post_id,author_comment_karma,author_link_karma,time_in_mins,post_is_original_content,post_name,post_num_comments,post_over_18,post_score,post_has_link,post_spoiler,post_stickied,subreddit_id,subreddit_name,subreddit_subscriber_count,post_title,post_upvote_ratio,post_url
uznoym,13709,21661,860,False,t3_uznoym,278,False,3309,False,False,False,386om,t5_386om,1232779,Nerd on Facebook wants everyone to know he’s not a nerd,0.96,https://i.redd.it/cs4cymlb18291.jpg
uzn3ky,784,6153,893,False,t3_uzn3ky,88,False,5246,False,False,False,2qh0u,t5_2qh0u,29007155,Jim Carrey And eddie murphy pose for a picture together while working in the same studio,0.96,https://i.redd.it/kp63rmrcv7291.jpg
uzl4f0,12634,3216643,1017,False,t3_uzl4f0,34,False,6450,False,False,False,2xqtc,t5_2xqtc,166110,Goth Girls,0.98,https://i.imgur.com/cJATVlq.jpeg
uznjk2,26564,92850,868,False,t3_uznjk2,57,False,3812,False,False,False,2r05i,t5_2r05i,6570505,Light field display made out of 16384 maps in item frames,0.99,https://v.redd.it/y8obdz7az7291
uzmi30,399,3059,927,False,t3_uzmi30,300,False,6644,False,False,False,2qi4s,t5_2qi4s,2234371,This happened to me when I was fighting Vader in Fallen Order! I wonder how that happened. 🤣,0.98,https://v.redd.it/uk6nfhz4p7291
uzmm00,693,8613,921,False,t3_uzmm00,539,False,3961,False,False,False,2w844,t5_2w844,2725867,"Instead of canceling $10,000 in student loans, wouldn't it be more helpful to change the interest rate to 0%?",0.95,https://www.reddit.com/r/NoStupidQuestions/comments/uzmm00/instead_of_canceling_10000_in_student_loans/
uzmlmo,38992,464973,922,False,t3_uzmlmo,33,False,4445,False,False,False,2tf0e,t5_2tf0e,465495,"Thank you, thank you",0.99,https://i.redd.it/95b9cz34q7291.gif
uzkkk7,123611,3254085,1058,False,t3_uzkkk7,763,False,8324,False,False,False,37bil,t5_37bil,835577,"Sure, Jesus would have LOVED owning an AR-15",0.84,https://i.redd.it/z5xlewgv17291.gif
uzlppw,925,9222,976,False,t3_uzlppw,71,False,6500,False,False,False,3f7q5,t5_3f7q5,1016724,cry about it,0.99,https://i.redd.it/rtlpb5zlg7291.gif
uzoa5c,17616,20963,829,False,t3_uzoa5c,456,False,2830,False,False,False,2qqcs,t5_2qqcs,350043,Please don’t make me carry a gun,0.92,https://www.reddit.com/r/Teachers/comments/uzoa5c/please_dont_make_me_carry_a_gun/
uzlf9l,21,3023,996,False,t3_uzlf9l,34,False,4966,False,False,False,3frqi,t5_3frqi,869476,Doggy Umbrella Dance,0.98,https://v.redd.it/f2q2e6hzc7291
uzhsic,0,6641,1272,False,t3_uzhsic,1214,False,45268,False,False,False,2s5oq,t5_2s5oq,20602517,LPT: in college it is much better to be friends with the people who have the party house than it is to live at the party house.,0.9,https://www.reddit.com/r/LifeProTips/comments/uzhsic/lpt_in_college_it_is_much_better_to_be_friends/
uzlmcn,4880,12081,982,False,t3_uzlmcn,902,False,5417,False,False,False,2si92,t5_2si92,1878509,Countries considered as electoral democracies by American organization freedom house. 2012 and 2022,0.9,https://i.redd.it/mmchksrhf7291.jpg
uzramu,1760,138167,676,False,t3_uzramu,113,False,3586,False,False,False,122hf1,t5_122hf1,1375299,The real Elden Lord,0.99,https://i.redd.it/ljhilr09y8291.jpg
uzm74b,0,3062,946,False,t3_uzm74b,74,False,10637,False,False,False,hw1ju,t5_hw1ju,3212474,cursed_encouragement,0.97,https://i.redd.it/klbw2m2xl7291.jpg
uzi5nz,6057,25708,1245,False,t3_uzi5nz,1012,False,17352,False,False,False,2tycb,t5_2tycb,16056913,1979 - Disco world championship,0.97,https://v.redd.it/wmqagpzj46291
uzqdc4,17334,4731796,722,False,t3_uzqdc4,85,False,1957,False,False,False,2xp2p,t5_2xp2p,3478542,Doggo almost drowns,0.95,https://v.redd.it/j9etcbhwp8291
uzkkru,44899,535017,1058,False,t3_uzkkru,446,False,6132,False,False,False,2qh4r,t5_2qh4r,1746740,BaCk tHe BlUe,0.92,https://i.redd.it/g8fjsgaz17291.jpg
uzmv4u,13359,71506,907,False,t3_uzmv4u,145,False,7132,False,False,False,2zmfe,t5_2zmfe,5634136,Title Deliberating...,0.96,https://i.imgur.com/XxhRHqU.png
uzp0du,40352,341343,790,False,t3_uzp0du,351,False,4923,False,False,False,2cneq,t5_2cneq,8063174,Americans Aren’t Numb to Mass Shootings: We’ve just become fatalistic about the possibility of politicians doing anything to stop them.,0.98,https://newrepublic.com/article/166615/americans-arent-numb-mass-shootings
uzo67i,5220,266135,846,False,t3_uzo67i,409,False,7300,False,False,False,2w67q,t5_2w67q,6257743,will never recover from that,0.97,https://v.redd.it/j01sy5sp58291
uzi1v6,4243,16345,1253,False,t3_uzi1v6,527,False,21676,False,False,False,2uao3,t5_2uao3,2743321,Assaulting someone,0.96,https://v.redd.it/54lqdci736291
uzl6i3,7095,27234,1014,False,t3_uzl6i3,82,False,5516,False,False,False,2rybx,t5_2rybx,1119217,Seems like Zuko taught Aang how to breakdance-fight. Who did it better?,0.98,https://v.redd.it/alzwaknq97291
uznq6x,29475,121931,858,False,t3_uznq6x,219,False,2896,False,False,False,5qpzgw,t5_5qpzgw,546933,Lmaoo they expect us to believe this?,0.98,https://i.redd.it/u08rqbco18291.jpg
uzkd6o,2048,7122,1075,False,t3_uzkd6o,220,False,6065,False,False,False,2s28b,t5_2s28b,752215,I honestly forgot how funny Rob Thomas and Sinbad are in this episode...,0.97,https://i.redd.it/p2u0yjt0z6291.jpg
uzlr6t,382573,531578,1042,False,t3_uzlr6t,168,False,5122,False,False,False,29numb,t5_29numb,769499,Ollie redebuts as HololiveEN,0.97,https://i.imgur.com/HRtvFhw.jpg
uzqblv,43,1572,725,False,t3_uzqblv,20,False,1898,False,False,False,2206u1,t5_2206u1,176350,The look when mom calls dad,0.99,https://v.redd.it/ujfwk0zgp8291
uzm4be,2309,62269,952,False,t3_uzm4be,292,False,4147,False,False,False,adf18,t5_adf18,558572,Boobs only exist to serve a man’s sexual pleasure,0.97,https://i.redd.it/ma6jnrh2l7291.jpg
uzlnie,7169,553579,981,False,t3_uzlnie,318,False,8029,False,False,False,2xxyj,t5_2xxyj,5090028,I was told this once in the Army and fully believe it,0.96,https://i.redd.it/t1ry6ervf7291.jpg
uzmt34,3890,6868,910,False,t3_uzmt34,54,False,3455,False,False,False,2wivw,t5_2wivw,128408,Liechtenstein Maritime Law,0.99,https://i.redd.it/x2m1unxas7291.jpg
uzotd5,5804,146288,801,False,t3_uzotd5,66,False,2390,False,False,False,2qh16,t5_2qh16,12084411,Instagram moderators say Iran offered them bribes to remove accounts,0.97,https://www.bbc.com/news/world-middle-east-61516126
uzn309,52,1607,895,False,t3_uzn309,108,False,3528,False,False,False,2p976a,t5_2p976a,249544,Find someone that look at you the way Conner and grant look at Joey 🙂,0.99,https://i.redd.it/5re72o96v7291.jpg
uzokqy,63055,269624,814,False,t3_uzokqy,1693,False,6685,False,False,False,2r5rp,t5_2r5rp,6279251,NRA: Mama didn’t raise a victim.,0.89,https://i.redd.it/fbtb7qoq98291.jpg
uzmpuf,746,2877,916,False,t3_uzmpuf,78,False,3510,False,False,False,2ro2c,t5_2ro2c,1760386,School's out! Time to take the train home~ (sound on!),0.99,https://v.redd.it/0z1ojm5si4291
uzm026,1036,3280,959,False,t3_uzm026,82,False,4054,False,False,False,2u0zn,t5_2u0zn,351936,Meds got me like,0.99,https://i.imgur.com/qvlZ3kK.jpg
uzp6l3,6837,7109,783,False,t3_uzp6l3,96,False,3451,False,False,False,3i60n,t5_3i60n,2085797,KENOBIIIII,0.99,https://i.redd.it/iyw5z1u9f8291.jpg
uzieeg,576915,10449985,1227,False,t3_uzieeg,1280,False,22105,False,False,False,dyqlw,t5_dyqlw,1035161,People like this are holding back the species.,0.86,https://i.redd.it/t29odfzg76291.jpg
uzno8r,3555,26991,862,False,t3_uzno8r,121,False,4104,False,False,False,2qh13,t5_2qh13,28913591,"Russian Lawmakers Tell Putin to Stop Ukraine War, Are Branded Traitors",0.97,https://www.businessinsider.com/russia-lawmakers-tell-stop-ukraine-war-branded-traitors-2022-5
uzlc4t,153976,336171,1003,False,t3_uzlc4t,44,False,4960,False,False,False,3x5kfw,t5_3x5kfw,95058,Got em,0.97,https://i.redd.it/7r6gqpi7v5291.jpg
uzl3k5,849,4720,1020,False,t3_uzl3k5,237,False,14096,False,False,False,2qimj,t5_2qimj,2133984,Monaco stabilized onboard,0.98,https://gfycat.com/dazzlingcomposedeyra
uzqp3x,167834,9370541,707,False,t3_uzqp3x,131,False,1795,False,False,False,346d4,t5_346d4,1429837,Health insurance in America,0.98,https://i.imgur.com/g8yYtYo.png
uzlt1m,0,2803,971,False,t3_uzlt1m,75,True,4960,False,True,False,2titf,t5_2titf,789251,literally.,0.98,https://i.redd.it/sxwkkvroh7291.gif
uzpdl7,4650,10089,773,False,t3_uzpdl7,118,False,2179,False,False,False,2qixk,t5_2qixk,1247073,seriously it gets annoying sometimes,0.92,https://i.redd.it/wjjkihvzg8291.gif
uznlsh,11858,12389,866,False,t3_uznlsh,55,False,2915,False,False,False,2qiqi,t5_2qiqi,1249991,Saw this charming van on my way in to work yesterday,0.99,https://i.redd.it/g78j7l2g08291.jpg
uzse3d,16070,18919,622,False,t3_uzse3d,22,False,1342,False,False,False,2v1zrq,t5_2v1zrq,97044,BE INFORMED PLEASE,0.99,https://i.redd.it/grknf9mu79291.jpg
uznxum,105491,27214,848,False,t3_uznxum,18,False,2819,False,False,False,3i7or,t5_3i7or,239782,I was reading some of the tie-in comics... and holy shit Derpy Suki is the ultimate meme format.,0.97,https://i.redd.it/k5y78onn38291.png
uzjmms,6756,377406,1133,False,t3_uzjmms,330,False,17919,False,False,False,3gdh7,t5_3gdh7,6856350,🔥 The mother of all snapping turtles,0.96,https://v.redd.it/z3laymlmo6291
uzr4uo,5488,7017,685,False,t3_uzr4uo,10,False,1704,False,False,False,3m0tc,t5_3m0tc,3601613,Title,0.95,https://i.redd.it/1hhrd9nsw8291.gif
uztupl,312628,98100,546,False,t3_uztupl,89,False,1039,False,False,False,2qn0o,t5_2qn0o,381850,Nonsense for UEFA to suggest this is down to fans arriving late. I know LFC fans who arrived at Stade de France two and a half hours ago and have only just got inside the ground. Complete lack of organisation. Dangerous bottlenecks.,0.99,https://twitter.com/JamesPearceLFC/status/1530625386152972292?t=DwmXXT8j41oynIWui8aYCg&s=19
uzn0zs,73678,1462048,994,False,t3_uzn0zs,112,False,12295,False,False,False,2uqcm,t5_2uqcm,5509380,An Aussie entertaining a quokka,0.99,https://v.redd.it/r8o007mku7291
uzoo7g,1452,2025,809,False,t3_uzoo7g,97,False,2395,False,False,False,3ju96,t5_3ju96,110904,not a happy bunny,0.99,https://i.redd.it/zon3nycla8291.gif
uzpxjw,51458,93937,745,False,t3_uzpxjw,36,False,4389,False,False,False,2qh03,t5_2qh03,32967733,"Hey, I'm trying...",0.98,https://i.redd.it/g4jax1c1l8291.gif
uzl33b,12636,3216781,1021,False,t3_uzl33b,33,False,4744,False,False,False,30wnn,t5_30wnn,904738,Dogs are the best people.,0.97,https://i.imgur.com/UzY4cNJ.gifv
uzj16l,12364,305639,1179,False,t3_uzj16l,178,False,11747,False,False,False,3mj3w,t5_3mj3w,823055,"In Morbius (2022), Matt Smith is seen dancing to a song that says ""Have sex"", which is what Morbius fans largely do during their free time. Very cool of the movie to acknowledge this in such a subtle but direct way",0.96,https://i.redd.it/zg3y256lg6291.png
uzoc4d,14,1618,827,False,t3_uzoc4d,39,False,2504,False,False,False,2qhm7,t5_2qhm7,870032,"Made it around 2 years ago, still works excellent",0.97,https://v.redd.it/uk2l5j6e78291
uzsktk,1381,170210,613,False,t3_uzsktk,46,False,2155,False,False,False,43zwn1,t5_43zwn1,787955,MOST ANTICIPATED EARNINGS,0.99,https://i.redd.it/ioazqqco99291.jpg
uznu4t,20,2267,854,False,t3_uznu4t,93,False,3027,False,False,False,45oerd,t5_45oerd,51897,Epic 💯,0.91,https://v.redd.it/7d4tl2er28291
uznury,85684,14137,852,False,t3_uznury,93,False,2769,False,False,False,2qvp9,t5_2qvp9,3291630,A poster that I finished recently. All freehand.,0.98,https://i.imgur.com/nRibprG.jpg
uzqzye,146,2028,692,False,t3_uzqzye,682,False,3351,False,False,False,2qh33,t5_2qh33,40818966,My 37 year old friend finally got laid so we went to the clubs to celebrate,0.9,https://i.redd.it/te28jl5jv8291.jpg
uzstt6,73678,1457590,600,False,t3_uzstt6,186,False,2489,False,False,False,m0bnr,t5_m0bnr,6230000,"This boy's parents were worried he'd be lonely on his birthday as they had recently moved, so they asked if people could send him cards. Ryan Reynolds found out and he did the most Ryan Reynolds thing ever. This was the boy's reaction.",0.97,https://v.redd.it/cus0mhnrb9291
uznpll,50539,2661479,861,False,t3_uznpll,12,False,4794,False,False,False,2vegg,t5_2vegg,5817075,me_irl,0.99,https://i.redd.it/pkjxlc5i18291.gif
uzn37t,3136,123473,896,False,t3_uzn37t,84,False,3087,False,False,False,2zij4,t5_2zij4,841006,Quite the cat-like reflexes. Saved her life…,0.97,https://v.redd.it/n84cnbz8v7291
uzp4rm,42345,22920,786,False,t3_uzp4rm,24,False,2237,False,False,False,48t85,t5_48t85,2143982,Teal'c doesn't taser moms.,0.99,https://i.redd.it/2b1ih1vte8291.jpg
uzt7ud,272340,93398,580,False,t3_uzt7ud,110,False,1130,False,False,False,2qm7u,t5_2qm7u,1953786,[Highlight] Mike Trout rips a homer off Beckham Aaron Trout,0.99,https://v.redd.it/irfi2j7kf9291
uzr0jb,304177,465695,692,False,t3_uzr0jb,28,False,3991,False,False,False,2qjpg,t5_2qjpg,19064599,Is ludio ludius est.,0.99,https://i.redd.it/l3zs4fhov8291.jpg
uzn2de,5522,15984,897,False,t3_uzn2de,20,False,6731,False,False,False,2usxq,t5_2usxq,1626101,dirk sols,0.99,https://i.redd.it/f3njaz7tu7291.gif
uzpro2,1326,4982,754,False,t3_uzpro2,9,False,1945,False,False,False,3on1q,t5_3on1q,726766,yeah same honestly,0.98,https://i.redd.it/j23wi1imk8291.jpg
uzkkry,408,46107,1060,False,t3_uzkkry,48,False,5506,False,False,False,2qh7a,t5_2qh7a,20696165,"Summer daydream, me, digital, 2022",0.98,https://i.redd.it/7rtzjt4z17291.gif
uzp7lh,1840,17975,782,False,t3_uzp7lh,32,False,4675,False,False,False,3ndbi,t5_3ndbi,580728,Now try not to bin in the race tomorrow please,0.99,https://i.redd.it/7qb6ft2if8291.gif
uznkzu,4726,2809,868,False,t3_uznkzu,29,False,2865,False,False,False,3jwwf,t5_3jwwf,858277,It's not every day you meet a famous fella such as Saul,0.98,https://i.redd.it/7g4wshw808291.jpg
uzmypo,343,3149,903,False,t3_uzmypo,682,False,3383,False,False,False,2ssp7,t5_2ssp7,1674337,Why is it when Ukrainians are defending their countries against Russians they are labeled “heroes” but when Palestinians defend their land against zionists they are labeled “terrorists” ?,0.77,https://www.reddit.com/r/TooAfraidToAsk/comments/uzmypo/why_is_it_when_ukrainians_are_defending_their/
uznjtk,24639,178035,870,False,t3_uznjtk,495,False,4329,False,False,False,3ipa1,t5_3ipa1,545938,Everyone loves hearing statements about guns made by people who don't know anything about guns.,0.92,https://i.redd.it/jrw8gw2yz7291.jpg
uzn8zc,74,2749,887,False,t3_uzn8zc,1438,False,3307,False,False,False,rgzzt,t5_rgzzt,2081754,bruh IDC what yall think it shouldnt be like to this,0.78,https://i.redd.it/6ll84hcvw7291.jpg
uzocio,119626,143619,827,False,t3_uzocio,186,False,2384,False,False,False,3ilna,t5_3ilna,261090,"sorry, i'm chaosblind",0.97,https://i.redd.it/rivjojsa68291.png
uzlbk9,26,2558,1005,False,t3_uzlbk9,51,False,4608,False,False,False,3egn8,t5_3egn8,870147,Solid Teamwork,0.98,https://v.redd.it/c3wfbz1sb7291
uzlv58,18078,21253,969,False,t3_uzlv58,106,False,3800,False,False,False,2xp02,t5_2xp02,886744,Does this count? Source:CNN,0.95,https://i.redd.it/3j4hup3ci7291.jpg
uznvp9,316,2594,852,False,t3_uznvp9,172,False,3897,False,False,False,363r3,t5_363r3,3650746,Uno Reverso,0.95,https://v.redd.it/4lmwz1a438291
uzofnw,2265,6558,823,False,t3_uzofnw,33,False,3590,False,False,False,2ubgg,t5_2ubgg,4276264,Mildly_historical But infuriating,0.98,https://i.redd.it/uz1grqke88291.jpg
uzlq5l,1334,3135,977,True,t3_uzlq5l,52,False,3983,False,True,False,2rfz5,t5_2rfz5,1108909,Luffy be like (Chapter 1050 spoilers),0.96,https://i.redd.it/v9ppt6odg7291.gif
uznibm,12624,59259,872,False,t3_uznibm,37,False,2681,False,False,False,jzp47,t5_jzp47,577881,"She scream, she raise hell, but most importantly she heckin' YELLS.",0.99,https://v.redd.it/hbrm2madz7291
uzltsj,511,13717,971,True,t3_uzltsj,20,False,4047,False,False,False,35gpe,t5_35gpe,329654,Fast Travel in GameBoy style OC,0.98,https://i.redd.it/i6uea5fxh7291.gif
uzpxat,24819,129384,746,False,t3_uzpxat,78,False,1842,False,False,False,33ebbv,t5_33ebbv,65216,minecraft Sweden comments,0.98,https://v.redd.it/kffn0230m8291
uzmqqh,348,4396,916,False,t3_uzmqqh,25,False,3070,False,False,False,39inp,t5_39inp,551802,I think my mom’s cat might need an exorcism,0.99,https://i.redd.it/3z7p3eyqr7291.jpg
ufd2z6,460,304548,1277,False,t3_ufd2z6,8,False,8901,False,False,False,2s3v4,t5_2s3v4,289839,NBA Playoffs 2022 Predictions Tournament,0.95,https://reddit.com/r/sportsbook/predictions?tournament=tnmt-65c6ef48-f3f9-44f2-9313-5cea573ab9eb
uzqa3d,544,11309,729,False,t3_uzqa3d,120,True,2494,False,False,False,r1l2z,t5_r1l2z,1561212,"Thanks, I hate aqua-assault",0.93,https://v.redd.it/sofp6nh4p8291
uzr672,284318,133314,684,False,t3_uzr672,46,False,1480,False,False,False,34o9s,t5_34o9s,3168185,Exclusive Resort Starter Pack,0.99,https://i.redd.it/vrqtd4w4x8291.jpg
uzqb2a,17334,4732063,728,False,t3_uzqb2a,17,False,1693,False,False,False,2ugf9,t5_2ugf9,2244981,Armed Robbery FAIL in New Orleans,0.96,https://i.imgur.com/LXqKBtV.gifv
uzrfkg,10440,13740,671,False,t3_uzrfkg,27,False,1391,False,False,False,3cb2g,t5_3cb2g,594451,I built Spirit in Minecraft,0.98,https://i.redd.it/tv46ya9gz8291.png
uzo88u,210,5972,835,False,t3_uzo88u,300,False,3427,False,False,False,3nasz,t5_3nasz,1881727,Chav Pulls Knife Out And Gets Leathered,0.98,https://v.redd.it/b1dq8cid68291
uzob61,412,8989,830,False,t3_uzob61,64,False,2375,False,False,False,27uuuy,t5_27uuuy,583094,Russian Fishing,0.94,https://v.redd.it/wjqevbo378291
uzskyp,1038,786,615,False,t3_uzskyp,12,False,1172,False,False,False,3blco,t5_3blco,1813813,CaT tRapPed tO SuFfocaTe aNd DiE,0.99,https://v.redd.it/frj0kj4i99291
uzkjrg,5193,28432,1065,False,t3_uzkjrg,72,False,5453,False,False,False,2vm97,t5_2vm97,748481,Sorry Garou but therapy ain't cheap,0.98,https://i.imgur.com/5Kd6MwY.jpg
uzjw3e,212,4186,1116,False,t3_uzjw3e,107,False,6634,False,False,False,2s837,t5_2s837,1314706,Skyrim Up Down Up Down,0.97,https://i.redd.it/vlple43p13291.gif
uzp4la,5009,25833,789,False,t3_uzp4la,133,False,2014,False,False,False,2wzm6,t5_2wzm6,362356,Reva is decent but she's kind of a discount version of Trilla. (OC),0.97,https://i.redd.it/kt4ce1jre8291.png
uznxa2,938,10545,852,False,t3_uznxa2,49,False,2495,False,False,False,gdma4,t5_gdma4,250668,Some may need to be changed.,0.97,https://i.redd.it/vsjb9b4l38291.jpg
uzkhxd,8004,6716,1070,False,t3_uzkhxd,1865,False,12178,False,False,False,2th52,t5_2th52,12186595,Bill Gates bag holding Tesla at negative 2 billion,0.84,https://i.redd.it/mya25jxtz6291.png
uziwvw,313,9121,1240,False,t3_uziwvw,356,False,25423,False,False,False,2x2oy,t5_2x2oy,6245820,Trying to take someone's phone,0.95,https://v.redd.it/54lqdci736291
uzr8vh,16945,35335,684,False,t3_uzr8vh,28,False,1371,False,False,False,2s7yh,t5_2s7yh,176638,The YouTube algorithms really struck gold on this one,0.98,https://i.redd.it/jgbiy643x8291.png
uzp68a,23748,61144,789,False,t3_uzp68a,255,False,1972,False,False,False,2xrd1,t5_2xrd1,1220020,imagine if this was a thing and everyone could your custom playlist,0.95,https://i.redd.it/e67f7xt5f8291.png
uzt2ne,17334,4732544,593,True,t3_uzt2ne,99,False,1053,False,False,False,2rd9v,t5_2rd9v,4209970,This absolute unit of a hot dog (20 inches),0.94,https://i.imgur.com/vDbO5t4.gifv
uzl1wm,273,37595,1029,False,t3_uzl1wm,47,False,4165,False,False,False,2rh53,t5_2rh53,618518,"Congratulations! You took a bath today. You did it, even if it's a chore.",0.96,https://i.redd.it/1zelmg6d87291.jpg
uzlss1,14307,2723,978,False,t3_uzlss1,114,False,3882,False,False,False,37k29,t5_37k29,424170,ich🎶iel,0.98,https://i.redd.it/96d4o9fmh7291.jpg
uzqrgr,1139,10595,711,False,t3_uzqrgr,12,False,1468,False,False,False,305li,t5_305li,826710,Ozzy enjoying some pool time!,0.99,https://i.redd.it/y7ztzdsct8291.jpg
uzo825,9274,60596,840,False,t3_uzo825,19,True,3381,False,False,False,12p4l2,t5_12p4l2,1481104,Ideal summer for Eula?,0.96,https://i.redd.it/o6gdqiro48291.png
uzo8o2,22410,17524,839,False,t3_uzo8o2,255,False,2241,False,False,False,2qh1e,t5_2qh1e,26442763,How Dog Breeds React to Robbers,0.83,https://youtu.be/Gwz1mo99MRQ
uzkunl,22194,11068,1045,False,t3_uzkunl,88,False,4375,False,False,False,2s3nb,t5_2s3nb,15949233,"[WP] You have lived an unimpressive life, and died an unimpressive death. Surprisingly, Odin welcomes you into Valhalla, citing the many battles with depression you fought.",0.94,https://www.reddit.com/r/WritingPrompts/comments/uzkunl/wp_you_have_lived_an_unimpressive_life_and_died/
uznho7,27402,41661,879,False,t3_uznho7,77,False,2473,False,False,False,2v70p,t5_2v70p,1289027,The salon of my 33' sailboat,0.96,https://i.redd.it/1gufpgpbz7291.jpg
uzu4v4,295,741,539,False,t3_uzu4v4,11,False,879,False,False,False,3i3vm,t5_3i3vm,306280,anon accidentally saves his dad,0.98,https://i.redd.it/5rqrupohs7291.png
uznzkk,4990,7433,853,False,t3_uznzkk,162,False,2297,False,False,False,2vq0w,t5_2vq0w,2546613,The enemy density this season is fantastic,0.96,https://www.reddit.com/r/DestinyTheGame/comments/uznzkk/the_enemy_density_this_season_is_fantastic/
uzpd13,525,2096,781,False,t3_uzpd13,395,False,1822,False,False,False,2wbww,t5_2wbww,650103,I hate slayer,0.94,https://www.reddit.com/r/2007scape/comments/uzpd13/i_hate_slayer/
uzq5op,265427,640157,741,False,t3_uzq5op,419,False,2285,False,False,False,2yrq6,t5_2yrq6,4021602,The full video of the interaction with Ted Cruz in the restaurant.,0.95,https://v.redd.it/zvar9z2vn8291
uznl6a,2410,56853,874,False,t3_uznl6a,6,False,2432,False,False,False,36w5l,t5_36w5l,422894,meow_irl,0.98,https://i.redd.it/ojulklea08291.jpg
uzlcfb,8931,136750,1010,False,t3_uzlcfb,80,False,3995,False,False,False,2we4j,t5_2we4j,745485,no one needs to know,0.99,https://i.redd.it/6m4288p3c7291.jpg
uzmmkb,5411,158457,929,False,t3_uzmmkb,33,False,5459,False,False,False,23gidu,t5_23gidu,385692,Mom is not a gamer 😡,0.99,https://i.redd.it/0b0qlzgdq7291.gif
uzqujv,43159,17668,707,False,t3_uzqujv,160,False,2056,False,False,False,2qhta,t5_2qhta,3527332,My girlfriend's car LOVES to be stretched.,0.94,https://v.redd.it/pxxhpcp4u8291
uzklff,207982,106552,1065,False,t3_uzklff,259,False,7296,False,False,False,2uii8,t5_2uii8,2602782,Xochitl Gomez (America Chavez) and Iman Vellani (Kamala Khan) hanging out,0.94,https://i.redd.it/n7iqv2j727291.jpg
uzr977,159164,100076,686,False,t3_uzr977,62,False,1330,False,False,False,2xwua,t5_2xwua,542475,Superior Soviet engineering,0.97,https://v.redd.it/76iplg3sx8291
uzoiyu,165,256652,824,False,t3_uzoiyu,20,False,2058,False,False,False,2yo2z,t5_2yo2z,2698228,The hoverboard remains undefeated,0.98,https://v.redd.it/39p3zes798291
uzrtvw,10471,9006,658,False,t3_uzrtvw,84,False,1253,False,False,False,2qka0,t5_2qka0,740139,charlie just put out a video about #savetf2,0.98,https://i.redd.it/v7691pwu29291.png
uzmc77,3924,146888,946,False,t3_uzmc77,161,False,3147,False,False,False,31d92,t5_31d92,119396,Imagine waking up seeing the ocean at your bedroom window,0.97,https://v.redd.it/66d3t9ugn7291
uzr4qj,90048,662291,693,False,t3_uzr4qj,26,False,1352,False,False,False,46tcaa,t5_46tcaa,124835,Some people eat snails,0.96,https://v.redd.it/iublexupw8291
uzgyav,4804,172672,1342,False,t3_uzgyav,169,False,23985,False,False,False,2u2bh,t5_2u2bh,3837924,Caricaturist does not hold back,0.95,https://v.redd.it/8coapp3to5291
uzmksc,2048,1561,932,False,t3_uzmksc,235,False,2808,False,False,False,30hhs,t5_30hhs,353808,"Big Blow To Chinese & Russian Air Force As Their ‘Most Advanced’ Fighter Jet Is Being Decoded By US, UK Scientists",0.97,https://eurasiantimes.com/big-blow-to-chinese-russian-air-force-fighter-jet-uk-us/
uzono3,1393,29536,817,False,t3_uzono3,367,False,2782,False,False,False,2qqjc,t5_2qqjc,27708566,"TIL AirPods are ""difficult if not impossible"" to recycle and not designed to be repairable.",0.94,https://en.wikipedia.org/wiki/AirPods#Criticism
uzovjp,4488,1132,806,True,t3_uzovjp,38,False,1882,False,False,False,2qh55,t5_2qh55,22524988,[I ate] A Stromboli from a family owned pizza shop,0.98,https://i.redd.it/h5xk3utjc8291.jpg
uzphda,49331,71892,776,False,t3_uzphda,69,False,1732,False,False,False,2qhh7,t5_2qhh7,900960,"You heard it here first folks, the internet funnyman himself said it",0.99,https://i.redd.it/yyacyudzh8291.jpg
uzp75q,142,1274,790,True,t3_uzp75q,36,False,1776,False,False,False,3boqz,t5_3boqz,2127749,Boiler room office space,0.98,https://www.reddit.com/r/MaliciousCompliance/comments/uzp75q/boiler_room_office_space/
uzi3yo,270,7785,1258,False,t3_uzi3yo,136,False,9954,False,False,False,233jor,t5_233jor,460720,this empty beach me & my girlfriend saw while taking a walk last night,0.98,https://i.redd.it/2vyxzjzu36291.jpg
uzprdo,6099,223463,761,False,t3_uzprdo,98,False,2325,False,False,False,2qh61,t5_2qh61,6813561,This train.,0.94,https://i.redd.it/u309n0ljk8291.png
uzopkj,-1,1583,815,False,t3_uzopkj,177,False,1927,False,False,False,2qq6g,t5_2qq6g,938976,I’m telling my mom I’ll be taking off my hijab tomorrow,0.96,https://www.reddit.com/r/confessions/comments/uzopkj/im_telling_my_mom_ill_be_taking_off_my_hijab/
uzm4q0,16668,3033,960,False,t3_uzm4q0,397,False,3057,False,False,False,2s4tv,t5_2s4tv,771627,Texas Cops Are Cowards,0.93,https://i.redd.it/azsm79j641291.gif
uzoehf,6748,504030,831,False,t3_uzoehf,86,False,2005,False,False,True,2vxxc,t5_2vxxc,1918010,Capitol rioter who sported a Hitler mustache is convicted of all 5 charges against him (he tried to convince the jury that he didn't know the Capitol building is where Congress meets),0.96,https://deadstate.org/hitler-loving-capitol-rioter-is-convicted-of-all-5-charges-against-him/
uztjno,2335,12806,570,False,t3_uztjno,106,False,899,False,True,False,3l2acu,t5_3l2acu,247530,Ushi voice-line,0.97,https://v.redd.it/31oug90ni9291
uzkatd,2527,4599,1089,False,t3_uzkatd,96,False,4597,False,False,False,2r9vp,t5_2r9vp,1856996,Oh no what now,0.97,https://i.redd.it/ftpq6fq2y6291.jpg
uzqh2o,64749,60144,726,False,t3_uzqh2o,16,False,1453,False,False,False,2wi6h,t5_2wi6h,145727,How it feels finding a Shrine of Chance,0.99,https://i.imgur.com/GLwd4kh.jpg
uzirex,880,153663,1208,False,t3_uzirex,58,False,8145,False,False,False,3gl3k,t5_3gl3k,1502606,Invest in Law Enforcement,0.95,https://i.redd.it/vp3ele7sc6291.gif
