post_id,author_comment_karma,author_link_karma,time_in_mins,post_is_original_content,post_name,post_num_comments,post_over_18,post_score,post_has_link,post_spoiler,post_stickied,subreddit_id,subreddit_name,subreddit_subscriber_count,post_title,post_upvote_ratio,post_url
uz3wux,2003,12125,972,False,t3_uz3wux,28,False,646,False,False,False,11kimd,t5_11kimd,202972,Weird stairs in the backrooms 🤔,0.98,https://v.redd.it/iu46dqfn42291
uz77l5,1013,32498,816,False,t3_uz77l5,185,False,401,False,False,False,3hksc,t5_3hksc,154477,mejor me vuelvo,0.97,https://v.redd.it/oyqf6i1zw2291
uz159w,159,666,1104,False,t3_uz159w,38,False,963,False,False,False,2tsd7,t5_2tsd7,117756,The winspiracy goes deep,0.98,https://i.redd.it/fi6uabv6i1291.png
uz5y7g,3746,125098,881,False,t3_uz5y7g,53,False,974,False,False,False,313fb,t5_313fb,2439433,"The Virgin Mary punching the devil in the face, 'The De Brailes Hours', Oxford ca. 1240. [1162x1137]",0.99,https://i.redd.it/580vg9ghm2291.jpg
uz81ti,987,430,773,False,t3_uz81ti,2,False,357,False,False,False,2v4o7,t5_2v4o7,186175,Of course the bear plays the horn,0.97,https://v.redd.it/xxezdhwfw0291
uyu9r5,194,4350,60,False,t3_uyu9r5,2766,False,10597,False,False,False,2ssp7,t5_2ssp7,1673566,Is it wrong to be upset my fiance wants a open relationship?,0.89,https://www.reddit.com/r/TooAfraidToAsk/comments/uyu9r5/is_it_wrong_to_be_upset_my_fiance_wants_a_open/
uz82v3,10449,9008,772,False,t3_uz82v3,59,False,355,False,False,False,fx5gt,t5_fx5gt,111002,Extra beef on the side,0.98,https://v.redd.it/uzxxde8t43291
uz3rgc,5451,52245,1079,False,t3_uz3rgc,32,False,775,False,False,False,3f1fs,t5_3f1fs,220704,I'm in love with Tobey Maguire's Spiderman suit. What y'all think of these shots ?,0.99,https://www.reddit.com/gallery/uz3rgc
uz4nne,7518,9894,938,False,t3_uz4nne,34,True,579,False,False,False,2zkms,t5_2zkms,263669,Soft tissue tumor the was unexpected in a routine bunionectomy,0.99,https://i.redd.it/o5lcpw5eb2291.jpg
uz6u99,7360,10396,835,False,t3_uz6u99,12,False,423,False,False,False,3ij6j,t5_3ij6j,50775,"Shoutout to Desert Scourge, gotta be one of my favourite calamity bosses!",1.0,https://v.redd.it/2r5aycp1u2291
uz06m3,32480,8959,1150,False,t3_uz06m3,62,False,1109,False,False,False,w0jc9,t5_w0jc9,42786,"Murphys Law but human edition. Do not bore the human , capitans, for there shall be disastrous consequences.",0.99,https://i.redd.it/s0fm34qt91291.jpg
uzb9ll,18480,13895,613,False,t3_uzb9ll,29,False,219,False,False,False,2tfgu,t5_2tfgu,78110,"O drama que vive a Roma, estádio aos pedaços...",0.99,https://i.redd.it/ko9zeuyvx3291.jpg
uz0wmu,278,3782,1312,False,t3_uz0wmu,67,False,1483,False,False,False,22y335,t5_22y335,212452,sajish,0.98,https://v.redd.it/0nb6cwm6g1291
uz27ht,275,661,1057,False,t3_uz27ht,8,False,830,False,False,False,31xdu,t5_31xdu,332169,AAAAAAAAAAAAAAAAA,0.99,https://i.redd.it/f8bis7e7g0291.jpg
uyyat1,54077,7639,1244,False,t3_uyyat1,156,False,1475,False,False,False,2qhbe,t5_2qhbe,2237939,"Made this in the air fryer I snuck in to my motel room. Their continental breakfast is juice and fruit loops so I was like yeah I can do better. Egg, bread, slice of cheese. Turkey bacon.",0.84,https://i.redd.it/n94v0kdkt0291.jpg
uz08u6,61400,22057,1149,False,t3_uz08u6,36,False,1102,False,False,False,2sfg5,t5_2sfg5,742550,Why's the wifi signal so weak?,0.98,https://www.reddit.com/r/talesfromtechsupport/comments/uz08u6/whys_the_wifi_signal_so_weak/
uyxxql,10319,141096,1263,False,t3_uyxxql,131,False,1570,False,False,False,2robf,t5_2robf,278402,"Seriously, why?",0.98,https://i.redd.it/wn8ol337q0291.jpg
uz2zrd,11027,92440,1021,False,t3_uz2zrd,40,False,735,False,False,False,427he1,t5_427he1,37962,Orban's 2050 goal,0.98,https://i.redd.it/is9gzlobx1291.jpg
uyxnyz,40072,193813,1277,False,t3_uyxnyz,90,False,1651,False,False,False,2ug54,t5_2ug54,292171,Remember back in earlier Horizon games when street races... felt like actual street races?,0.97,https://v.redd.it/mywmvo2dn0291
uz8or8,5475,5130,748,False,t3_uz8or8,15,False,317,False,False,False,51kvw0,t5_51kvw0,60237,Bob Lazar showing his invention that could have changed the world...,0.97,https://v.redd.it/hldgv5dwz2291
uz4tk6,169330,70106,935,False,t3_uz4tk6,95,False,558,False,False,False,2qqd4,t5_2qqd4,254732,I've been told my collection is too large. I disagree. Thoguhts?,0.96,https://i.redd.it/vt24qaoqc2291.jpg
uz80bp,45024,112418,781,False,t3_uz80bp,2,False,352,False,False,False,2tsod,t5_2tsod,366175,MRW I'm at a restaurant with a teenage witch but she's taking too long admiring the food she ordered,0.97,https://i.imgur.com/SJS4VRh.gifv
uz7cfv,2241,1224,813,False,t3_uz7cfv,281,False,389,False,False,False,2qnp7,t5_2qnp7,699913,Broadcom to 'focus on rapid transition to subscriptions' for VMware,0.98,https://www.reddit.com/r/sysadmin/comments/uz7cfv/broadcom_to_focus_on_rapid_transition_to/
uz06wd,839,15879,1152,False,t3_uz06wd,39,False,1090,False,False,False,xko8j,t5_xko8j,36755,"And that's a wrap. After working on this for 1 year and 5 months it's finally finished with 400 days of progress and 128,164 stitches in total. Now it's time to get this bad boy framed and hung on the wall!",0.99,https://i.redd.it/4qd6lim1a1291.jpg
uz34k4,1693,1389,1016,False,t3_uz34k4,57,False,791,False,False,False,3ph1a,t5_3ph1a,103968,For those who don’t have the twitter,0.99,https://i.redd.it/7k7w14zey1291.jpg
uz6b0y,18,8219,864,False,t3_uz6b0y,7,False,452,False,False,False,3fgez,t5_3fgez,83315,Lasagna,0.99,https://v.redd.it/aq0u8uzip2291
uzbkcv,223974,435634,599,False,t3_uzbkcv,204,False,861,False,False,False,2yo6b,t5_2yo6b,2324610,This has “Dont Go In There” vibes,0.99,https://v.redd.it/9ng168tp04291
uz4vyn,13,337,932,False,t3_uz4vyn,9,True,554,False,False,False,398od,t5_398od,85431,Kentucky Mario faked his death,0.99,https://i.redd.it/304t661ed2291.jpg
uz4phs,1880,28232,941,False,t3_uz4phs,18,False,568,False,False,False,2s5ei,t5_2s5ei,390592,Chickpea Spinach Curry,0.97,https://i.redd.it/yr53yv0sb2291.jpg
uz7w69,2517,14747,787,False,t3_uz7w69,38,False,726,False,False,False,2sczp,t5_2sczp,607993,Another Lydia Naomi Bubble Frock with some self drafted details added. 🦇🫧,0.99,https://www.reddit.com/gallery/uz7w69
uz8ght,145,10716,760,False,t3_uz8ght,1,False,324,False,False,False,2v5sp,t5_2v5sp,120066,Her smile,0.99,https://i.redd.it/t1awpf6283291.jpg
uz5f6v,38869,52215,907,False,t3_uz5f6v,13,False,506,False,False,False,2u1gx,t5_2u1gx,27245,Flames fans right now,0.98,https://i.redd.it/bl7y7ijvh2291.png
uz9awf,2953,853,718,False,t3_uz9awf,9,False,589,False,False,False,39inp,t5_39inp,551199,My lil Tina,1.0,https://i.redd.it/k2sagyujf3291.jpg
uz26e6,30158,224223,1264,False,t3_uz26e6,23,True,2268,False,True,False,3c02n,t5_3c02n,287472,Don't mind me,0.99,https://i.redd.it/obj021cjq1291.jpg
uz198u,11583,5678,1201,False,t3_uz198u,82,False,1006,False,False,False,2rrim,t5_2rrim,96540,I’ve heard all of this said unironically,0.96,https://i.redd.it/0ilu6y75j1291.jpg
uz451h,134,1076,1061,False,t3_uz451h,83,False,1710,False,False,False,2xp2p,t5_2xp2p,3477261,Crazy way to cross a bridge,0.93,https://v.redd.it/3f4fg8oq62291
uyz4xe,19789,71671,1203,False,t3_uyz4xe,6,False,1261,False,False,False,3k32c,t5_3k32c,377450,d’awwww!,0.99,https://v.redd.it/zlw1zcyhxw191
uz6f1m,39,180,858,False,t3_uz6f1m,25,False,445,False,False,False,2zqih,t5_2zqih,412533,A Complete Guide to BTS’ Discography - A helpful and extensive guide to help new fans and old discover their wide range of music (Up-to-date as of May 2022),0.98,https://i.redd.it/433h3e7kq2291.jpg
uytv1w,87,2139,91,False,t3_uytv1w,875,False,3566,False,False,False,2qpoo,t5_2qpoo,213566,Mauler and Rush of Hot 89.9 are total scumbags,0.94,https://www.reddit.com/gallery/uytv1w
uz4mwk,2482,2467,945,False,t3_uz4mwk,42,False,1162,False,False,False,3iufz,t5_3iufz,186633,This Whole Sub...,0.93,https://i.redd.it/oo4xy787b2291.gif
uz7jjj,74,1196,804,False,t3_uz7jjj,14,False,371,False,False,False,2rfjf,t5_2rfjf,158593,Maynard’s the man..,0.98,https://i.redd.it/42sede6903291.jpg
uz8whq,338745,419309,738,False,t3_uz8whq,344,False,621,False,False,False,2qho4,t5_2qho4,439059,"At the NRA convention, Ted Cruz says the reasons for mass shootings are absent fathers, declining church attendance, social media, and video games.",0.89,https://v.redd.it/ez49u2z0c3291
uz8q9c,2945,1124,747,False,t3_uz8q9c,23,False,311,False,False,False,2vu7a,t5_2vu7a,42368,STOP THE MADNESS,0.99,https://i.redd.it/7xi0rnai93291.jpg
uz2slk,174,7266,1032,False,t3_uz2slk,80,False,745,False,False,False,to643,t5_to643,131258,does this qualify?,0.96,https://i.redd.it/cgkosc3pv1291.jpg
uyyih6,3212,36926,1234,False,t3_uyyih6,19,False,3056,False,False,False,3i7or,t5_3i7or,239766,"Guys, I think something is wrong with my copy of The Legend of Korra",0.99,https://i.redd.it/xt1olvrjv0291.png
uz5wql,782,1029,883,False,t3_uz5wql,10,False,479,False,False,False,xnz2i,t5_xnz2i,58856,My spouse made this and wanted me to post it. 😬,0.99,https://i.redd.it/3mmcl5c5m2291.jpg
uz3kip,687,41682,995,False,t3_uz3kip,7,False,1355,False,False,False,2rn7o,t5_2rn7o,942616,Tom & Jerry,0.99,https://i.redd.it/t04xk61622291.jpg
uza2uh,4078,17212,679,False,t3_uza2uh,6,False,252,False,False,False,2tt9j,t5_2tt9j,48049,“Kickitty-kickitty-kickitty-kickitty-KICK-KICK-KICK-KICK-KICK”,1.0,https://v.redd.it/gx55i95mm3291
uz4abv,267,494,963,False,t3_uz4abv,119,False,606,False,False,False,2s1ie,t5_2s1ie,144012,"The Allen key set of Theseus- if every key has been replaced at one point with a new key, and once the case gives out and is replaced as needed. Is it still the same key set I’ve had all these years??",0.99,https://i.redd.it/r64hldh682291.jpg
uz4n06,27719,75741,945,False,t3_uz4n06,99,False,1609,False,False,False,3sulg5,t5_3sulg5,467456,"180,380,000 Shares on Loan!!!! The shorts just WON'T STOP. 34.9% of All AMC SHARES are ON LOAN!!!! 🚀 👩‍🚀 🚀 👩‍🚀 🚀 👨‍🚀 🚀 👩‍🚀 🚀 🍿 🍿 🍿 Let's go!!!!",0.99,https://www.reddit.com/r/amcstock/comments/uz4n06/180380000_shares_on_loan_the_shorts_just_wont/
uyywum,0,1106,1216,False,t3_uyywum,44,False,1325,False,False,False,2qnlf,t5_2qnlf,160861,gimme one nuggets,0.99,https://v.redd.it/ti60p8z5z0291
uyy8cl,281,921,1348,False,t3_uyy8cl,34,False,1541,False,False,False,3epk9,t5_3epk9,104141,"My best good boy, Palmer (15). One year resident of Rainbow town. Didn't think I'd make it a day but here we are.",1.0,https://www.reddit.com/gallery/uyy8cl
uz22jh,8405,38479,1066,False,t3_uz22jh,6,False,822,False,False,False,9xica,t5_9xica,309896,"Thanks, I hate that piece of information",0.99,https://i.redd.it/jiedt04987b81.jpg
uz7m2r,19627,667647,801,False,t3_uz7m2r,12,False,366,False,False,False,hazp9,t5_hazp9,24646,It's all coming together,0.98,https://i.redd.it/z3bz4orv03291.png
uz2x7l,220017,1371898,1028,False,t3_uz2x7l,30,False,735,False,False,False,32apjv,t5_32apjv,29206,Greg Abbott argues with grieving parents about gun laws,0.98,https://i.imgur.com/e9BFpOK.jpg
uz8fza,13090,40490,762,False,t3_uz8fza,258,False,1352,False,False,False,2qh16,t5_2qh16,12080204,"Tesla won’t set up manufacturing plant in India until allowed to first sell and service cars, Elon Musk says",0.9,https://techcrunch.com/2022/05/27/tesla-wont-set-up-manufacturing-plant-in-india-until-allowed-to-first-sell-and-service-cars-elon-musk-says/
uz4699,706,15766,967,False,t3_uz4699,8,False,601,False,False,False,2tdi5,t5_2tdi5,144630,Araragi with lovely vampires,0.99,https://i.redd.it/bfs37u3w62291.jpg
uz7m66,165,250630,801,False,t3_uz7m66,12,False,740,False,False,False,31d92,t5_31d92,118001,Even knowing this still terrifies me,0.99,https://v.redd.it/cytb1xtv03291
uz03fg,2683,9661,1157,False,t3_uz03fg,30,False,1081,False,False,False,2skj2,t5_2skj2,272569,🇰🇷 A South Korean division demonstrating volley fire with self-propellered K-9 (155 mm) howitzers.,0.99,https://v.redd.it/dgbycf5e91291
uz0ghg,471,203685,1142,False,t3_uz0ghg,18,False,1031,False,False,False,2sesx,t5_2sesx,654866,Cecily Strong,0.96,https://i.imgur.com/VTJZCr4.png
uz367z,4957,14538,1015,False,t3_uz367z,25,False,1449,False,False,False,2shbb,t5_2shbb,282930,"My 10 year old sister left this on my desk the other day while I was at school. It says, “Man or woman, I won’t stop loving you”",0.99,https://i.redd.it/kiaf6uusy1291.jpg
uz390r,1191,1919,1012,False,t3_uz390r,127,False,692,False,False,False,2rk3b,t5_2rk3b,475934,"New to Civ VI, any suggestion on what I should do now?",0.98,https://www.reddit.com/gallery/uz390r
uz990e,12647,14110,722,False,t3_uz990e,13,False,581,False,False,False,2qj9g,t5_2qj9g,4853166,What’s your favorite scary movie? Done by: @rhea_riot at Lost Dutchman Tattoo in Phoenix,0.96,https://i.redd.it/4mcga0g2f3291.jpg
uz4ee3,1517,996,957,False,t3_uz4ee3,71,False,587,False,False,False,2yy8z0,t5_2yy8z0,46269,Fuck the NRA,0.81,https://i.imgur.com/QCZtITR.jpg
uz3574,147,1002,1018,False,t3_uz3574,3,False,701,False,False,False,2anwwk,t5_2anwwk,25770,"I saw this on Instagram before Kenobi, and now we get to see how this time plays out",0.99,https://i.redd.it/16oap68ky1291.jpg
uz8mmd,1738,2287,753,False,t3_uz8mmd,33,False,317,False,False,False,pgc6w,t5_pgc6w,37900,[No Spoilers] To all the Critters discovering this place because of ExU: Calamity…,0.98,https://www.reddit.com/r/Dimension20/comments/uz8mmd/no_spoilers_to_all_the_critters_discovering_this/
uz7lbl,32973,13118,803,False,t3_uz7lbl,237,False,1525,False,False,False,2qimj,t5_2qimj,2131841,"[Adam Stern] ESPN intends to keep F1 commercial free if it renews rights, and the only ad option even being considered otherwise (if the new fee forced it) would be comparable to a split screen. Full commercial breaks with no racing on-screen is not being considered",0.99,https://twitter.com/A_S12/status/1530285617623490560
uyzki2,25079,30047,1185,False,t3_uyzki2,70,False,1161,False,False,False,3hets,t5_3hets,85678,Soon (for real!),0.98,https://i.redd.it/l3e9cxgv41291.jpg
uz5wzq,4540,1544,886,False,t3_uz5wzq,32,False,466,False,False,False,2rer8,t5_2rer8,266652,firma sus,0.97,https://i.redd.it/k5bqg8y6m2291.jpg
uyz9xu,1082,12141,1199,False,t3_uyz9xu,24,False,1216,False,False,False,39bxv,t5_39bxv,144961,ik_ihe,0.99,https://i.redd.it/7ma6x3ec21291.jpg
uz43zq,1476,1917,973,False,t3_uz43zq,118,False,613,False,True,False,3a3kv,t5_3a3kv,226483,First Look at [SPOILER] in Obi-Wan Kenobi,0.98,https://i.redd.it/d224021p62291.jpg
uz8gbw,4209,4937,762,False,t3_uz8gbw,20,False,328,False,False,False,38oju,t5_38oju,971601,burger store near my place. I'm dying guys,0.99,https://i.redd.it/u3khrmk083291.jpg
uz6rgf,2925,1933,843,False,t3_uz6rgf,162,False,836,False,False,False,2si92,t5_2si92,1877817,Percentage of people who feel safe walking outside at night,0.96,https://i.redd.it/b6x8vxcgt2291.jpg
uyylhz,2271,82455,1232,False,t3_uyylhz,129,False,1343,False,False,False,2vxds,t5_2vxds,250966,My style isn't for everyone... but what do you think?,0.96,https://i.imgur.com/w3zvxcf.jpg
uz5rvn,112575,312,892,False,t3_uz5rvn,102,False,474,False,False,False,2s7cl,t5_2s7cl,306313,Does anyone just NOT care about preparing work for their leave?,0.98,https://www.reddit.com/r/BabyBumps/comments/uz5rvn/does_anyone_just_not_care_about_preparing_work/
uz5482,39686,44207,924,False,t3_uz5482,5,False,528,False,False,False,3epkn,t5_3epkn,201103,Kyra tackled me because I dared to also pet Phoenix,0.98,https://i.redd.it/y16ly3tcf2291.jpg
uyzyou,48,654,1165,False,t3_uyzyou,9,False,1108,False,False,False,2suml,t5_2suml,229223,sweet snuggles😍,0.99,https://v.redd.it/6wyb6hfa81291
uz18fq,16481,8452,1105,False,t3_uz18fq,23,False,1982,False,False,False,nngwo,t5_nngwo,871190,They're everywhere,0.99,https://i.redd.it/5u2tdv5yi1291.gif
uywwwt,143,1501,1326,False,t3_uywwwt,165,False,1816,False,False,False,2qjuv,t5_2qjuv,2048843,Historical Bear Markets,0.97,https://i.redd.it/afn7l2urf0291.jpg
uyzyz8,156,4267,1262,False,t3_uyzyz8,26,False,1182,False,False,False,2uiff,t5_2uiff,824295,Behind the Scenes clips from the first American Pie,0.98,https://v.redd.it/7hnlhbsx71291
uz0ual,84484,2400582,1125,False,t3_uz0ual,11,False,958,False,False,False,k40dr,t5_k40dr,67375,This mama opossum doesn’t let anything get in the way of her fitness routine. She brings her pouch-full of babies along for her evening walks at Wild By Nurture,0.99,https://gfycat.com/powerfulimpolitedungenesscrab
uz937l,5516,5519,732,False,t3_uz937l,34,False,291,False,False,False,69haov,t5_69haov,12629,I supported Heard. I was wrong.,0.96,https://www.reddit.com/r/deppVheardtrial/comments/uz937l/i_supported_heard_i_was_wrong/
uz6nbe,14954,24782,850,False,t3_uz6nbe,15,False,427,False,False,False,2srkz,t5_2srkz,58316,"I’ve been trying to teach myself pixel art… here’s some of my Eevee character, Maeve!",0.99,https://i.redd.it/bkw076ufs2291.jpg
uz5oqv,19349,140758,896,False,t3_uz5oqv,69,False,996,False,False,False,3itr1,t5_3itr1,379817,Thoughts on Obi-Wan Kenobi?,0.99,https://i.redd.it/zacabzu7k2291.jpg
uz4p2v,82,5708,943,False,t3_uz4p2v,14,False,1120,False,False,False,3iblf,t5_3iblf,266881,Meet Muezza,1.0,https://i.imgur.com/ZFqi4HE.jpg
uz1594,102708,10719,1110,False,t3_uz1594,27,False,928,False,False,False,2qykd,t5_2qykd,376001,"The Japanese market near my house has these dinner for two packs to make at home. The volcano ramen comes with fresh noods, spicy broth base, and a toppings pack with Karrage, Kikurage, and corn",0.99,https://www.reddit.com/gallery/uz1594
uz9z4d,16799,18755,687,False,t3_uz9z4d,30,False,253,False,False,False,scu5z,t5_scu5z,61660,One of my best friends has passed away. Made a tribute in his name.,0.95,https://i.redd.it/2r6v5yjjl3291.png
uz65yo,4210,1801,873,False,t3_uz65yo,5,False,455,False,False,False,4jxcnj,t5_4jxcnj,40424,Daily life of a sigma vlog,0.99,https://i.redd.it/yvfrcd9do2291.jpg
uz6h9f,11483,69312,859,False,t3_uz6h9f,13,False,428,False,False,False,34bcl,t5_34bcl,169159,"Just unsubbed from r/meirl. Either really unfunny or rely unrelatable (and sometimes fake) posts, but this was the last straw for me",0.95,https://i.redd.it/p4zsfo61r2291.jpg
uz4pa9,1335,7160,944,False,t3_uz4pa9,8,False,555,False,False,False,2tz1z,t5_2tz1z,84085,Christopher Dalken,0.99,https://i.redd.it/h38m5cnob2291.png
uz3dax,14369,395447,1008,True,t3_uz3dax,13,False,671,False,False,False,2sf9b,t5_2sf9b,412886,Lazy River Dreampark,0.98,https://i.redd.it/uos8enhh02291.jpg
uz2nvm,10648,12423,1040,False,t3_uz2nvm,60,False,1538,False,False,False,3ju96,t5_3ju96,110745,"hey, so long as i still get paid",0.98,https://v.redd.it/gegrazg2h1291
uz9rsb,525,9733,696,False,t3_uz9rsb,18,False,543,False,False,False,3538a,t5_3538a,834795,Fault? What do U think?,0.98,https://v.redd.it/w95tw4asj3291
uz9ws9,7705,8861,690,False,t3_uz9ws9,191,False,251,False,False,False,2qqwk,t5_2qqwk,141729,"As a proud Alabmian gun owner, we need to seriously address this assault rifle shit. We aren't using it for hunting, and I'll be the first to confess.",0.78,https://www.reddit.com/r/Alabama/comments/uz9ws9/as_a_proud_alabmian_gun_owner_we_need_to/
uzajm1,383,18987,656,False,t3_uzajm1,16,False,227,False,False,False,2qt7l,t5_2qt7l,164691,little george drawing i did. also added a bow to his outfit,0.97,https://i.redd.it/ewvgaxdzq3291.jpg
uza06z,6559,58335,685,False,t3_uza06z,51,False,519,False,False,False,2qsev,t5_2qsev,581044,Can Paddy make weight for July?,0.91,https://i.imgur.com/KVu5swW.jpeg
uz6lki,17288,4649457,852,False,t3_uz6lki,3,False,865,False,False,False,3hwza,t5_3hwza,874152,doggo tried so hard to resist,0.99,https://i.imgur.com/H5iZCvB.gifv
uzamug,2375,25249,652,False,t3_uzamug,7,False,232,False,False,False,2ruhk,t5_2ruhk,152632,"Kaijus as Animals: Day 9, Godzilla vs Biollante",1.0,https://i.redd.it/uigie7utr3291.jpg
uzcsdv,2506,43057,531,False,t3_uzcsdv,20,False,333,False,False,False,2qlqp,t5_2qlqp,4107307,Little finger joint box I made.,0.99,https://v.redd.it/6j1frppcd4291
uz63wa,5208,4358,876,False,t3_uz63wa,16,False,460,False,False,False,2ug7r,t5_2ug7r,64888,dont need no second half 😒,0.99,https://i.redd.it/3bz91ai8oz191.gif
uz4arq,16,1769,963,False,t3_uz4arq,26,False,1203,False,False,False,3jmfh,t5_3jmfh,399590,Cat flows through model train tunnel,0.99,https://v.redd.it/gy52tao482291
uz570o,750,2122,920,False,t3_uz570o,32,False,1053,False,False,False,2sebi,t5_2sebi,908088,First time playing The Witcher 3 and felt inspired to make this…,0.99,https://i.redd.it/emh8n032g2291.jpg
uz9mh0,36,146,705,False,t3_uz9mh0,20,False,266,False,False,False,3exs8,t5_3exs8,130066,Our eldest son on stage in high school,0.98,https://i.redd.it/aphujejei3291.png
uzbrmw,50878,47060,592,False,t3_uzbrmw,22,False,191,False,False,False,2qy4s,t5_2qy4s,138325,"My 5 Year Old Son wanted his favorite car on a T-shirt, so I drew this for him.",0.96,https://i.redd.it/ciskv9oh24291.jpg
uz68sm,2730,26047,870,False,t3_uz68sm,147,False,889,False,False,False,swxxz,t5_swxxz,1468303,Darknet drug dealers working in a Xanax factory,0.96,https://v.redd.it/fa04wtlzo2291
uyxqai,1390,32552,1278,True,t3_uyxqai,174,False,8659,False,False,False,2qmeb,t5_2qmeb,4040498,9 Generation of Starters by me,0.98,https://i.redd.it/cuhvgcq5o0291.jpg
uyz4tp,1834,2708,1416,False,t3_uyz4tp,13,False,3016,False,False,False,2vm97,t5_2vm97,748116,I was bored and I thought Manako looked kinda sus so.......,0.98,https://i.redd.it/xjq21ht311291.png
uz9f0i,11282,28142,716,False,t3_uz9f0i,58,False,560,False,False,False,3cb2g,t5_3cb2g,594332,I will die on this hill!,0.92,https://i.redd.it/gmr70u2hg3291.png
uz7cr6,25,1527,817,False,t3_uz7cr6,12,False,376,False,False,False,4h0a66,t5_4h0a66,960,100⬆️ en esta publicación para el set completo :v,0.97,https://i.redd.it/wjkg7yvky2291.jpg
uz9a92,51684,192678,723,False,t3_uz9a92,89,False,288,False,False,False,3onkg,t5_3onkg,148024,The police forgot to check Lang for his 2nd gun,0.86,https://clips.twitch.tv/ProductiveFaintHyenaTinyFace-eADHinVahtvQK2dQ
uzcp2a,1424,8370,538,False,t3_uzcp2a,4,False,157,False,False,False,2te6p,t5_2te6p,562883,"Thanks to a late reservation at Oga’s Cantina, I managed to capture this photo after the park closed.",0.99,https://i.redd.it/y5ypmqwcc4291.jpg
uz5jaf,6,365,1104,False,t3_uz5jaf,26,False,593,False,False,False,2rlrf,t5_2rlrf,179705,"MG Epyon, with metallic green from Studio G and some hex camo masking tape I found online",0.99,https://i.redd.it/9f54agkti2291.jpg
uz33l7,34750,1085708,1022,False,t3_uz33l7,10,False,1653,False,False,False,48nz4l,t5_48nz4l,96988,"🔴Daily Reverse Repo Update 05/27: $2,006.688B - BUY HODL DRS🔴",0.98,https://i.redd.it/e4lelvw6y1291.png
uz4qoa,6666,1414,944,False,t3_uz4qoa,36,False,555,False,False,False,21t8e4,t5_21t8e4,54416,Finished my Bridgerton embroidery project! 🐝,0.99,https://i.redd.it/3oxvt1t3c2291.jpg
uyy3lu,8924,267272,1261,False,t3_uyy3lu,35,False,1444,False,False,False,2tq4v,t5_2tq4v,633563,Cat.,0.99,https://v.redd.it/tt0pp71pr0291
uz0e9v,114,668,1148,False,t3_uz0e9v,211,False,1025,False,False,False,339ie,t5_339ie,186333,"The developer of Rogue Earth, a kurzgesasgt-style game, was threatened by lawsuit from Kurzgesagt. The project is currently being scrapped. (Lots of text)",0.98,https://www.reddit.com/gallery/uz0e9v
uz40mk,5150,150159,980,False,t3_uz40mk,179,False,610,False,False,False,fc76s,t5_fc76s,117179,"I don’t usually like absolutes, but this one is accurate",0.85,https://i.imgur.com/mSsIX7r.jpg
uz7lah,73,165,808,False,t3_uz7lah,24,False,357,False,False,False,3f5dt,t5_3f5dt,186822,hey from me and my pup :) hope y’all are having a great day!,0.99,https://i.redd.it/h052moro03291.jpg
uz8be6,3,158,774,False,t3_uz8be6,19,False,318,False,False,False,39em5,t5_39em5,343094,"Went through some harassment so I had to make a new account . My program is ending and I won’t see my students anymore (they don’t know). My birthday is on the 4th no contact from my mom in almost a year and my friends stopped contact , won’t even answer if they’re okay. I feel like empty and tired.",0.98,https://i.redd.it/jzvubint63291.jpg
uz8jqf,706,10898,763,False,t3_uz8jqf,67,False,311,False,False,False,2qhv7,t5_2qhv7,718273,"Frase que Salvador Dalí dijo sobre México, pienso que aún es relevante.",0.95,https://i.redd.it/63bq3rbu83291.jpg
uz5zek,923,12447,887,False,t3_uz5zek,113,False,454,False,False,False,2rsgr,t5_2rsgr,201218,I became a member today! Was only planning on picking up a few things...,0.91,https://i.redd.it/pa46fp4sm2291.jpg
uz6kj2,60,480,859,False,t3_uz6kj2,55,False,412,False,False,False,2ys92,t5_2ys92,206184,"M/26/5'8"" [238lbs to 187lbs] (2 months; 3 weeks)",0.97,https://i.imgur.com/TphClON.jpg
uza461,186249,1130105,685,False,t3_uza461,5,False,239,False,False,False,2tpfm,t5_2tpfm,73439,64 seconds of Ritsu's karma,1.0,https://v.redd.it/55hxfuezm3291
uz64q2,58,341,881,False,t3_uz64q2,26,False,435,False,False,False,33zyg,t5_33zyg,123380,We won with 2 TICKETS because of what me and my m2a3 squad did!,0.98,https://v.redd.it/yaim3u10o2291
uz1p29,821,75515,1208,False,t3_uz1p29,12,False,4415,False,False,False,2vegg,t5_2vegg,5813573,me_irl,0.99,https://i.redd.it/qmzfmq3mm1291.jpg
uz3vnr,4243,7548,989,False,t3_uz3vnr,14,False,610,False,False,False,2mqpqw,t5_2mqpqw,69900,Rentiods arguing over such feeble minded things like politics and forgetting rents due 😒,0.98,https://i.redd.it/eisly6rs42291.jpg
uz4jr4,1217,3622,958,False,t3_uz4jr4,34,False,553,False,False,False,2sss3,t5_2sss3,611563,A Highway in India surrounded by windmills,0.97,https://i.redd.it/lqzhm44ga2291.jpg
uz37so,160,6844,1112,False,t3_uz37so,17,False,736,False,False,False,2z77i,t5_2z77i,40416,POV: It's autumn 2017 and you're listening to the Night In The Woods soundtrack:,0.99,https://v.redd.it/p86lotf6z1291
uz307k,4825,70719,1031,False,t3_uz307k,11,False,1411,False,False,False,10288s,t5_10288s,1079182,No need to over-complicate life.,0.98,https://i.redd.it/c6vys4ifx1291.jpg
