post_id,author_comment_karma,author_link_karma,time_in_mins,post_is_original_content,post_name,post_num_comments,post_over_18,post_score,post_has_link,post_spoiler,post_stickied,subreddit_id,subreddit_name,subreddit_subscriber_count,post_title,post_upvote_ratio,post_url
uz4s5l,67824,137029,1069,False,t3_uz4s5l,83,False,4104,False,False,False,3mj3w,t5_3mj3w,822709,"In ""Recess: School's Out"" (2001), the police repeatedly refuse to solve the situation as the school is being taken over by terrorists. This is by far the most realistic part of the movie.",0.99,https://i.redd.it/gnx1i9ugc2291.jpg
uz3a63,165814,371922,1141,False,t3_uz3a63,23,False,1910,False,False,False,2qmjl,t5_2qmjl,1810850,GTA Vice City - Ray Liotta [3840x2160],0.97,https://i.redd.it/qnqkapknz1291.jpg
uz1wbv,444,4729,1205,False,t3_uz1wbv,30,False,2423,False,False,False,2tt3v,t5_2tt3v,216901,Thriller bark was PEAK COMEDY,0.99,https://i.redd.it/opxscj07o1291.jpg
uz35a8,233,2847,1147,False,t3_uz35a8,20,False,2008,False,False,False,3k2fi9,t5_3k2fi9,35203,Si,0.97,https://i.redd.it/tpcs2ibky1291.gif
uz9kot,8061,3617,837,False,t3_uz9kot,103,False,738,False,False,False,2ssrb,t5_2ssrb,113852,STAR WARS™: Knights of the Old Republic™ II: The Sith Lords - Announcement Trailer - Nintendo Switch,0.98,https://www.youtube.com/watch?v=rEhYnI1MqxI
uytrx9,131,25423,227,False,t3_uytrx9,2994,False,56334,False,False,False,2qh8y,t5_2qh8y,425086,Footage of British and American volunteers in Ukraine striking a Russian BTR,0.86,https://v.redd.it/43ckxk4tdz191
uz3yoq,2656,49673,1109,False,t3_uz3yoq,61,False,5122,False,False,False,2srr9,t5_2srr9,1348451,Anon cures his friend,0.98,https://i.redd.it/wpwqtyei52291.jpg
uyxoty,97799,651526,1409,False,t3_uyxoty,47,False,5536,False,False,False,3j659,t5_3j659,409034,Silly Uncle Billy 🤪🤪,0.95,https://i.redd.it/966sf26xn0291.jpg
uz8hho,3315,31676,891,False,t3_uz8hho,34,False,883,False,False,False,2u0l2,t5_2u0l2,600416,"Hitman: ""These guys are immortal, boss!""",0.98,https://v.redd.it/k6id9vl783291
uz1vdi,124913,61153,1207,False,t3_uz1vdi,40,False,2308,False,False,False,2vy3g,t5_2vy3g,822564,Spoof shirts were my favorite then,0.98,https://i.redd.it/vcg5hfizn1291.jpg
uzbweq,5176,11501,713,False,t3_uzbweq,38,False,1230,False,False,False,5qpzgw,t5_5qpzgw,546892,"If you see this, it’s a red flag. It means they don’t have to be honest about pay.",0.99,https://i.redd.it/jov39je244291.jpg
uzbnps,53941,4463,727,False,t3_uzbnps,29,False,528,False,False,False,2qlzfy,t5_2qlzfy,21944,A peek at the Doctor's cellphone,0.99,https://i.imgur.com/MvJ48Zt.png
uz4y1u,616,1248,1062,False,t3_uz4y1u,204,False,1476,False,False,False,2qhxu,t5_2qhxu,2125725,"Berlin, Germany",0.92,https://i.redd.it/edwsj2evd2291.jpg
uz1kb7,3594,14677,1221,False,t3_uz1kb7,10,False,2582,False,False,False,3aw4y,t5_3aw4y,382655,he fu**ed up his face,0.99,https://i.redd.it/f9ffpp2kl1291.jpg
uyzon6,23511,169072,1309,False,t3_uyzon6,207,False,3280,False,False,False,2ykm6,t5_2ykm6,324187,Batman analysed Superman’s fight with Zod to predict where to block and counter,0.95,https://v.redd.it/wkqe9j6u51291
uz9pz1,25,348,829,False,t3_uz9pz1,34,False,715,False,False,False,2quts,t5_2quts,905476,Got my grandma to make me a final battle quilt,1.0,https://www.reddit.com/gallery/uz9pz1
uz0ukh,0,4291,1254,False,t3_uz0ukh,87,False,9925,False,False,False,p49x6,t5_p49x6,1141805,Team Toaster Strikes Back,0.98,https://i.imgur.com/dWk1N7y.jpg
uz65nn,4093,3414,1004,False,t3_uz65nn,33,False,1216,False,False,False,2s7yh,t5_2s7yh,176602,SNL now in 3D!,0.97,https://i.redd.it/yb92z79ao2291.jpg
uz6m5x,1243,7443,982,False,t3_uz6m5x,170,False,1141,False,False,False,2rh21,t5_2rh21,147966,"Yes, these people do in fact exist",0.98,https://i.redd.it/sn99d1g5s2291.jpg
uz8wpx,460,561,870,False,t3_uz8wpx,13,False,812,False,False,False,325lr,t5_325lr,712578,A real life Space Whale!,0.98,https://v.redd.it/8louu6tc92291
uz1803,573,6886,1236,False,t3_uz1803,131,False,8288,False,False,False,2s5ti,t5_2s5ti,1743995,me irl,0.98,https://i.redd.it/hexzs0yui1291.jpg
uyti1h,1258,6401,248,False,t3_uyti1h,436,False,19388,False,False,False,2skqi,t5_2skqi,3171481,"On 27 May 1942, an assassination of Reinhard Heydrich, the 'architect of Holocaust', was undertaken by Josef Gabčík and Jan Kubiš in Prague, making it one of the few successful assassinations of a high profile Nazi during the WW2 [800x510]",0.97,https://i.redd.it/z1tdfw3k9z191.jpg
uyxk7o,154275,55691,1417,False,t3_uyxk7o,169,False,5078,False,False,False,33o0p,t5_33o0p,2657082,"This religious biology book features endorsements from totally real people; Nurse, Medical Doctor, and Dentist",0.96,https://i.imgur.com/kQvaSi3.jpg
uzdkba,199889,5021549,615,False,t3_uzdkba,18,True,370,False,False,False,37q5a,t5_37q5a,93252,The devil is kinda cute tho,0.98,https://i.redd.it/bkhns02kl4291.gif
uyy4qb,9,3304,1388,False,t3_uyy4qb,23,False,4605,False,False,False,2yvry,t5_2yvry,294642,USB C should be normalized,0.98,https://i.redd.it/mz2185x28z191.gif
uz6i5x,57594,45070,987,False,t3_uz6i5x,19,False,1143,False,False,False,sfted,t5_sfted,275167,fans of this game be like: I want a,0.98,https://i.redd.it/25kkzpj2r2291.png
uyx6wj,41635,18820,0,False,t3_uyx6wj,809,False,54989,False,False,False,38e1l,t5_38e1l,1908273,maybe maybe maybe,0.96,https://v.redd.it/5ijec43ki0291
uyvtnt,1465,4675,87,False,t3_uyvtnt,342,False,7885,False,False,False,2rygj,t5_2rygj,519606,are windsocks any less flags than any other flags? DEBATE,0.96,https://i.redd.it/tb5b3tsj30291.png
uzc8cz,12647,24940,694,False,t3_uzc8cz,8,False,467,False,False,False,3lrep,t5_3lrep,443943,I am doing my part preaching the good word.,0.97,https://i.imgur.com/bsFEzs8.jpg
uyvqxn,434428,12128517,91,False,t3_uyvqxn,134,False,7376,False,False,False,2smf3,t5_2smf3,916387,Multi-stage quick return mechanism (slomo at the end),0.96,https://i.imgur.com/8xeNO7Y.gifv
uyxscl,43045,1335171,1408,False,t3_uyxscl,61,False,19687,False,False,False,2qh0s,t5_2qh0s,1831829,once upon your time,0.97,https://i.redd.it/uu7enblro0291.png
uz7tjn,34,545,924,False,t3_uz7tjn,14,False,933,False,False,False,2zzfr,t5_2zzfr,467812,Bojack Horseman inspired by The Scream. Did it for my AP Art History final. Ink Painting,0.99,https://i.redd.it/cebd10wi23291.jpg
uz383g,22347,67604,1146,False,t3_uz383g,7558,False,47551,False,False,False,2qh3l,t5_2qh3l,24720493,"Shooter entered school through propped open door, had over 1,600 rounds of ammunition",0.91,https://news4sanantonio.com/news/local/official-kids-to-911-during-siege-police-send-the-police
uz0ogu,1251,15699,1266,False,t3_uz0ogu,50,False,2754,False,False,False,2r6ex,t5_2r6ex,273874,Asuka Driver by me! Inspired by the Art of @khyleri on twitter,0.96,https://www.reddit.com/gallery/uz0ogu
uz3glx,1038,1593,1138,False,t3_uz3glx,17,False,1779,False,False,True,2u0y3,t5_2u0y3,94621,….,0.98,https://i.redd.it/biopk64a12291.jpg
uzdk4e,114,214,617,False,t3_uzdk4e,39,False,364,False,False,False,2qtr8,t5_2qtr8,221067,"Well fellas, I did my part",0.97,https://www.reddit.com/r/army/comments/uzdk4e/well_fellas_i_did_my_part/
uz0ppp,1134414,53832,1261,False,t3_uz0ppp,107,False,7701,False,False,False,2qimj,t5_2qimj,2131917,Its that time of year again: The annual posting of the baller Monaco firefighters helmet.,0.98,https://i.redd.it/hll5eihee1291.jpg
uz6e28,31,668,999,False,t3_uz6e28,79,False,1155,False,False,False,120xk3,t5_120xk3,23801,YES!,0.98,https://i.redd.it/x0mnxv3bq2291.jpg
uz5mrk,1369,7211,1036,False,t3_uz5mrk,34,False,1528,False,False,False,48nz4l,t5_48nz4l,96988,RC Tweet,0.97,https://i.redd.it/ior2e51rj2291.jpg
uz64if,469,834,1012,False,t3_uz64if,12,False,1188,False,False,False,3gbar,t5_3gbar,51577,Thank u for ur service,0.99,https://i.redd.it/e8bl2kc0o2291.jpg
uz12qb,35882,121817,1250,False,t3_uz12qb,32,False,2480,False,False,False,35qtc,t5_35qtc,1012706,The day we brought him home and then today (five months later). He's grown so much!,0.99,https://i.redd.it/zxily0zlh1291.jpg
uz7eul,5292,8758,950,False,t3_uz7eul,7,False,978,False,False,False,u037o,t5_u037o,69025,#killyourlawn,0.97,https://i.redd.it/1xm1upryw1291.jpg
uzcsdv,2506,43469,666,False,t3_uzcsdv,37,False,1018,False,False,False,2qlqp,t5_2qlqp,4107604,Little finger joint box I made.,0.99,https://v.redd.it/6j1frppcd4291
uyx6yo,11893,6992,5,False,t3_uyx6yo,209,False,4893,False,False,False,2rdbn,t5_2rdbn,3047268,The cleanest my desk has ever looked,0.97,https://i.redd.it/h3pcx2qpi0291.jpg
uzbfhf,23406,25205,740,False,t3_uzbfhf,8,False,530,False,False,False,2yjxo,t5_2yjxo,360118,"Uh-Oh, I Guess There Might Not be a Rimworld 2",0.99,https://i.redd.it/ewuvh4jfz3291.png
uzciif,55,302,680,False,t3_uzciif,8,False,448,False,False,False,9n2w1,t5_9n2w1,122154,r/vegan is hiding this from you. Soystrogen gives the best soyboobs,0.99,https://i.redd.it/o68r7thgjz191.jpg
uzei87,17029,40417,560,False,t3_uzei87,6,False,308,False,False,False,38gjk,t5_38gjk,199269,Coincidence? I Think Not!,0.98,https://i.redd.it/ha5lxdhzv4291.png
uz7lbl,32973,13473,937,False,t3_uz7lbl,293,False,2355,False,False,False,2qimj,t5_2qimj,2131918,"[Adam Stern] ESPN intends to keep F1 commercial free if it renews rights, and the only ad option even being considered otherwise (if the new fee forced it) would be comparable to a split screen. Full commercial breaks with no racing on-screen is not being considered",0.99,https://twitter.com/A_S12/status/1530285617623490560
uza0xm,5,21726,819,False,t3_uza0xm,21,False,670,False,False,False,2u04j,t5_2u04j,495812,Ovenable.,0.99,https://i.redd.it/k0cxcl15m3291.png
uzcs0t,957,4391,668,False,t3_uzcs0t,49,False,423,False,False,False,2rj35,t5_2rj35,166120,Handed her my WASR and she immediately assumed this stance. Think gf is secretly Gopnik.,0.9,https://v.redd.it/fynqod8uc4291
uze4vf,1036,14329,586,False,t3_uze4vf,9,False,329,False,False,False,3md3a,t5_3md3a,228826,"In max payne 3, you can actually hear bullet casings falling down the escalator",0.99,https://v.redd.it/30nnu7hmr4291
uzdeuw,4084,996,631,False,t3_uzdeuw,39,False,370,False,False,False,2s0u3,t5_2s0u3,153129,Nope. I was born into this misery.,0.97,https://i.redd.it/ewmuqrz0k4291.jpg
uzcxhv,29420,37026,659,False,t3_uzcxhv,53,False,409,False,False,False,2ug83,t5_2ug83,759143,This made me laugh so damn hard,1.0,https://i.redd.it/85fgmufwe4291.jpg
uz864e,376,436,914,False,t3_uz864e,79,False,880,False,False,False,2rrlp,t5_2rrlp,5420729,Star Wars Jedi: Survivor - Official Teaser,0.97,https://youtu.be/4HLDaBGdnLc
uz6rck,8271,20189,982,False,t3_uz6rck,24,False,1077,False,False,False,hr7yt,t5_hr7yt,199567,A helmet I bought two weeks ago at Rocky Mountain ATV just went on sale. They sent an email notifying me that they’ve automatically issued me the price difference as store credit. I never would have known about the price difference otherwise. Free $52 to use on my next purchase.,0.97,https://i.imgur.com/KS7bpfw.jpg
uzdtl2,876,715,606,False,t3_uzdtl2,20,False,351,False,False,False,3fn31,t5_3fn31,3125712,Can someone explain,0.95,https://v.redd.it/bcp93x4do4291
uyxgeo,279482,516365,1430,False,t3_uyxgeo,390,False,76050,False,False,False,2vegg,t5_2vegg,5813626,me_irl,0.95,https://i.redd.it/e5aun28fl0291.gif
uz5bwx,23411,21286,1051,False,t3_uz5bwx,27,False,1344,False,False,False,2sal9,t5_2sal9,436008,Leave me alone,0.99,https://i.redd.it/wv8c2025h2291.jpg
uz6u21,3832,2029,978,False,t3_uz6u21,251,False,1064,False,False,False,2r1ky,t5_2r1ky,863258,Top Gun: Maverick’ Set To Take Breath Away With $142M+ Record Memorial Day Opening - Friday Mid-Day Update,0.93,https://deadline.com/2022/05/top-gun-maverick-box-office-1235034420/
uzcz54,7142,3393,657,False,t3_uzcz54,9,False,401,False,False,False,3fdcn,t5_3fdcn,178391,Now Playing,0.99,https://i.redd.it/o8nisa5ef4291.jpg
uz9ner,6346,11164,840,False,t3_uz9ner,11,False,693,False,False,False,pwlo0,t5_pwlo0,101909,Baka Subaru 😔,1.0,https://i.redd.it/t54ylnc7i3291.jpg
uyyoz6,2585,3489,1364,False,t3_uyyoz6,21,False,3697,False,False,False,2z2ak,t5_2z2ak,698518,A handsome ginger loaf,0.99,https://i.redd.it/rpdxm2b9x0291.jpg
uz77l6,11679,27055,960,False,t3_uz77l6,16,False,998,False,False,False,2qhad,t5_2qhad,461810,Two more Starbucks stores voted to unionize today - 505 Union and Eastlake,0.96,https://twitter.com/SeattleSBWU/status/1530277130977701888?t=Qza8kkfc1HqLvc7LLFdzZQ&s=19
uz04pp,3051,5031,1295,False,t3_uz04pp,60,False,2930,False,False,False,30cz1,t5_30cz1,1126617,My first double tap!,0.98,https://v.redd.it/8naojgll91291
uz1a5z,35270,57962,1240,False,t3_uz1a5z,73,False,2497,False,False,False,2hp3js,t5_2hp3js,64009,Tarm’s rise up 👊😎,0.95,https://i.redd.it/xvwy1ujcj1291.jpg
uzan2g,840,26691,789,False,t3_uzan2g,34,False,595,False,False,False,2qn0o,t5_2qn0o,381155,"I get the feeling Thiago has shaken off his injury and should be ok to start. I dunno, just a hunch.",1.0,https://i.imgur.com/fkzXlhP.jpg
uzapr7,278,881,785,False,t3_uzapr7,38,False,1425,False,False,False,2u2bh,t5_2u2bh,3835910,True friends laugh instead of helping,0.98,https://v.redd.it/00o69xfks3291
uzcd61,78017,1232854,694,False,t3_uzcd61,151,False,1066,False,False,False,2qm7u,t5_2qm7u,1952853,[extrabaggs] You won't believe this: Tommy Pham was upset at Joc Pederson over their *fantasy football league*. L,0.99,https://twitter.com/extrabaggs/status/1530352758443761668
uzaw6x,8788,126575,776,False,t3_uzaw6x,19,False,574,False,False,False,2zfa0,t5_2zfa0,1068871,-6 cm,0.97,https://v.redd.it/msruvtw0u3291
uyy35d,588484,485305,1396,False,t3_uyy35d,230,False,3952,False,False,False,2x4yx,t5_2x4yx,2349807,CDC places about half of Florida at high risk for COVID transmission,0.95,https://wusfnews.wusf.usf.edu/health-news-florida/2022-05-27/cdc-places-half-florida-high-risk-covid-transmission
uzbdph,63,2228,749,False,t3_uzbdph,18,False,522,False,False,False,2qi2h,t5_2qi2h,291806,drew my lil man! hope u guys like him :3,0.99,https://www.reddit.com/gallery/uzbdph
uz6tmu,206,2586,979,False,t3_uz6tmu,23,False,1057,False,False,False,2qjof,t5_2qjof,244344,Sweet baby pork roll,0.99,https://i.imgur.com/ZM0nZan.jpg
uz4g0x,2329,3630,1094,False,t3_uz4g0x,166,True,1500,False,True,False,2wjmx,t5_2wjmx,321897,"Finally at Peace. This is my Partner, I snapped this right as he died. He fought Stage 4 Renal cancer for 5 years, but he lost the fight on 05/30/20. In the end, his poor body was just worn out.",0.91,https://i.redd.it/9j3lk7wj92291.jpg
uz3jiw,455621,315888,1136,False,t3_uz3jiw,848,False,1716,False,False,False,2tuot,t5_2tuot,138585,Jay on the opening of the Obi-Wan Kenobi series,0.83,https://i.redd.it/gixe5snp12291.png
uz4a8y,282,8985,1101,False,t3_uz4a8y,135,False,1537,False,False,False,2ykcc,t5_2ykcc,257482,battle of the wms,0.96,https://i.redd.it/oyf5n39082291.gif
uz6u5q,1214,1258,979,False,t3_uz6u5q,16,False,1054,False,False,False,3ppb2,t5_3ppb2,94844,scottbob,0.99,https://i.redd.it/169iezo2u2291.png
uz4rg2,1289,4715,1078,False,t3_uz4rg2,101,False,1426,False,False,False,2qhu3,t5_2qhu3,204493,I loved seeing this reaction to the winner,0.94,https://i.redd.it/sy9x55mac2291.jpg
uz3zno,911,13342,1116,False,t3_uz3zno,11,False,1633,False,False,False,2ru8n6,t5_2ru8n6,36589,does he get bitchet?,0.98,https://v.redd.it/fia7qbmo52291
uz7y88,914,3854,925,False,t3_uz7y88,251,False,888,False,False,False,45hf8f,t5_45hf8f,37363,Guy mocks and makes fun of Texas school shooting victims,0.88,https://v.redd.it/yi55zdck33291
uz5adb,17288,4663480,1053,False,t3_uz5adb,28,False,1311,False,False,False,2r5qg,t5_2r5qg,847636,Too tired to enjoy her first day out in the city.,0.99,https://i.imgur.com/RGlKfwR.jpeg
uz08uv,862,12058,1290,False,t3_uz08uv,49,False,2823,False,False,False,34a0h,t5_34a0h,1304927,My fanart of Jiro!,0.99,https://i.redd.it/kb88q7hja1291.jpg
uz22te,11539,24206,1205,False,t3_uz22te,75,False,6203,False,False,False,3ndbi,t5_3ndbi,580296,PAIIIIIINNNNNNN,0.97,https://i.redd.it/xbgjs6oop1291.gif
uz4z8r,5409,1201,1068,False,t3_uz4z8r,111,False,1358,False,False,False,2qhdi,t5_2qhdi,326881,"Got a FF13 tattoo, but have no one to share it with. Lowkey my fave entry in the series.",0.93,https://i.redd.it/24v6yfc6e2291.jpg
uz0fxw,35,8287,1281,False,t3_uz0fxw,113,False,2759,False,False,False,2v567,t5_2v567,1571188,Her foot...,0.93,https://v.redd.it/z576xvjxgx191
uyzbqx,3532,74834,1334,False,t3_uyzbqx,139,True,11464,False,False,False,324zi,t5_324zi,2329945,Lioness with her almost completely eaten zebra,0.97,https://i.redd.it/uay8aeas21291.jpg
uz9j6n,1789,13930,847,False,t3_uz9j6n,47,False,686,False,False,False,2ssjq,t5_2ssjq,257753,Glitter makeup Nate appreciation post ✨,0.97,https://www.reddit.com/gallery/uz9j6n
uz74qh,44432,39024,965,False,t3_uz74qh,40,False,985,False,False,False,3blr7,t5_3blr7,80828,Who's posting it on our sister sub r/ElonMusk ?,0.98,https://i.redd.it/xtzmixmew2291.jpg
uz92tl,9386,533,870,False,t3_uz92tl,47,False,742,False,False,False,341k1,t5_341k1,955121,Scrubs don’t mean I am an employee…,0.97,https://www.reddit.com/r/IDontWorkHereLady/comments/uz92tl/scrubs_dont_mean_i_am_an_employee/
uz2zrw,9041,868835,1163,False,t3_uz2zrw,36,False,1823,False,False,False,31gwh,t5_31gwh,463160,Iceberg,0.99,https://i.redd.it/0nc6cbx8x1291.jpg
uz9j1o,98,876,847,False,t3_uz9j1o,134,False,686,False,False,False,2qrrr,t5_2qrrr,212834,Giants manager Gabe Kapler will be skipping the national anthem over political inactivity on school shootings,0.86,https://www.sfchronicle.com/sports/giants/article/Giants-Gabe-Kapler-to-skip-national-anthem-17204296.php
uza10c,114,1515,822,False,t3_uza10c,8,False,636,False,False,False,2t9sl,t5_2t9sl,1134881,"Animal Therapy, 1956",0.98,https://www.reddit.com/gallery/uza10c
uzasf7,4198,28886,782,False,t3_uzasf7,83,False,561,False,True,False,zlrg5,t5_zlrg5,166455,Making bad decisions =/= being poorly written,0.94,https://i.redd.it/wo6tid28t3291.png
uz4818,13431,208193,1105,False,t3_uz4818,21,False,3802,False,False,False,2sbq3,t5_2sbq3,22087690,"Sunset reflections at Stokksnes, Iceland [OC][5105x7654] by @explorerhans",0.99,https://i.imgur.com/hyxDtFy.jpg
uzeew5,1114,1782,571,False,t3_uzeew5,7,False,299,False,False,False,2qq2q,t5_2qq2q,284870,Nice sunset at the padres game right now,0.99,https://i.redd.it/gg1bn91tu4291.jpg
uz8p94,39119,10158,889,False,t3_uz8p94,27,False,779,False,False,False,38d4q,t5_38d4q,135408,polarization is just fun,0.96,https://i.redd.it/mjf73hr7a3291.jpg
uyw4fz,16058,3301,70,False,t3_uyw4fz,840,False,5870,False,False,False,2qh4i,t5_2qh4i,20923640,has anyone ever lost the ability to read?,0.94,https://www.reddit.com/r/books/comments/uyw4fz/has_anyone_ever_lost_the_ability_to_read/
uzba4y,49622,90889,756,False,t3_uzba4y,8,False,510,False,False,False,5vej89,t5_5vej89,51596,He's decided to be like this always,1.0,https://i.imgur.com/Z9F2xX8.jpg
uz5sj5,426,10529,1030,False,t3_uz5sj5,27,False,1191,False,False,False,2tpjq,t5_2tpjq,326422,I designed 5 custom pieces to fill the void of accurate Star Wars lightsaber hilts,0.98,https://www.reddit.com/gallery/uz5sj5
uz97aj,41,3812,864,False,t3_uz97aj,17,False,1798,False,False,False,2st2l,t5_2st2l,744206,this cat is the real owner,0.99,https://i.redd.it/m5keeyzke3291.gif
uz1c41,338,2299,1239,False,t3_uz1c41,77,False,2270,False,False,False,2r9po,t5_2r9po,305140,When you accidentally leave the tag on.,0.98,https://i.imgur.com/XSu2moH.jpg
uz4f3y,454,34711,1096,False,t3_uz4f3y,15,False,1506,False,False,False,25sigb,t5_25sigb,183139,Blursed rock,0.99,https://v.redd.it/eprguhdc92291
uz9e22,43742,9395,855,False,t3_uz9e22,17,False,685,False,False,False,6dswva,t5_6dswva,15443,"Guys, look what my pocket typed out!",0.96,https://i.redd.it/beeqmn9cg3291.png
uzavmb,245021,1480332,778,False,t3_uzavmb,210,False,3651,False,False,False,2uqcm,t5_2uqcm,5502463,These twins think they are in their mother's womb even after birth.,0.94,https://v.redd.it/6gjv8871u3291
uyzua0,158128,303280,1309,False,t3_uyzua0,281,False,9221,False,False,False,310rm,t5_310rm,2513295,Hierarchy Of Disagreement,0.94,https://i.redd.it/8ebhb3v671291.png
uzbwpz,103,2467,721,False,t3_uzbwpz,13,False,465,False,False,False,2rhee,t5_2rhee,66518,saw this on tumblr...,0.99,https://i.redd.it/ybq2tjh544291.jpg
uz823z,53294,147885,921,False,t3_uz823z,112,False,865,False,False,False,347fo,t5_347fo,71731,How Bad Is The Gringo Papi?,0.98,https://m.youtube.com/watch?v=U9WjJvi1Doo
uz7cw7,2775,21997,954,False,t3_uz7cw7,38,False,946,False,False,False,2scup,t5_2scup,965723,I really appreciate how they coordinate this.,0.98,https://v.redd.it/n3vvm5rgy2291
uz3umv,1674,9977,1123,False,t3_uz3umv,14,False,1616,False,False,False,49y2dr,t5_49y2dr,41065,:),0.99,https://i.redd.it/ca7egf3k42291.jpg
uz7rdp,38421,21510,935,True,t3_uz7rdp,30,False,897,False,False,False,2y95n,t5_2y95n,221268,Humans have zero chill when it comes to Technology,0.98,https://www.reddit.com/r/HFY/comments/uz7rdp/humans_have_zero_chill_when_it_comes_to_technology/
uz1vwt,5094,37361,1215,True,t3_uz1vwt,177,False,6221,False,False,False,2qmeb,t5_2qmeb,4040575,I'm a biologist and love to draw Pokémon anatomy for fun! Here's my nightmare-fuel take on Tyranitar [OC],0.99,https://i.redd.it/dl93t891o1291.jpg
uzaa5o,15672,4730,809,False,t3_uzaa5o,3,False,598,False,False,False,35pff,t5_35pff,177737,This is Asa at the Smithsonian Zoo! She just turned 8,0.99,https://i.redd.it/vz8bqjdho3291.jpg
uzasqv,1375,6163,783,False,t3_uzasqv,55,False,549,False,False,False,2ra72,t5_2ra72,358695,Not to flex or anything but I'm looking juicier than all your boyfriends. Stick a needle in me.,0.93,https://i.redd.it/4dhi4v88t3291.jpg
uzd9yb,5707,17055,641,False,t3_uzd9yb,22,False,363,False,False,False,38c5p,t5_38c5p,136025,Not my cat has wares if you have coin.,1.0,https://i.redd.it/bf02ef8mi4291.jpg
uz71ur,3294,5364,970,False,t3_uz71ur,15,False,980,False,False,False,2viuz,t5_2viuz,676788,Frozen duck,0.93,https://v.redd.it/19n1tr83ny191
uzbycn,7661,9437,719,False,t3_uzbycn,123,False,3363,False,False,False,43zwn1,t5_43zwn1,787817,This tweet from DLauer got me feeling things. I’m not fuckin leavin! Link to thread in comments 🤜💎🤛🚀🚀🚀,0.98,https://i.redd.it/d7jb7xpm44291.jpg
uz3ufs,8742,3333,1123,False,t3_uz3ufs,73,False,1586,False,False,False,2sqih,t5_2sqih,520987,A Tragic Story of the week.,0.99,https://i.redd.it/do4yrrbi42291.png
uyxtqz,57167,355181,1411,True,t3_uyxtqz,220,False,16363,False,False,False,34ixl,t5_34ixl,2378601,Redrew my apartment as a sunny loft (updated to meet sub rules),0.94,https://i.redd.it/lzs6m9r4p0291.jpg
uyytgh,258,2510,1359,False,t3_uyytgh,166,False,3957,False,False,False,nngwo,t5_nngwo,871179,OH NOOO!1!1! HES LATE!1!1,0.96,https://i.redd.it/hxv87t4gy0291.jpg
uywa1y,1572,3391,62,False,t3_uywa1y,893,False,6158,False,False,False,2qh2p,t5_2qh2p,2723668,I am sick of respecting religion,0.83,https://www.reddit.com/r/atheism/comments/uywa1y/i_am_sick_of_respecting_religion/
uzcvat,1525,25799,665,False,t3_uzcvat,15,False,387,False,False,False,13psmh,t5_13psmh,62835,King Knight (From Shovek Knight),1.0,https://www.reddit.com/gallery/uzcvat
uzaldi,2673,1830,793,False,t3_uzaldi,225,False,566,False,False,False,2vvpi,t5_2vvpi,4166427,I just inherited a 3 pound tub of whole milk ricotta cheese. I need recipes that use A LOT of ricotta please.,0.94,https://www.reddit.com/r/EatCheapAndHealthy/comments/uzaldi/i_just_inherited_a_3_pound_tub_of_whole_milk/
uzb677,1250,28229,762,False,t3_uzb677,11,False,513,False,False,False,2t8ve,t5_2t8ve,114812,God Tier Waifu,0.98,https://i.redd.it/rvuevrosw3291.jpg
uyz11k,3253,22531,1350,False,t3_uyz11k,188,False,3297,False,False,False,3g7sw,t5_3g7sw,257589,"Mom, I wish you could see how much progress I've made as a person. I wish you were still here. Maybe dad wouldn't have such a problem with it, if you were able to talk to him. I miss you and love you!",0.91,https://i.redd.it/wwrrcxz301291.jpg
uywoqx,11425,3160069,37,False,t3_uywoqx,53,False,6063,False,False,False,2xqtc,t5_2xqtc,165786,Feeling futile,0.96,https://i.imgur.com/NTQvYvu.jpeg
uz5lws,70335,11118371,1040,False,t3_uz5lws,85,False,1210,False,False,False,2sbqz,t5_2sbqz,155475,This is what a Democratic majority has accomplished:,0.87,https://i.redd.it/62yz6tq7j2291.png
uyzsl0,82,1340,1313,False,t3_uyzsl0,281,False,2824,False,False,False,2qh1u,t5_2qh1u,29732451,NOFX - The Idiots Are Taking Over [Punk],0.95,https://youtu.be/3kqLVeP7iHA
uz7de5,496377,4087735,954,False,t3_uz7de5,41,False,915,False,False,False,39geq,t5_39geq,276744,Derecho in South Dakota (May 2022),0.99,https://v.redd.it/13i9ppa4y2291
uz96ze,446,1241,865,False,t3_uz96ze,25,False,690,False,False,False,2syto,t5_2syto,2836083,my new camera,0.98,https://i.redd.it/9arg2wgme3291.jpg
uzc23x,1057,1477,714,False,t3_uzc23x,25,False,442,False,False,False,5vinfe,t5_5vinfe,65504,I went to the Grove in L. A. but only seem to remember getting out and then back into my car,0.98,https://www.reddit.com/gallery/uzc23x
uzbraw,9844,642775,731,False,t3_uzbraw,17,False,468,False,False,False,2tsps,t5_2tsps,383557,hype,0.99,https://v.redd.it/5ibogwi014291
uz5ioz,15105,5014,1044,False,t3_uz5ioz,61,False,1231,False,False,False,2zvvb,t5_2zvvb,310001,"Russia has a democratic ruling party, but with no elections, oh and also there is 100% communist support. (no mods)",0.99,https://i.redd.it/hy7gemjki2291.png
uz74d3,60,786,967,False,t3_uz74d3,14,False,956,False,False,False,2se5q,t5_2se5q,663080,Lavender sheer jelly💜,0.99,https://i.redd.it/hjzimy2iw2291.jpg
uz748g,13,17508,967,False,t3_uz748g,13,False,962,False,False,False,40vn2t,t5_40vn2t,104226,Battle of the Two Clans.,0.97,https://i.redd.it/8dbea3efw2291.jpg
uz6abo,7102,2722,1007,False,t3_uz6abo,30,False,1099,False,False,False,2qvi5,t5_2qvi5,112232,yes,0.96,https://i.redd.it/wsve99qep2291.gif
uz3rr8,13531,55769,1128,True,t3_uz3rr8,190,False,13088,False,False,False,2qh0u,t5_2qh0u,29005777,Rural Wisconsin ditches now contain 16 less bags of trash than they did before.,0.97,https://i.redd.it/72cwgpvp32291.jpg
