post_id,author_comment_karma,author_link_karma,time_in_mins,post_is_original_content,post_name,post_num_comments,post_over_18,post_score,post_has_link,post_spoiler,post_stickied,subreddit_id,subreddit_name,subreddit_subscriber_count,post_title,post_upvote_ratio,post_url
uz5dmy,99219,101262,1071,False,t3_uz5dmy,153,False,959,False,False,False,h6jkg,t5_h6jkg,145696,Asked on a “1776 Restoration Movement” page if he can join The People’s Convoy.,0.96,https://i.redd.it/u403r0cjg2291.jpg
uzakg5,12376,39159,815,False,t3_uzakg5,9,False,442,False,False,False,mv490,t5_mv490,87215,(Self) Mermista with her hair down,0.99,https://i.redd.it/lyo5okk5r3291.jpg
uyws2r,2315,67427,52,True,t3_uyws2r,35,False,3673,False,False,False,2sbzt,t5_2sbzt,357865,"King of Devotion, digital illustration by me.",0.98,https://i.redd.it/g0yeml58e0291.jpg
uyxcz8,28226,198371,18,False,t3_uyxcz8,81,False,3443,False,False,False,2um6i,t5_2um6i,257356,J'ai attendu les 36h réglementaires avant de pouvoir composter ce meme,0.96,https://i.redd.it/bg4f385gk0291.png
uz5m7k,2320,243024,1059,False,t3_uz5m7k,48,False,2314,False,False,False,3ptdy,t5_3ptdy,167460,Le awkward cosplay selfie ✌️,0.98,https://i.redd.it/ohrrtdv1i2291.jpg
uz4gku,346,1121,1115,False,t3_uz4gku,77,False,1094,False,False,False,2qhlh,t5_2qhlh,19813901,"""Storage"" (2022) This film follows my journey of buying abandoned or unpaid storage units in online auctions. The process and the conflicted feelings that arise from doing it. [00:15:03]",0.91,https://youtu.be/XVqPcQGFQr0
uyzb3q,4887,4747,1356,False,t3_uyzb3q,167,False,2378,False,False,False,2qhbp,t5_2qhbp,199911,"2 weeks ago, we were talking and laughing as I helped him with his university application. 1 week ago, the police knocked our door at midnight to tell us he passed away in a car accident. Today, we buried him and put him to rest. Please make dua for my 17-year-old younger brother.",0.96,https://i.redd.it/zfrmrngm21291.jpg
uyy7yh,959,17696,1411,False,t3_uyy7yh,104,False,2937,False,False,False,3c0ex,t5_3c0ex,33702,dispenso título,0.98,https://v.redd.it/me2wy3nus0291
uz8br6,9557,24739,929,False,t3_uz8br6,53,False,1520,False,False,False,2w6fe,t5_2w6fe,2107049,Not this intro bro,0.96,https://v.redd.it/wa685aku63291
uzc0tf,585,578,736,False,t3_uzc0tf,25,False,816,False,False,False,2qj5n,t5_2qj5n,7327602,"When your buns are stale, but you have a rice cooker",0.94,https://i.imgur.com/IIHKSmA.jpg
uzbqo7,147,314,752,False,t3_uzbqo7,59,False,357,False,False,False,2s0df,t5_2s0df,439877,Can’t wait to see them roaming Galaxy’s Edge!!!!!,0.98,https://i.redd.it/tzuo207g24291.jpg
uz1b34,1872,20511,1261,False,t3_uz1b34,47,False,1761,False,False,False,34fix,t5_34fix,136432,I'll just leave this here. Don't ask me for the sauce...I don't have it.,0.98,https://i.redd.it/wky1nefkj1291.jpg
uz6wfd,1,537,998,False,t3_uz6wfd,33,False,762,False,False,False,2taso,t5_2taso,96241,A true friend,0.99,https://i.redd.it/pwbvhh1mu2291.jpg
uzcr5u,263,170,693,False,t3_uzcr5u,44,False,298,False,False,False,2riyy,t5_2riyy,211524,Aaahhh…So they finally admit it!!,0.97,https://i.redd.it/7ww1c2zzc4291.jpg
uyupv7,3,24635,189,False,t3_uyupv7,448,False,5836,False,False,False,2qhpn,t5_2qhpn,890235,MacKenzie Scott has Donated more than $12 Billion to more than 1200 Non-Profit Organizations,0.95,https://www.streamingrant.com/news/mackenzie-scott-has-donated-more-than-12-billion-to-over-1200-non-profit-organizations/
uyyjg1,58017,24628,1395,False,t3_uyyjg1,50,False,2636,False,False,False,2qwza,t5_2qwza,219993,Found this as I was losing my faith in humanity,0.98,https://i.redd.it/swdsue6uv0291.jpg
uzcc8e,74661,492575,718,False,t3_uzcc8e,64,False,317,False,False,False,2qlht,t5_2qlht,406892,C5N haciendo de las suyas,0.97,https://i.redd.it/yoztrjfi84291.jpg
uz65jb,-29,7855,1034,False,t3_uz65jb,8,False,854,False,False,False,4ha1cb,t5_4ha1cb,56392,Bully minorities,0.98,https://i.redd.it/5othlhc9o2291.jpg
uz7t0l,24696,125557,954,False,t3_uz7t0l,11,False,662,False,False,False,3i218,t5_3i218,83220,POV: Lucoa asked you if she's more beautiful without her horns (ﾉ∀`♥),1.0,https://i.redd.it/4tsbud1023291.jpg
uyzjhn,24184,246619,1345,False,t3_uyzjhn,45,False,2313,False,False,False,flhe9,t5_flhe9,259147,they made it feelsstrongman,0.98,https://i.redd.it/0n2evz2n41291.jpg
uz8490,5606,1692,939,False,t3_uz8490,207,False,633,False,False,False,2qnvz,t5_2qnvz,146062,This sub has to get over it's terminal lefty-phobia,0.85,https://www.reddit.com/r/Destiny/comments/uz8490/this_sub_has_to_get_over_its_terminal_leftyphobia/
uz3rda,6520,58677,1148,False,t3_uz3rda,44,False,1207,False,False,False,2wvqt,t5_2wvqt,265138,"Not the Sea, but you might want to see",0.99,https://v.redd.it/vmii9owmew191
uzcmpz,441,11110,701,False,t3_uzcmpz,17,False,304,False,False,False,2rnwo,t5_2rnwo,1674740,Honda Odyssey Minivan Solar Kitchen Build,0.98,https://v.redd.it/ejxnes0mb4291
uz5zod,1932,25425,1042,False,t3_uz5zod,28,False,866,False,False,False,2t4vd,t5_2t4vd,222857,Korrasami! 💙❤️,0.98,https://www.reddit.com/gallery/uz5zod
uz3fpi,1784,78250,1164,False,t3_uz3fpi,29,False,1309,False,False,False,3fuwj,t5_3fuwj,125481,Learn from the past,0.84,https://i.redd.it/4331vbhz02291.png
uzb6wk,2464,102979,782,False,t3_uzb6wk,9,False,392,False,False,False,2qh24,t5_2qh24,419848,Two little watercolors,0.98,https://www.reddit.com/gallery/uzb6wk
uza8pc,5952,5798,833,False,t3_uza8pc,29,False,450,False,False,False,2v8c6,t5_2v8c6,87643,Parece meme pero es anécdota,0.98,https://i.redd.it/lacc5vz4o3291.png
uz6t5l,2819,51186,1003,False,t3_uz6t5l,17,False,756,False,False,False,2s8lc,t5_2s8lc,2343986,Woods babysitting out of the rain while I clean the brooder,0.98,https://i.redd.it/0ftf11j7s2291.jpg
uz6tq3,46,666,1002,False,t3_uz6tq3,10,False,765,False,False,False,34hxo,t5_34hxo,362278,Rest of the puzzle solution,0.98,https://i.redd.it/gfq0ncazt2291.jpg
uz3908,92714,267934,1173,False,t3_uz3908,21,False,1297,False,False,False,3l3ou0,t5_3l3ou0,71929,New Weapon,0.99,https://i.redd.it/wkuhomwgz1291.jpg
uz8yzq,912,10321,897,False,t3_uz8yzq,18,False,1330,False,False,False,2twpw,t5_2twpw,392576,Tummy rub now plz *snap snap*,0.99,https://i.redd.it/yrtor01lc3291.jpg
uyxae3,21270,20478,23,False,t3_uyxae3,57,True,3275,False,False,False,2qh9a,t5_2qh9a,1207606,Based,0.97,https://i.redd.it/82sh3a1pj0291.jpg
uzdbyv,17040,13997,659,False,t3_uzdbyv,53,False,648,False,False,False,2uii8,t5_2uii8,2601414,One thing I hope the new Daredevil show does is keep the traditional “one take” fight scene. Too iconic to leave out,0.98,https://i.redd.it/5cnm93o6j4291.jpg
uz843o,38342,772279,940,False,t3_uz843o,5,False,627,False,False,False,2sd7q,t5_2sd7q,166852,Wild side,0.98,https://www.reddit.com/gallery/uz843o
uyxnfz,798,2713,2,False,t3_uyxnfz,42,False,3059,False,False,False,2tfso,t5_2tfso,354545,"Foden, Haaland and Pep next season after they get knocked out of the champions league again.",0.99,https://i.redd.it/2b5qp62in0291.jpg
uz76zv,73,1334,984,False,t3_uz76zv,80,False,720,False,False,False,3ibn9,t5_3ibn9,71311,anyone want to go on a picnic date?,0.96,https://i.redd.it/knyday65x2291.jpg
uytpg5,3571,211635,263,False,t3_uytpg5,130,False,8321,False,False,False,3abi4,t5_3abi4,773153,a smidgen of context in the comments,0.97,https://i.redd.it/36fbojnxcz191.jpg
uz7pwj,43,321,959,False,t3_uz7pwj,17,False,662,False,False,False,2qutz,t5_2qutz,185842,Good morning brisbane,0.99,https://i.redd.it/1b93u13r13291.jpg
uz2acx,125039,116627,1218,False,t3_uz2acx,183,False,1482,False,False,False,2qmoq,t5_2qmoq,172013,hey it ryhmes,0.97,https://i.redd.it/lkeir0rfr1291.jpg
uz9tw9,13899,54870,854,False,t3_uz9tw9,4,False,483,False,False,False,3e93l,t5_3e93l,229731,When your life’s a series of bad days.,0.99,https://i.redd.it/49lz05cdk3291.jpg
uz0pbf,1476,2904,1291,False,t3_uz0pbf,291,False,5092,False,False,False,2xh58,t5_2xh58,3622462,'You Just Saved a Life': Kind Stranger Brings Starbucks Barista to Tears in Life-Changing Interaction,0.92,https://www.entrepreneur.com/article/428298
uyz4eo,841,13296,1366,False,t3_uyz4eo,26,False,2399,False,False,False,320u5,t5_320u5,278491,"""Hit it hard""",0.98,https://v.redd.it/uqyv354011291
uz3u05,741,1236,1146,False,t3_uz3u05,55,False,1170,False,False,False,2tqcj,t5_2tqcj,214081,red ross? i prefer red monica,0.97,https://i.redd.it/1u6r3r6e42291.jpg
uz7n09,88547,22939,962,False,t3_uz7n09,116,False,663,False,False,False,39u79,t5_39u79,61371,If you protest when cops kill people... *checks notes* they'll let children die?,0.95,https://i.redd.it/37mund5413291.jpg
uz4b4h,6714,49799,1123,False,t3_uz4b4h,97,False,2784,False,False,False,3gdh7,t5_3gdh7,6850744,🔥 This Embrogynesis of Dolphin and human from another sub seem scary after seeing the video of Dolphins getting high from 🐡,0.97,https://i.redd.it/anp3f5in72291.gif
uyzmoc,14209,199433,1342,False,t3_uyzmoc,13,False,2379,False,False,False,2xd5g,t5_2xd5g,2557896,Spidemen tinder in real life,0.98,https://i.redd.it/ok37tdrd51291.jpg
uze9ye,2620,5282,602,False,t3_uze9ye,7,False,219,False,False,False,2s6dm,t5_2s6dm,196196,This show has way too many untouched meme templates.,0.97,https://i.redd.it/g5k8vlkgt4291.jpg
uz7c9g,90,2001,977,False,t3_uz7c9g,18,False,698,False,False,False,3f1fs,t5_3f1fs,220703,"""The smartest man alive""",0.99,https://i.redd.it/pqb4ikjgy2291.jpg
uz788p,1021,1586,983,False,t3_uz788p,95,False,1729,False,False,False,o7cng,t5_o7cng,872358,Huh.,0.98,https://i.imgur.com/JhhkwOo.jpg
uz3z92,2230,2600,1139,False,t3_uz3z92,14,False,1138,False,False,False,3lacy,t5_3lacy,110605,W-Whats that?,0.99,https://i.redd.it/m2osdo0752291.gif
uz0cs1,4075,1377,1308,False,t3_uz0cs1,11,True,1990,False,True,False,3on1q,t5_3on1q,726617,💀,0.99,https://i.redd.it/wnr5cvygb1291.jpg
uz6aow,1257,8733,1028,False,t3_uz6aow,62,False,811,False,False,False,2qlq3,t5_2qlq3,225734,Nyt rapussa tuoksuu leipomolta,0.98,https://i.redd.it/0na0nbo4o2291.jpg
uzama6,594,364,814,False,t3_uzama6,9,False,417,False,False,False,37aix,t5_37aix,617649,Woof irl,0.99,https://i.redd.it/3uky882or3291.jpg
uzfdu3,4170,84426,533,False,t3_uzfdu3,2,False,184,False,False,False,2z9ds,t5_2z9ds,337999,Dad's who don't want dogs and dogs have unbreakable bonds.,0.99,https://v.redd.it/6kg8su7o55291
uzcqik,15963,93775,695,False,t3_uzcqik,5,False,297,False,False,False,2qkvl,t5_2qkvl,1926090,An Abandoned House that was Built in 1966 with an 80s Addition!!,0.99,https://www.reddit.com/gallery/uzcqik
uzbfji,7891,4267,770,False,t3_uzbfji,33,False,368,False,False,False,2s5sb,t5_2s5sb,338428,"Babe Wake up, new clips of Off-season Scottie Barnes 😮‍💨👌🏽",0.98,https://v.redd.it/olv91vzfz3291
uz83bz,134773,194472,942,False,t3_uz83bz,11,False,617,False,False,False,1476rf,t5_1476rf,41342,WHY DADDY ATLUS NO GOOD ANOUNCMENT,1.0,https://i.redd.it/yv0iakox43291.jpg
uz21wm,2446,17103,1230,False,t3_uz21wm,12,False,1496,False,False,False,306sc,t5_306sc,402722,"Teeniest, weeniest, Beaniest of bleps.",1.0,https://i.imgur.com/6rqugMq.jpg
uz2637,1420,38437,1225,False,t3_uz2637,92,False,3805,False,False,False,2qh7a,t5_2qh7a,20692746,"Pencil drawing, duomo do millani door, by me, 2022",0.99,https://i.redd.it/xeofmhfgq1291.jpg
uz5ief,14278,2009,1067,False,t3_uz5ief,152,False,898,False,False,False,2y2r8,t5_2y2r8,813300,Who did you the dirtiest this application season?,0.99,https://www.reddit.com/r/ApplyingToCollege/comments/uz5ief/who_did_you_the_dirtiest_this_application_season/
uz0u6j,4728,17274,1287,False,t3_uz0u6j,86,False,1766,False,False,False,u8wq5,t5_u8wq5,487480,"Still love this scene, but anyone else catch this?",0.95,https://v.redd.it/qj5h89yye1291
uz5udb,221,1817,1052,False,t3_uz5udb,21,False,850,False,False,False,346cl,t5_346cl,517559,“i’d like to speak to the manager”,0.98,https://www.reddit.com/gallery/uz5udb
uz10g9,271,1620,1279,False,t3_uz10g9,58,False,1736,False,False,False,2qiep,t5_2qiep,880057,"HungryBox, Riddles, and Sonix came to play at my local last night ahead of Momocon in Atlanta. Pretty cool guys.",0.98,https://www.reddit.com/gallery/uz10g9
uz7qbi,6645,5610,961,False,t3_uz7qbi,171,False,1594,False,False,False,3fmt2,t5_3fmt2,332612,Oh hell nah 💀💀😭😭,0.97,https://i.redd.it/wumjbvcs13291.png
uz2wph,577,1791,1193,False,t3_uz2wph,20,False,1319,False,False,False,3bbsj,t5_3bbsj,50410,Eu_nvr,0.99,https://v.redd.it/fip5jhmmw1291
uzemdb,1796,4568,584,False,t3_uzemdb,11,False,207,False,False,False,2ef8gf,t5_2ef8gf,64681,"My most recent fanart is for Elira, hope you like it",0.99,https://www.reddit.com/gallery/uzemdb
uzexuc,2433,11901,564,False,t3_uzexuc,9,False,191,False,False,False,2u28p,t5_2u28p,313095,bad!!!,0.82,https://i.redd.it/3fehld0x05291.jpg
uzapsm,2798,46843,813,True,t3_uzapsm,65,False,404,False,False,False,3n607,t5_3n607,89883,"I don't need sleep, I need answers",0.99,https://i.redd.it/aagkij3fs3291.png
uyvlky,8731,18836,132,True,t3_uyvlky,50,False,5228,False,False,False,plyak,t5_plyak,805859,Got a new one whipped up for you. [OC],0.97,https://i.redd.it/iljqnoa510291.jpg
uz64z6,207972,735610,1040,False,t3_uz64z6,44,False,2031,False,False,False,2qh6p,t5_2qh6p,966544,Where was I?,0.78,https://i.imgur.com/nhKYbQu.jpg
uz6crj,64,1625,1030,False,t3_uz6crj,36,False,784,False,False,False,31hpy,t5_31hpy,82722,Apparently BASIL is good in smoothies...,1.0,https://i.redd.it/ih9gqyxvp2291.png
uz2q9p,4028,9017,1203,True,t3_uz2q9p,86,False,1329,False,False,False,2v94d,t5_2v94d,303666,We don't buy Drake ships because we need to but because we have to.,0.98,https://v.redd.it/8676ixsdw0291
uz83t4,157813,551574,946,False,t3_uz83t4,305,False,1468,False,False,False,2sljg,t5_2sljg,632258,Tay Conti: This is absurd. His name is DUSTIN DOLEZAL and he’s been threatening Sammy and I since January. He writes us EVERY SINGLE DAY and apparently planning to do something with us in June. I’m taking legally precautions but if something happens to us y’all know who to look for.,0.96,https://twitter.com/tayconti_/status/1530297409548558342?s=21&t=TsOhAwZxXHckj6eaiq1puA
uzecvl,17,4967,603,False,t3_uzecvl,68,False,217,False,False,False,igfxt,t5_igfxt,122149,can you guess what they were watching,0.98,https://i.redd.it/ocj4s77au4291.jpg
uz2mdo,7,1586,1208,False,t3_uz2mdo,96,False,3455,False,False,False,2rfxx,t5_2rfxx,5854573,Trundle trying very hard to kill me,0.97,https://v.redd.it/2pazwlrvt1291
uzccws,267,855,724,False,t3_uzccws,24,False,303,False,False,False,2qh0z,t5_2qh0z,146287,Has no one realized the meme potential?,0.97,https://i.redd.it/fads21kq84291.png
uzb7ww,2376,1809,787,False,t3_uzb7ww,11,False,368,False,False,False,2qhmx,t5_2qhmx,369394,Beautiful evening in Asheville,0.99,https://i.redd.it/wlg5i8cgx3291.jpg
uz0gsd,12821,61560,1308,False,t3_uz0gsd,18,False,1847,False,False,False,2s3jo,t5_2s3jo,265573,Send him to the realm of darkness!,0.99,https://i.redd.it/ff44aacgc1291.gif
uzd33c,418,15871,680,False,t3_uzd33c,0,False,266,False,False,False,116qz7,t5_116qz7,86357,"Attack eyes, followed by hunting a pawrent.",1.0,https://v.redd.it/ioj45tyfg4291
uzcafk,0,204,727,False,t3_uzcafk,10,False,309,False,False,False,3m9q1,t5_3m9q1,89446,When the twitch notification doesn't go off,0.97,https://i.redd.it/hq2wfg1584291.jpg
uzdk1t,15198,73523,652,False,t3_uzdk1t,41,False,246,False,False,False,2t776,t5_2t776,379894,You hear that trans people? You’re impressionable!,0.92,https://i.redd.it/vapvi85kl4291.jpg
uz7pnp,456,10887,965,False,t3_uz7pnp,81,False,634,False,True,False,3adlm,t5_3adlm,622738,Season 4 Volume 2 | Teaser Trailer | Netflix,0.98,https://v.redd.it/82pc6acf13291
uz4fo8,6866,18997,1124,False,t3_uz4fo8,51,False,1032,False,False,False,11dpd1,t5_11dpd1,66261,I think you’ll like my Union based Warhammer army with a kit bashed Sherman tank,0.98,https://i.redd.it/uar3v2pg92291.jpg
uz2sjn,4624560,9169083,1201,False,t3_uz2sjn,144,False,3399,False,False,False,39d7x,t5_39d7x,278368,Scheherazade,0.95,https://i.redd.it/ec39droev1291.jpg
uz8j2q,4185,1499,926,False,t3_uz8j2q,2,False,570,False,False,False,29vcoe,t5_29vcoe,54969,goddess,0.96,https://i.redd.it/507yzxdtz2291.jpg
uz6jbq,2108,39534,1022,False,t3_uz6jbq,4,False,750,False,False,False,3b5ss,t5_3b5ss,488037,absolutelynotme_irl,0.99,https://i.redd.it/7yls5sxrzz191.gif
uzbtzs,167,486,754,False,t3_uzbtzs,6,False,327,False,False,False,38nec,t5_38nec,165268,Sunrise at Arches National Park,0.99,https://i.redd.it/y6bxai1e34291.jpg
uyyzf8,42186,48149,1380,False,t3_uyyzf8,45,False,2266,False,False,False,2qh2w,t5_2qh2w,426807,Point of No Return,0.96,https://i.redd.it/6flhh6vrfz191.png
uz6lk8,8331,36571,1020,False,t3_uz6lk8,17,False,1870,False,False,False,n82s4,t5_n82s4,336915,Le firefighter has arrived,1.0,https://www.reddit.com/gallery/uz6lk8
uzd1ob,178,950,683,False,t3_uzd1ob,10,True,660,False,False,False,3n7fs,t5_3n7fs,1601442,AAAAAAHHHHH,0.98,https://v.redd.it/l32ouy0vf4291
uz8cgo,8082,7002,936,True,t3_uz8cgo,70,False,1390,False,False,False,3boqz,t5_3boqz,2124852,"Sorry, I'm not PC Manufacturer support, please stop calling!",0.97,https://www.reddit.com/r/MaliciousCompliance/comments/uz8cgo/sorry_im_not_pc_manufacturer_support_please_stop/
uzaj2q,30573,24344,825,False,t3_uzaj2q,15,False,408,False,False,False,2vcc3,t5_2vcc3,106623,Zeke on Pandy's lap (art by @milky_tossy),0.98,https://i.redd.it/5stqf0blq3291.jpg
uz5d9k,19505,25631,1079,False,t3_uz5d9k,12,False,889,False,False,False,2upwb,t5_2upwb,66848,Little thing me and my shop teacher made,0.99,https://i.redd.it/96kyxnm9h2291.jpg
uz3kal,4058,97455,1165,False,t3_uz3kal,100,False,1158,False,False,False,2qhe0,t5_2qhe0,497828,RR qualify for first final since being the inaugural season champion under Shane Warne in 2008,0.98,https://i.imgur.com/GADaWyh.jpg
uzblj2,19655,91383,768,False,t3_uzblj2,45,False,343,False,False,False,2yokk,t5_2yokk,1062734,"True urban hell to urban well. Adams street at 17th Avenue, Gary, Indiana 1987 to now",0.96,https://www.reddit.com/gallery/uzblj2
uz5rnl,9727,42348,1060,False,t3_uz5rnl,7,False,839,False,False,False,33f6p,t5_33f6p,381068,"""for more information on lung cancer, keep smoking.""",0.98,https://i.redd.it/8i20zgmxk2291.png
uz6i70,101,730,1024,False,t3_uz6i70,30,False,743,False,False,False,2smr1,t5_2smr1,1459137,My aerocapture was a bit closer than expected,1.0,https://v.redd.it/y2yppf6tq2291
uz62ul,3439,2659,1045,False,t3_uz62ul,48,False,796,False,False,False,2y1rb,t5_2y1rb,138548,The Average Amber Heard Fan vs the Average Johnny Depp Enjoyer,0.94,https://v.redd.it/bsaouu6bn2291
uyz4v8,5591,144351,1373,False,t3_uyz4v8,244,False,2197,False,False,False,2qh1s,t5_2qh1s,2206687,The Fed’s favorite inflation measure rose 4.9% in April in a sign that price increases could be slowing,0.95,https://www.cnbc.com/2022/05/27/the-feds-preferred-gauge-shows-inflation-rose-4point9percent-in-april-in-a-sign-that-price-increases-could-be-slowing.html
uz8t12,2,1914,913,False,t3_uz8t12,23,False,1279,False,False,False,2u4lp,t5_2u4lp,2602726,SQUANCH,0.99,https://i.redd.it/k4xfi4u6b3291.jpg
uz38vm,4967,130184,1180,False,t3_uz38vm,26,False,1213,False,False,False,s0nyv,t5_s0nyv,258454,"May 16, 1992 Chalino Sanchez performed in Culiacán. Just before singing the song “Alma Enamorada” he was handed a note informing him he would be killed by cartel assassins after the show. He proceeded to finish his performance and was executed shortly after.",0.98,https://v.redd.it/196s3hg8z1291
uz3pge,6650,11959,1158,False,t3_uz3pge,19,False,1121,False,False,False,2tfln,t5_2tfln,235979,EVERY... GOD DAMN... DAY.,0.95,https://i.redd.it/hw5l2o8d32291.jpg
uz666c,54,438,1040,False,t3_uz666c,48,False,780,False,False,False,iuzv7,t5_iuzv7,76133,My Tagilla costume got front and center of my highschool yearbooks costume page,0.99,https://i.redd.it/tasol0veo2291.jpg
uz9o8q,194,403,870,False,t3_uz9o8q,7,False,468,False,False,False,3el0q,t5_3el0q,264551,"""JuSt PlAY BeTtER""",0.99,https://i.redd.it/utq6dbcti3291.jpg
uyxph8,760,4074,6,False,t3_uyxph8,20,False,3003,False,False,False,3o6xm,t5_3o6xm,609698,Batman 🤓,0.98,https://i.redd.it/85lrxvf1o0291.jpg
uz4mhz,654,1715,1115,False,t3_uz4mhz,9,False,982,False,False,False,2qont,t5_2qont,172044,At a beer garden and I look over and see this lovely,0.98,https://www.reddit.com/gallery/uz4mhz
uyz5ls,5788,9538,1372,False,t3_uyz5ls,44,False,2220,False,False,False,331rj,t5_331rj,414477,Slowly growing,0.99,https://i.redd.it/jm9sc0oq01291.gif
uz35og,830,79511,1185,False,t3_uz35og,19,False,1214,False,False,False,2vns9,t5_2vns9,101759,"i hate that she gets more and more chances to lie,and then lie about lying,not to mention covering up all lies.",0.95,https://i.redd.it/a5qgzruny1291.png
uzam9h,4421,929,821,False,t3_uzam9h,13,False,403,False,False,False,2abod4,t5_2abod4,311147,Gotta be creative with the decoys,0.99,https://v.redd.it/giyym8egr3291
uz82v3,10449,9293,949,False,t3_uz82v3,84,False,590,False,False,False,fx5gt,t5_fx5gt,111092,Extra beef on the side,0.98,https://v.redd.it/uzxxde8t43291
uz8my1,100980,46063,922,False,t3_uz8my1,14,False,1297,False,False,False,2qhm7,t5_2qhm7,869850,I made a Lego Geodude,1.0,https://www.reddit.com/gallery/uz8my1
uz9rwg,3298,2244,865,False,t3_uz9rwg,50,False,452,False,False,False,3d2z7,t5_3d2z7,53188,Guess which dogs shouldn’t be around children (hint) They’re called “nanny dogs” 🙄😂,0.9,https://v.redd.it/ziunva0uj3291
uzd9pq,14,398,670,False,t3_uzd9pq,7,False,255,False,False,False,2rdw8,t5_2rdw8,596491,"He didn’t get any of our food, and he is being really dramatic about it",0.98,https://i.redd.it/0q6f3bljfg411.jpg
uz2irf,3292,37641,1215,False,t3_uz2irf,65,False,1331,False,False,False,2clyzt,t5_2clyzt,1069466,Doctors Hate him! He Went from 0.5 kd to 5 kd Using this one Simple Trick,0.97,https://v.redd.it/ltg9t0rrs1291
uzc1ne,0,208,743,False,t3_uzc1ne,7,False,313,False,False,False,2tna8,t5_2tna8,652603,Father and daughter,0.96,https://v.redd.it/g8y6m6y754291
uz3q3i,169,3193,1158,False,t3_uz3q3i,23,False,1112,False,False,False,y8c63,t5_y8c63,49807,Kids these days (FUCK),0.98,https://i.redd.it/ynt5jw3c32291.png
uz5l0l,13031,730,1070,False,t3_uz5l0l,43,False,850,False,False,False,2qmxz,t5_2qmxz,674223,I call it harden cumpo’s,0.97,https://i.redd.it/nhzrqjvbj2291.jpg
uza6s6,8191,3777,844,False,t3_uza6s6,61,False,417,False,False,False,2z8fuj,t5_2z8fuj,103960,"For me, it's the jarring mix of fonts that makes it look disingenuous",1.0,https://i.redd.it/1a4hl3zmn3291.jpg
uz2fli,11234,40888,1219,False,t3_uz2fli,215,False,1336,False,False,False,2si8i,t5_2si8i,877373,"What is this ""weed"" that I'm totally letting take over my lawn because it is super soft and pretty and doesn't grow tall? South Central Canada",0.99,https://i.redd.it/j8yjwjuns1291.jpg
uz5oi7,16585,15275,1065,False,t3_uz5oi7,12,False,833,False,False,False,3eyx3,t5_3eyx3,336505,Pov: Pablo on Face-time asking what your plans are for tonite,1.0,https://v.redd.it/bs7zm4zxj2291
uz1req,18524,60003,1250,False,t3_uz1req,44,False,1472,False,False,False,2vxf7,t5_2vxf7,72056,"Yesterday, all my troubles seemed so far away",0.99,https://i.redd.it/mxypnla4n1291.gif
uz9d4v,8760,1622,894,False,t3_uz9d4v,30,False,2848,False,False,False,p3r73,t5_p3r73,536168,Saw this on Quora and felt like you'd all appreciate it as much as I did.,0.99,https://i.redd.it/0z4ixsr3g3291.jpg
uzclam,40708,118042,711,False,t3_uzclam,29,False,684,False,False,False,mvcq5,t5_mvcq5,1234348,He just wanted a friend.,0.98,https://v.redd.it/ybx2e4y2b4291
uz5pox,95640,66657,1063,False,t3_uz5pox,55,False,821,False,False,False,2qhr3,t5_2qhr3,960535,"Awhile back I posted a pic of a VW Polo Harlekin, stating that it was a very rare sight in the United States. What's an even rarer sight? Two of them.",0.98,https://i.redd.it/zkckapztj2291.jpg
uz908k,278,32386,904,False,t3_uz908k,151,False,502,False,True,False,2g5ach,t5_2g5ach,159326,The Guard vs TSM / VCT North America 2022 - Stage 2 Challengers - Group Stage / Post-Match Thread,0.98,https://www.reddit.com/r/ValorantCompetitive/comments/uz908k/the_guard_vs_tsm_vct_north_america_2022_stage_2/
uz0zaz,8800,43913,1286,False,t3_uz0zaz,94,False,1649,False,False,False,2rr0e,t5_2rr0e,121789,My respect for Liverpool 📈📈📈,0.97,https://i.redd.it/ccfnjo3ug1291.jpg
uzdb9w,1978988,137398,668,False,t3_uzdb9w,3,False,248,False,False,False,38rmh,t5_38rmh,401486,"DO YOU LIKE MY COSTUME? I AM VERY PROFICIENT AT WRITING SOCIAL MEDIA COMMENTS. THIS IS A COSTUME, I AM THE HUMAN INSIDE OF THE COSTUME.",0.99,https://i.redd.it/kdo9o9ckz1291.jpg
uz5d3y,1835,6053,1081,False,t3_uz5d3y,19,False,863,False,False,False,33939w,t5_33939w,34763,First Official Look At The Nyanners Nendoroid,0.98,https://i.redd.it/4cb245veh2291.jpg
uzbnoo,1017,26238,766,False,t3_uzbnoo,6,False,332,False,False,False,3isai,t5_3isai,239166,The Wildlands,0.99,https://i.redd.it/d1kq8a3e14291.jpg
uz6g61,3,533,1028,False,t3_uz6g61,3,False,741,False,False,False,swhbd,t5_swhbd,185113,Sweet sweet LUNA,0.97,https://i.redd.it/hgd1tl7uq2291.jpg
uz8ub3,96570,11369,912,False,t3_uz8ub3,29,False,519,False,False,False,38oz1,t5_38oz1,451918,Why fight over Golden Sands when we can unite in destroying dagertooth?,0.98,https://i.redd.it/a1zqfbpib3291.jpg
uzd03q,161180,26206,687,False,t3_uzd03q,53,False,256,False,False,False,2r78m,t5_2r78m,121687,Nostalgia Box broken into overnight,0.99,https://i.imgur.com/7OTHAaS.jpg
uz5jnv,12156,5060,1072,False,t3_uz5jnv,26,False,842,False,False,False,2td8l,t5_2td8l,405097,Avocatto,0.99,https://i.redd.it/6l0inza0j2291.jpg
uzcsfi,37807,973,700,False,t3_uzcsfi,12,False,276,False,False,False,282xv9,t5_282xv9,84703,I can't be the only one who thinks this.,0.98,https://i.redd.it/bgfytxodd4291.jpg
uz8ngt,15449,5735,922,False,t3_uz8ngt,71,False,521,False,False,False,2ryfq,t5_2ryfq,42109,Meet Gene!,0.99,https://www.reddit.com/gallery/uz8ngt
uz9qvz,16,1697,867,False,t3_uz9qvz,25,False,1075,False,False,False,kcmhp,t5_kcmhp,455299,WARNING,0.98,https://i.redd.it/411e2fojj3291.jpg
