post_id,author_comment_karma,author_link_karma,time_in_mins,post_is_original_content,post_name,post_num_comments,post_over_18,post_score,post_has_link,post_spoiler,post_stickied,subreddit_id,subreddit_name,subreddit_subscriber_count,post_title,post_upvote_ratio,post_url
uz8935,15541,60892,665,False,t3_uz8935,842,False,47197,False,False,False,35n7t,t5_35n7t,2536337,Cops don't help,0.94,https://i.redd.it/hmyphrd963291.jpg
uz7wjk,58678,6272,682,False,t3_uz7wjk,2007,False,20288,False,False,False,2qh3l,t5_2qh3l,24719676,Uvalde school police chief identified as commander who decided not to breach classroom,0.97,https://www.cnn.com/us/live-news/texas-elementary-school-shooting-05-27-22/h_aabca871ba934fa48726a8d5e5c12eac
uz88xi,3302,6450,666,False,t3_uz88xi,988,False,13857,False,False,False,2qnts,t5_2qnts,21410219,Police didn't immediately confront the gunman as Texas school shooting unfolded because they 'could've been shot',0.97,https://www.insider.com/texas-shooting-police-didnt-immediately-confront-gunman-lieutenant-explains-2022-5
uz6jv0,230,6754,748,False,t3_uz6jv0,555,False,20928,False,False,False,35fmc,t5_35fmc,2315682,Customer is upset that a mattress store won’t… help them move…?,0.97,https://i.redd.it/p1tbj9lnr2291.jpg
uz626e,28965,6418,772,False,t3_uz626e,897,False,26027,False,False,False,2y77d,t5_2y77d,1956757,Cops trying to join the movement.,0.95,https://i.redd.it/zsbadixgn2291.jpg
uz89iz,16151,34236,666,False,t3_uz89iz,415,False,12953,False,False,False,qir9n,t5_qir9n,3090725,The thin blue line,0.95,https://i.redd.it/8g06ywgd63291.jpg
uz7zif,488,14043,680,False,t3_uz7zif,78,False,10730,False,False,False,2qt55,t5_2qt55,21463010,A smooth criminal,0.92,https://i.redd.it/63pr76a043291.gif
uz5ra3,8808,9185,788,False,t3_uz5ra3,450,False,31013,False,False,False,2sf2b,t5_2sf2b,536526,The worst person you know just had a good take,0.95,https://i.imgur.com/n13gEgi.jpg
uz9bud,0,3833,615,True,t3_uz9bud,142,False,10224,False,False,False,2r05i,t5_2r05i,6567881,Stop Motion Animation,0.98,https://v.redd.it/wzllptrmf3291
uz75f2,67717,112831,722,False,t3_uz75f2,2926,False,35760,False,False,False,2qh03,t5_2qh03,32959090,There are levels to Innovation,0.81,https://i.imgur.com/k0XqOEG.jpg
uz5p9e,4927,19462,792,False,t3_uz5p9e,439,False,30020,False,False,False,2qh7a,t5_2qh7a,20691953,"Swat team, me, digital, 2017",0.89,https://i.redd.it/admxbrick2291.jpg
uz7r2r,333997,8570329,693,False,t3_uz7r2r,1000,False,8590,False,False,False,2qi4s,t5_2qi4s,2231264,Star Wars Jedi: Survivor - Official Teaser,0.97,https://www.youtube.com/watch?v=4HLDaBGdnLc
uz55cj,123599,1068723,818,False,t3_uz55cj,356,False,21207,False,False,False,2qh1o,t5_2qh1o,31231490,Door-to-door salesman squeaks at homeowner,0.98,https://v.redd.it/z613vu3mf2291
uz6r58,9696,156464,742,False,t3_uz6r58,160,False,10762,False,False,False,33x33,t5_33x33,5552117,They also getting natural protein so it’s all good,0.95,https://i.imgur.com/rBxEAJT.jpg
uz4zue,62316,69850,826,False,t3_uz4zue,158,False,14572,False,False,False,39qgx,t5_39qgx,769422,I’m not surprised but somehow still disappointed.,0.97,https://i.redd.it/6q53v596e2291.gif
uza97o,288267,181621,568,False,t3_uza97o,627,False,5210,False,False,False,2qh0u,t5_2qh0u,29005616,[OC] Fuck the NRA,0.76,https://i.imgur.com/QCZtITR.jpg
uz451s,393,54079,867,False,t3_uz451s,1624,False,25116,False,False,False,2yrq6,t5_2yrq6,4020138,Huge protest outside of the NRA convention in Houston. It's growing by the hour. There's gonna be more protesters than attendees.,0.91,https://v.redd.it/qxc2aaqb62291
uz6bei,96161,107732,762,False,t3_uz6bei,194,False,12787,False,False,False,2qhsa,t5_2qhsa,9716221,"In November, I posted on Reddit that I was in accident. The accident ultimately led to 2 weeks in the hospital, 3+ surgeries, and having my mouth wired shut for more than 2 months. I lost 35 pounds and a lot of my strength. Today, I deadlifted 500 pounds",0.94,https://v.redd.it/1fxxbdmnp2291
uz3lpv,863,60186,893,False,t3_uz3lpv,870,False,22486,False,False,False,2cneq,t5_2cneq,8062425,Greg Abbott Is Full of Shit,0.94,https://www.texasobserver.org/greg-abbott-uvalde-shooting/
uz6jnw,50474,8510357,752,False,t3_uz6jnw,410,False,9095,False,False,False,346d4,t5_346d4,1429659,You had one job,0.98,https://i.redd.it/4w3nsbzlr2291.jpg
uz5kjd,14036,63905,799,False,t3_uz5kjd,1439,False,15974,False,False,False,43zwn1,t5_43zwn1,787797,RYAN COHEN TWEET,0.87,https://twitter.com/ryancohen/status/1530266772317917185?s=21
uz3jm7,6878,23605,895,False,t3_uz3jm7,1641,False,32891,False,False,False,3jj03,t5_3jj03,1797845,Motorcyclist chases after POS driver who fled from a Hit and Run,0.95,https://v.redd.it/xyfi4t7p12291
uz6010,211,8690,778,False,t3_uz6010,151,False,11035,False,False,False,2zmfe,t5_2zmfe,5630289,“What do you mean shoot the guy?? I could get injured! 😥”,0.96,https://i.redd.it/rh6wh2zxm2291.jpg
uz9j83,39499,153654,606,False,t3_uz9j83,312,False,4093,False,False,False,2qh13,t5_2qh13,28908667,Spanish parliament approves ‘only yes means yes’ consent bill | Spain,0.96,https://www.theguardian.com/world/2022/may/26/spanish-parliament-approves-only-yes-means-yes-consent-bill
uz2hu0,167834,9368584,945,False,t3_uz2hu0,821,False,104170,False,False,False,2w67q,t5_2w67q,6245215,The Wild West,0.89,https://gfycat.com/peskybaregoral
uz86ge,398574,57444,673,False,t3_uz86ge,966,False,4847,False,False,False,2qm7u,t5_2qm7u,1952594,"[Baggarly] Gabe Kapler told reporters in Cincinnati that he doesn't plan on coming out for the national anthem and that will be his plan going forward ""until I feel better about the direction of our country.""",0.9,https://twitter.com/extrabaggs/status/1530297672187277312?s=21&t=06w0hKXBddaLZERDY0rAXg
uz6gk5,123,4585,756,False,t3_uz6gk5,205,False,6887,False,False,False,2w7mz,t5_2w7mz,5359728,I think I found my dream guy,0.97,https://i.redd.it/xg14ft8iasw31.png
uz3lgv,53626,379816,893,False,t3_uz3lgv,489,False,14568,False,False,False,5r98w,t5_5r98w,1333813,Fuck the Christian Karens that post bullshit like this in response to children being murdered by mass shootings.,0.91,https://i.imgur.com/sx2nTNS.jpg
uz9ea2,64,4265,613,False,t3_uz9ea2,21,False,4020,False,False,False,3j7rv,t5_3j7rv,1014855,Blessed baby hog :),0.98,https://i.redd.it/geg4ypgeg3291.jpg
uz1hzg,909,7545,991,True,t3_uz1hzg,551,False,52971,False,False,False,3deqz,t5_3deqz,4209864,60 minutes later...,0.94,https://i.redd.it/cfvbeakzk1291.jpg
uz8puy,2732,21721,647,False,t3_uz8puy,124,False,4156,False,False,False,122hf1,t5_122hf1,1373721,Reaching difficult parts of Storm Veil Castle only to find Arteria Leafs ... Classic FromSoft Trolling!,0.99,https://i.redd.it/vfs3qi8u93291.gif
uz39fi,17288,4638805,909,False,t3_uz39fi,361,False,14001,False,False,False,3k2t0,t5_3k2t0,2210018,Showing off in the middle of the road,0.98,https://v.redd.it/hisd9cnjz1291
uz52rq,16242,291751,823,False,t3_uz52rq,122,False,8090,False,False,False,3gcwj,t5_3gcwj,11471639,Mental health days are ok.,0.97,https://i.redd.it/upc4n28ze2291.jpg
uz1gfg,73664,1440484,993,False,t3_uz1gfg,351,False,43286,False,False,False,2r5rp,t5_2r5rp,6278025,They are turning the fricking lions gay...,0.93,https://i.redd.it/ibqwjc0pk1291.png
uz567c,139534,2059111,818,False,t3_uz567c,86,False,10472,False,False,False,2qjpg,t5_2qjpg,19052816,Fresh Off The Boat,0.98,https://i.redd.it/99oj1csje2291.jpg
uz13o6,10460,23416,1009,False,t3_uz13o6,325,False,30202,False,False,False,2th52,t5_2th52,12183651,New Poll Summarizes Inflation Nicely,0.95,https://i.redd.it/z1ggwgguh1291.jpg
uz5axh,1911,3644,812,False,t3_uz5axh,80,False,7067,False,False,False,2wb7y,t5_2wb7y,1082613,Coolest Goodwill find ever,0.97,https://www.reddit.com/gallery/uz5axh
uz25w0,131257,842455,961,False,t3_uz25w0,251,False,18555,False,False,False,35g8o,t5_35g8o,993815,It was worth a shot.,0.97,https://i.imgur.com/jrI9Woq.jpg
uz2y5f,970,11291,924,False,t3_uz2y5f,622,False,15319,False,False,False,3cs2l,t5_3cs2l,237884,#killyourlawn,0.85,https://i.redd.it/1xm1upryw1291.jpg
uz6awl,345797,97734,764,True,t3_uz6awl,156,False,5330,False,False,False,3boqz,t5_3boqz,2123582,"Josh is on the grill until 11:55, so stop pestering him and do your station!",0.94,https://www.reddit.com/r/MaliciousCompliance/comments/uz6awl/josh_is_on_the_grill_until_1155_so_stop_pestering/
uz9pmj,312823,10785620,597,False,t3_uz9pmj,126,False,3161,False,False,False,3gdh7,t5_3gdh7,6848701,"🔥 Bald Eagle swoops in, steals food right out of the mouth of a Gray Wolf.",0.98,https://v.redd.it/4sua7rn1j3291
uz8r62,415,2280,645,False,t3_uz8r62,37,False,3602,False,False,False,3b749,t5_3b749,3814557,Try to sneak up on a german shepard,0.98,https://i.redd.it/l2ow5t8oa3291.gif
uz1zfw,2403,58995,969,False,t3_uz1zfw,93,False,18153,False,False,False,2xbrg,t5_2xbrg,5001289,Life do be like that sometimes,0.97,https://v.redd.it/bvevllwxo1291
uz37k6,310,135622,912,False,t3_uz37k6,112,False,13337,False,False,False,3nasz,t5_3nasz,1880434,Why walk when you can fly,0.91,https://v.redd.it/3f0mz5zsy1291
uz0hdz,3183,16515,1038,True,t3_uz0hdz,548,False,38087,False,False,False,2ti4h,t5_2ti4h,19964097,A park bench that can fold to a table,0.95,https://i.redd.it/p26vjr6lc1291.jpg
uz2dbi,6579,14677,951,False,t3_uz2dbi,623,False,12287,False,False,False,2s5oq,t5_2s5oq,20597945,LPT: Raise your hand to admit your mistake if you make a driving error. The huge majority of the time it will diminish any potential road rage from the other driver.,0.94,https://www.reddit.com/r/LifeProTips/comments/uz2dbi/lpt_raise_your_hand_to_admit_your_mistake_if_you/
uz17cl,513,9964,1004,False,t3_uz17cl,533,False,30504,False,False,False,2r7hk,t5_2r7hk,1166173,I laughed at this for way too long,0.93,https://imgur.com/JGlo14P.jpg
uz0yl9,2732,21732,1016,True,t3_uz0yl9,198,False,28673,False,False,False,2tex6,t5_2tex6,1998203,Rest with a Soap Bath,0.97,https://i.redd.it/so9lm8wmg1291.gif
uz1611,20,6122,1006,False,t3_uz1611,780,False,27957,False,False,False,m0bnr,t5_m0bnr,6225074,It’s like the eraser tool on PaintShop,0.94,https://v.redd.it/fpvdn335i1291
uz4eg0,121,3668,856,False,t3_uz4eg0,967,False,7246,False,False,False,2qh1e,t5_2qh1e,26441310,"That ""IT'S MORBIN TIME"" scene",0.91,https://youtu.be/OPaCXU4mwR8
uzbouo,41,87946,493,False,t3_uzbouo,707,False,2047,False,False,False,2qo4s,t5_2qo4s,4800644,"[Wojnarowski] The Lakers have hired Darvin Ham as coach, sources tell ESPN.",0.98,https://twitter.com/wojespn/status/1530344012607066112
uz2efr,309,226703,950,False,t3_uz2efr,51,False,13609,False,False,False,3i60n,t5_3i60n,2084428,he lived,0.98,https://i.redd.it/6fcsiv4es1291.jpg
uz2n3r,138102,13388,939,False,t3_uz2n3r,857,False,9942,False,False,False,2to41,t5_2to41,17962239,TIFU: by thinking peanut butter was supposed to be spicy,0.96,https://www.reddit.com/r/tifu/comments/uz2n3r/tifu_by_thinking_peanut_butter_was_supposed_to_be/
uz2znu,0,6556,923,False,t3_uz2znu,98,False,9646,False,False,False,2qh33,t5_2qh33,40803472,The best place in the house to sleep,0.97,https://v.redd.it/56lbnnuax1291
uz1urs,1740,18048,976,False,t3_uz1urs,66,False,13380,False,False,False,2qhm7,t5_2qhm7,869775,LEGO Dwebble & Crustle from Pokémon,0.97,https://i.redd.it/h6738dgun1291.jpg
uyzw74,39737,79907,1066,False,t3_uyzw74,919,False,28965,False,False,False,2qm21,t5_2qm21,1512602,Sounds like reasonable first step,0.91,https://i.imgur.com/hUmw7BV.jpg
uz52k2,270824,751039,824,False,t3_uz52k2,108,False,6177,False,False,False,29numb,t5_29numb,768640,I drew Mumei and Gura!,0.93,https://i.redd.it/5hcj5wvxe2291.jpg
uz0m1i,374088,5652431,1033,False,t3_uz0m1i,296,False,20144,False,False,False,2x93b,t5_2x93b,6930062,Veluwemeer Aqueduct in the Netherlands,0.97,https://gfycat.com/fluidaccurateboa
uz0gnw,7313,7849,1040,False,t3_uz0gnw,1485,False,18014,False,False,False,3pkgv,t5_3pkgv,1351015,I’m 27f living in New York and my mom freaks out when she can’t control me anymore.,0.94,https://www.reddit.com/gallery/uz0gnw
uz7drn,120,2815,713,False,t3_uz7drn,104,False,3938,False,False,False,48t85,t5_48t85,2143630,Laughed a little too hard,0.97,https://i.redd.it/gru2bmrty2291.jpg
uz402g,7881,96231,875,False,t3_uz402g,625,False,6824,False,False,False,3ipa1,t5_3ipa1,545870,They Were Afraid Of Getting Shot At...,0.94,https://i.imgur.com/5SoDbwW.jpg
uz7wx5,1205,2833,687,False,t3_uz7wx5,103,False,3427,False,False,False,2srr9,t5_2srr9,1348353,Anon had a dad,0.99,https://i.redd.it/c8z9fnle33291.png
uz1984,35184,84073,1002,False,t3_uz1984,91,False,14938,False,False,False,2sa3m,t5_2sa3m,2923288,haha got your nose,0.96,https://i.redd.it/1of8dau4j1291.jpg
uz4x43,3672,9201,831,False,t3_uz4x43,174,False,5380,False,False,False,p3r73,t5_p3r73,535959,May I offer you photos of my garden in these trying times,0.99,https://www.reddit.com/gallery/uz4x43
uz4l6k,377,29040,847,False,t3_uz4l6k,167,False,8342,False,False,False,23gidu,t5_23gidu,385301,"Fuck morbius, pixels is what real men watch",0.94,https://i.redd.it/trfg7drra2291.gif
uz23bk,28947,483092,965,False,t3_uz23bk,57,False,13629,False,False,False,2uqcm,t5_2uqcm,5501491,Downward-Facing Dog,0.99,https://v.redd.it/70lpy47tp1291
uyzd8j,572165,711626,1092,False,t3_uyzd8j,1031,False,26626,False,False,False,3aimx,t5_3aimx,3751989,Nailed it!,0.97,https://v.redd.it/99scly9531291
uz14y5,623,194528,1008,False,t3_uz14y5,440,False,11147,False,False,False,2qh61,t5_2qh61,6813193,Whizz Kid,0.92,https://v.redd.it/mhdmf232i1291
uz01pj,11764,55812,1059,False,t3_uz01pj,615,False,15420,False,False,False,2uao3,t5_2uao3,2742140,We see stuff like this on a daily basis,0.97,https://i.redd.it/3t3enk8091291.jpg
uz6qw2,1182,17319,744,False,t3_uz6qw2,232,False,3549,False,False,False,msyp9,t5_msyp9,692318,[France] POS runs over a pedestrian and tries to get away,0.95,https://v.redd.it/97c14719t2291
uz6ylp,16807,26316,734,False,t3_uz6ylp,167,False,3624,False,False,False,2yo6b,t5_2yo6b,2324551,This tick that I picked up because I thought it was a rock…,0.98,https://i.redd.it/23isx565v2291.jpg
uz383g,22261,67542,912,False,t3_uz383g,6387,False,37364,False,False,False,2qh3l,t5_2qh3l,24719700,"Shooter entered school through propped open door, had over 1,600 rounds of ammunition",0.92,https://news4sanantonio.com/news/local/official-kids-to-911-during-siege-police-send-the-police
uz4g5r,648,3191,854,False,t3_uz4g5r,210,False,4914,False,False,False,2r9vp,t5_2r9vp,1856741,"Another bust in Texas, 30 years to life",0.96,https://i.redd.it/tzhknzgl92291.jpg
uz3xpd,2169,57542,879,False,t3_uz3xpd,150,False,6024,False,False,False,2u2bh,t5_2u2bh,3835469,What you say?,0.92,https://v.redd.it/78j0q8r852291
uz0p3o,58975,151039,1029,False,t3_uz0p3o,1024,False,10655,False,False,False,2qh3s,t5_2qh3s,27992328,"Tron Legacy: Before Top Gun Maverick, director Joseph Kosinski made one of the most audacious big-budget debuts of all time",0.94,https://indianexpress.com/article/entertainment/hollywood/tron-legacy-top-gun-maverick-director-joseph-kosinski-audacious-debut-film-7935233/lite/
uyyqr5,748,25210,1123,False,t3_uyyqr5,225,False,41653,False,False,False,2wmvy,t5_2wmvy,5301475,Bros before anything,0.94,https://i.redd.it/10ljf31nx0291.jpg
uz87xq,14169,3052,673,False,t3_uz87xq,245,False,5871,False,False,False,2y77d,t5_2y77d,1956764,85 Degree Bakery enabled tips on their point of sale devices. Tips don’t go to workers; you’re just giving the company more money.,0.99,https://i.imgur.com/BQNBUUH.jpg
uz5xfm,175,2790,783,False,t3_uz5xfm,43,False,3928,False,False,False,2ro2c,t5_2ro2c,1760185,Pretty Much🤣,0.98,https://i.redd.it/pba1fe7bm2291.jpg
uz46bx,17288,4639812,878,False,t3_uz46bx,89,False,17704,False,False,False,35n7t,t5_35n7t,2536346,"Any time one of these clowns complains about people being ""woke"" they're just admitting that they like being asleep.",0.96,https://i.imgur.com/ziEvKXV.png
uz71tb,12960,21452,730,False,t3_uz71tb,645,False,9648,False,False,False,43zwn1,t5_43zwn1,787798,Lurking as well. Also I just shook his hand. He's still in Montreal 🤫,0.93,https://i.redd.it/ppddlqowv2291.jpg
uz7dtz,452338,3043431,713,False,t3_uz7dtz,289,False,3047,False,True,False,2uii8,t5_2uii8,2601067,Official Stills of SPOILER Characters in 'Doctor Strange in the Multiverse of Madness',0.97,https://www.reddit.com/gallery/uz7dtz
uyzqnb,33403,69393,1075,False,t3_uyzqnb,624,False,14592,False,False,False,11q8ir,t5_11q8ir,124908,Tell me you're guilty without telling me you're guilty?,0.96,https://i.redd.it/8e81iqfc61291.jpg
uz36pn,257,12419,915,False,t3_uz36pn,101,False,7047,False,False,False,3948y,t5_3948y,2931509,The kid: it's train time 😁,0.97,https://v.redd.it/mfphpmooy1291
uyyw00,88877,8463,1126,False,t3_uyyw00,970,False,34026,False,False,False,3hx3r,t5_3hx3r,2710670,Australians are easily offended,0.88,https://i.redd.it/rzk6gvyzy0291.jpg
uz1n60,1575,62787,986,False,t3_uz1n60,105,False,8704,False,False,False,2sgp1,t5_2sgp1,6125411,Not to brag but,0.97,https://i.redd.it/3xkj5165m1291.jpg
uyzmjg,3116,5780,1080,False,t3_uyzmjg,616,False,12804,False,False,False,3g3zk,t5_3g3zk,573215,I think they’re half a step away from coming to the right conclusion on their own,0.95,https://i.redd.it/uv4a9cnc51291.jpg
uyy19x,178147,298125,1160,False,t3_uyy19x,1136,False,45831,False,False,False,2t5y3,t5_2t5y3,3930127,"MRW I'm a police officer, armed to the teeth and covered in bullet proof armor and someone asks me if I want to go save some children",0.91,https://i.redd.it/m43hn794r0291.gif
uzb0bt,46321,22698,531,False,t3_uzb0bt,74,False,1693,False,False,False,3fn31,t5_3fn31,3125342,Haters will say it's fake. [Pulled from Instagram page foosgonewild],0.88,https://v.redd.it/inq223tcv3291
uz0339,262,5712,1058,False,t3_uz0339,24,False,13130,False,False,False,2wfjv,t5_2wfjv,4816908,Gotta be quicker next time little buddy,0.93,https://v.redd.it/lfywggyb91291
uz19t2,79693,3808284,1003,False,t3_uz19t2,33,False,23227,False,False,False,2usxq,t5_2usxq,1624855,They must have heard about my exploits,0.97,https://i.redd.it/6pkwp5d9j1291.gif
uyyvkd,1714,8409,1117,False,t3_uyyvkd,268,True,16535,False,False,False,2qimj,t5_2qimj,2131726,Mercedes mechanic examines the rear of ... Another mechanic,0.94,https://streamable.com/ph6jmy
uz6zbi,53217,45919,733,False,t3_uz6zbi,238,False,2985,False,False,False,2eempv,t5_2eempv,49669,Johnny Depp and Judy (the stenographer) ❤️,0.93,https://i.redd.it/03fo4j6av2291.jpg
uz5lra,70335,11115831,800,False,t3_uz5lra,347,False,3788,False,False,False,xkt2h,t5_xkt2h,284696,This is what a Democratic majority has accomplished:,0.83,https://i.redd.it/62yz6tq7j2291.png
uyynhq,165,7067,1128,False,t3_uyynhq,178,False,15812,False,False,False,2s28b,t5_2s28b,752093,Now I'm a Golden God,0.97,https://i.redd.it/82lzacbww0291.jpg
uz6vdu,7199,16143,739,False,t3_uz6vdu,107,False,3040,False,False,False,2qh16,t5_2qh16,12079832,"Democrats ask Apple, Google to prohibit apps from using data mining to target people seeking abortions",0.95,https://thehill.com/policy/technology/3504361-democrats-ask-apple-google-to-prohibit-apps-from-using-data-mining-to-target-people-seeking-abortions/
uyzhax,18779,94061,1088,False,t3_uyzhax,436,False,17207,False,False,False,2v0i1,t5_2v0i1,1137539,They could’ve just flown the ring,0.95,https://i.redd.it/cszg481041291.gif
uz0bfn,768,6266,1049,False,t3_uz0bfn,158,False,9549,False,False,False,5qpzgw,t5_5qpzgw,546894,Encouraging to see. Spotted at a local store.,0.96,https://i.imgur.com/GQwrCOF.jpg
uz2o1q,3744,475102,939,False,t3_uz2o1q,109,False,7869,False,False,False,3pzez,t5_3pzez,2067339,Is she not swimming?,0.98,https://i.redd.it/epqqyveou1291.jpg
uz48ae,4217,122860,866,False,t3_uz48ae,38,False,6469,False,False,False,hw1ju,t5_hw1ju,3211725,Cursed_Heroes,0.97,https://i.redd.it/a7i3lz5n72291.jpg
uz11oq,7580,11561,1014,False,t3_uz11oq,456,False,8714,False,False,False,2u5un,t5_2u5un,1508799,Kickboxer starts a fight and gets KO’d by wild haymakers,0.96,https://v.redd.it/hdbpjs0dh1291
uz3tg1,56435,298062,885,False,t3_uz3tg1,388,False,4791,False,False,False,2ea6kj,t5_2ea6kj,357466,WIBTA if I failed my student because she speaks with different dialect than I teach (language degree)? + UPDATE,0.95,https://www.reddit.com/r/BestofRedditorUpdates/comments/uz3tg1/wibta_if_i_failed_my_student_because_she_speaks/
uz16sr,2924,5139,1007,False,t3_uz16sr,381,False,8962,False,False,False,34o9s,t5_34o9s,3164629,average american man starterpack based on my one week vacation to america,0.97,https://i.redd.it/6qj2umiji1291.png
uyy2ms,4127,92188,1159,False,t3_uyy2ms,223,False,32011,False,False,False,3mj3w,t5_3mj3w,822592,"In American Psycho (2000), the restaurant Dorsia is mentioned several times, but never actually shown. This is because the film crew couldn't get a reservation.",0.95,https://i.redd.it/jb9mejsgr0291.jpg
uz4aio,16560,2155862,863,False,t3_uz4aio,42,False,4449,False,False,False,363r3,t5_363r3,3645431,This is so dope.,0.95,https://v.redd.it/nk32458882291
uz140x,14272,8406,1011,False,t3_uz140x,356,False,7587,False,False,False,2qhqw,t5_2qhqw,724598,We simply drop a giant ice cube into the ocean every now and then,0.97,https://www.reddit.com/gallery/uz140x
uz19ik,13545,3691794,1004,False,t3_uz19ik,104,False,7784,False,False,False,39gt6y,t5_39gt6y,163136,Lol,0.98,https://i.redd.it/ba5mt5h7j1291.jpg
uz4i2i,5338,11900,853,False,t3_uz4i2i,45,False,4191,False,False,False,3frqi,t5_3frqi,868524,Birb,0.99,https://v.redd.it/z5s2ekc1a2291
uz7cdx,5048,210733,716,False,t3_uz7cdx,111,False,2638,False,False,True,2vxxc,t5_2vxxc,1917730,Motorcyclist chases after POS driver who fled from a Hit and Run,0.96,https://v.redd.it/xyfi4t7p12291
uz0n8o,90270,289396,1033,False,t3_uz0n8o,291,False,9923,False,False,False,2qmeb,t5_2qmeb,4040429,How two Eevee's greet each other when meeting for the first time,0.97,https://v.redd.it/aw4pw3vvd1291
uz3p84,614,5379,891,False,t3_uz3p84,38,False,4827,False,False,False,2yb9w,t5_2yb9w,1385097,"""Bro, come check out this creature""",0.99,https://v.redd.it/e0fsueab32291
uz7rsu,55183,56931,695,False,t3_uz7rsu,157,False,5406,False,False,False,2qh03,t5_2qh03,32959117,Skyrim Up Down Up Down,0.97,https://i.redd.it/vlple43p13291.gif
uz9irt,6880,23721,609,False,t3_uz9irt,289,False,3923,False,False,False,2qhsa,t5_2qhsa,9716232,Motorcyclist chases after POS driver who fled from a Hit and Run,0.96,https://v.redd.it/kg21qej5h3291
uz10fg,108926,242891,1016,False,t3_uz10fg,429,False,8523,False,False,False,2x2oy,t5_2x2oy,6243183,WCGW Lifting a giant stone slab over a balcony,0.98,https://v.redd.it/lv5i4ui1h1291
uz49n6,4,9360,865,False,t3_uz49n6,17,False,4277,False,False,False,9zph8,t5_9zph8,1125942,Forbidden Celery,0.97,https://i.redd.it/wo7damu182291.jpg
uyzeet,25676,327616,1092,False,t3_uyzeet,263,False,15144,False,False,False,39ne7,t5_39ne7,2897992,to eat the fermented pears and drive home,0.96,https://v.redd.it/5892tmzd31291
uz2091,11832,20301,971,False,t3_uz2091,190,False,6782,False,False,False,2w2ea,t5_2w2ea,1607437,"Finally, I can watch all my favourite films in Unknown Language!",0.97,https://i.redd.it/gjjrwea4p1291.jpg
uyx6wj,41613,18762,1209,False,t3_uyx6wj,748,False,50481,False,False,False,38e1l,t5_38e1l,1908090,maybe maybe maybe,0.96,https://v.redd.it/5ijec43ki0291
uyxead,279197,516266,1197,False,t3_uyxead,1169,False,143233,False,False,False,2s5ti,t5_2s5ti,1743321,meirl,0.9,https://i.redd.it/3p27htclk0291.gif
uz4fl3,862,2666,857,False,t3_uz4fl3,193,False,3963,False,False,False,3ptyd,t5_3ptyd,1456742,He's amazing,0.94,https://v.redd.it/qsgdg8od92291
uyxgeo,279198,516266,1193,False,t3_uyxgeo,374,False,70258,False,False,False,2vegg,t5_2vegg,5812668,me_irl,0.95,https://i.redd.it/e5aun28fl0291.gif
uz4mjg,30088,195870,848,False,t3_uz4mjg,95,False,3746,False,False,False,2qqcn,t5_2qqcn,728221,"Big development: Ukrainian Orthodox Church of the Moscow Patriarchate, subordinate to the Russian Orthodox Church, breaks away and declares independence. “We disagree with the position of Patriarch Kirill of Moscow and All Rus’ on the war in Ukraine.”",0.98,https://twitter.com/ChristopherJM/status/1530253092863754241
uz2xsc,6142,46685,928,False,t3_uz2xsc,108,False,5952,False,False,False,12p4l2,t5_12p4l2,1480499,I have always wanted Xiao and Itto to meet,0.98,https://twitter.com/artastiq/status/1530234281833795585?s=20&t=gsDST9Uc_er45iJM1jEeKQ
uz17ll,18250,5629,1007,False,t3_uz17ll,8114,True,7961,False,False,False,2qh1i,t5_2qh1i,35965224,"What, in your opinion, is a realistic solution to gun violence in the United States?",0.85,https://www.reddit.com/r/AskReddit/comments/uz17ll/what_in_your_opinion_is_a_realistic_solution_to/
uz4q7w,898,11091,843,False,t3_uz4q7w,16,False,4429,False,False,False,2qi1r,t5_2qi1r,2047341,*taps shit on keyboard* i am in,0.99,https://i.redd.it/pmv6c7nzb2291.gif
uyxrwe,25676,327622,1175,False,t3_uyxrwe,1216,False,41899,False,False,False,2st2l,t5_2st2l,743534,Wingless goose playing with her rescuer,0.91,https://v.redd.it/2ctqzbako0291
uz3hsj,1112,29181,902,False,t3_uz3hsj,45,False,4416,False,False,False,2vi0z,t5_2vi0z,4226718,The black tear lines under a cheetah’s eyes protect them from glare and strong sunlight.,0.99,https://i.redd.it/4ffil7oj12291.jpg
uyxscl,43036,1334787,1175,False,t3_uyxscl,51,False,16250,False,False,False,2qh0s,t5_2qh0s,1831735,once upon your time,0.97,https://i.redd.it/uu7enblro0291.png
uz2elf,7365,1138994,953,False,t3_uz2elf,327,False,5027,False,False,False,2qn70,t5_2qn70,410812,The fact that the police are AFRAID of being outgunned by AR-15 is all evidence we need as to why they should be BANNED.,0.91,https://i.redd.it/9c03lu2gs1291.jpg
uz0v8x,9520,15944,1023,False,t3_uz0v8x,166,False,6514,False,False,False,2tycb,t5_2tycb,16051847,"R.L. Burnside in his backyard, 1978",0.98,https://v.redd.it/vk8friisf1291
