post_id,author_comment_karma,author_link_karma,time_in_mins,post_is_original_content,post_name,post_num_comments,post_over_18,post_score,post_has_link,post_spoiler,post_stickied,subreddit_id,subreddit_name,subreddit_subscriber_count,post_title,post_upvote_ratio,post_url
uzcx4w,17467,134829,732,False,t3_uzcx4w,740,False,163,False,False,True,2rp0g,t5_2rp0g,151256,"IT'S WHAT YOU WANT: The Yankees defeated the Rays by a score of 2-0 - May 27, 2022 @ 07:10 PM EDT",0.95,https://www.reddit.com/r/NYYankees/comments/uzcx4w/its_what_you_want_the_yankees_defeated_the_rays/
uzesfe,159,1775,514,False,t3_uzesfe,10,False,108,False,False,False,2sjr4,t5_2sjr4,132630,ctto haha,0.98,https://i.redd.it/bv8ft2z9z4291.jpg
uzbdo5,278,32401,813,False,t3_uzbdo5,75,False,238,False,True,False,2g5ach,t5_2g5ach,159328,Luminosity Gaming vs Evil Geniuses / VCT North America 2022 - Stage 2 Challengers - Group Stage / Post-Match Thread,0.98,https://www.reddit.com/r/ValorantCompetitive/comments/uzbdo5/luminosity_gaming_vs_evil_geniuses_vct_north/
uzderc,533,1828,601,False,t3_uzderc,9,False,137,False,False,False,4fxx08,t5_4fxx08,64593,Bob could have been a millionaire,1.0,https://i.redd.it/veg9xs20k4291.jpg
uz18b8,183,923,1265,False,t3_uz18b8,24,False,896,False,False,False,2re2c,t5_2re2c,149839,[No Spoilers] Little councilor Kiramman. By AlwaysThinkAboutArcane,0.99,https://i.redd.it/qxcgzyrri1291.jpg
uyw44c,6470,31973,143,False,t3_uyw44c,18,False,5800,False,False,False,2u2bh,t5_2u2bh,3836037,Let me jump-hug you--- omph!,0.98,https://v.redd.it/vucnt6w200291
uz6pty,1708,3972,1004,False,t3_uz6pty,17,False,438,False,False,False,2rhs5,t5_2rhs5,428016,Nice graffiti that I found in my hometown (no OC),1.0,https://i.redd.it/3yu6scr1t2291.jpg
uzbx1e,3220,9762,689,False,t3_uzbx1e,22,False,180,False,False,False,3g0svs,t5_3g0svs,22177,"Places, everyone.",0.97,https://i.imgur.com/ltKWI44.jpg
uyzxsh,1,11503,1375,False,t3_uyzxsh,78,False,2976,False,False,False,5tdqj0,t5_5tdqj0,161444,My tea is warm,0.98,https://v.redd.it/v3dm8wc281291
uzc349,164368,649781,731,False,t3_uzc349,44,False,441,False,False,False,2qhv6,t5_2qhv6,316609,[LeBron James] So damn EXCITED!!!!!!!! Congrats and welcome Coach DHam!! 👏🏾👏🏾👏🏾👏🏾👏🏾 #LakeShow 💜💛,1.0,https://twitter.com/kingjames/status/1530349624220844033?s=21&t=bJ_gIgwf1nBoSqBYTeLdog
uz0iox,708,18403,1299,True,t3_uz0iox,17,False,1000,False,False,False,2tdi5,t5_2tdi5,144632,Fire Sisters cosplay by Nymphahri and Himee [OC],0.98,https://www.reddit.com/gallery/uz0iox
uzdt8b,2399,13225,577,False,t3_uzdt8b,27,False,128,False,False,False,11dpd1,t5_11dpd1,66260,Away down south in the land of traitors......,0.99,https://i.redd.it/bcdhpb2em3291.jpg
uz21hp,341541,39707,1229,False,t3_uz21hp,46,False,808,False,False,False,2s4cy,t5_2s4cy,90644,Where the hell did you get these edibles from?,0.96,https://i.imgur.com/fCAO2RU.jpg
uyt47y,3524,13930,313,False,t3_uyt47y,198,False,16457,False,False,False,2qh7a,t5_2qh7a,20692755,"Ray Liotta, Me, Digital, 2022",0.96,https://i.redd.it/yorb4b545z191.jpg
uzdw4r,25614,11209,572,False,t3_uzdw4r,28,False,129,False,False,False,2u1if,t5_2u1if,2051216,I’m selling plates hmu!,0.96,https://i.imgur.com/isdWMxZ.jpg
uz3m9k,3755,34851,1155,False,t3_uz3m9k,162,False,1568,False,False,False,5wjmo8,t5_5wjmo8,426696,Drone footage of Russian BMP getting destroyed by a mine.,0.99,https://v.redd.it/6ub7vkdj22291
uz3hqb,1635,20907,1160,False,t3_uz3hqb,17,False,671,False,False,False,2rtqf,t5_2rtqf,109680,Every time,0.99,https://i.redd.it/qktd3jxi12291.jpg
uzebki,384,2271,546,False,t3_uzebki,9,False,116,False,False,False,2t0no,t5_2t0no,5754647,"Why do teenage girls walk in groups of 3, 5, and 7?",0.93,https://www.reddit.com/r/dadjokes/comments/uzebki/why_do_teenage_girls_walk_in_groups_of_3_5_and_7/
uz33s7,1126,2993,1186,False,t3_uz33s7,93,False,4543,False,False,False,3i60n,t5_3i60n,2084932,Just saw this while rewatching the prequels,0.99,https://i.redd.it/9tux9o12y1291.png
uyxtnt,67213,672983,49,False,t3_uyxtnt,48,False,1535,False,False,False,2vhg0,t5_2vhg0,162219,Mildly Muscular Yang [@corvophobia],0.99,https://i.redd.it/sobi7sx0p0291.jpg
uzaurk,36403,44579,748,False,t3_uzaurk,25,False,209,False,False,False,2s1wh,t5_2s1wh,132568,Chief David Njoku on Instagram: “CLEEVEEEELANDDDD THIS IS FOR YOUUU!!! Truly Blessed through it all ! Thank you to the Browns organization and The Haslam Family. Thankful…”,0.98,https://www.instagram.com/p/CeE8LM_pSSi/?igshid=YmMyMTA2M2Y=
uzad1e,32727,82003,774,True,t3_uzad1e,8,False,227,False,False,False,13014w,t5_13014w,287259,"It's over, Anakin! I have the high ground!",1.0,https://i.redd.it/0tcu2001p3291.jpg
uze5v3,4575,452,556,False,t3_uze5v3,39,False,118,False,False,False,2roln,t5_2roln,39071,Let’s Go Avalanche!,0.86,https://www.reddit.com/r/CalgaryFlames/comments/uze5v3/lets_go_avalanche/
uz6wyn,1685,3350,945,True,t3_uz6wyn,10,False,385,False,False,False,3e6ue,t5_3e6ue,272780,WE'LL WE'LL. IF IT AINT ME OLD FRIEND LACKTOAST,0.99,https://i.redd.it/3knrx4pqu2291.jpg
uz0s97,144430,9100,1287,False,t3_uz0s97,241,False,947,False,False,False,22i0,t5_22i0,627172,PARTEI-Spitzenpolitiker bezahlte Minderjährige für Sex,0.98,https://www.fr.de/politik/partei-politiker-sexuelle-handlungen-mit-minderjaehrigen-videos-online-veroeffentlicht-zr-91575588.html
uz3l97,3847,44238,1146,False,t3_uz3l97,6,False,1837,False,False,False,3n7fs,t5_3n7fs,1601435,bogeyman,0.98,https://v.redd.it/3kis4mpc22291
uzbfob,474242,64059,717,False,t3_uzbfob,7,False,444,False,False,False,2zexl,t5_2zexl,600192,Cats In A Nutshell,0.99,https://i.redd.it/26uuooady3291.gif
uz7skm,75,789,954,False,t3_uz7skm,15,False,490,False,False,False,2qhs6,t5_2qhs6,180070,I got a weighted blanket and it helps so much :),1.0,https://i.redd.it/chb4p6hc23291.jpg
uyr1fo,79186,1106273,396,False,t3_uyr1fo,217,False,6937,False,False,False,3md1s,t5_3md1s,3165227,"In Drop Dead Gorgeous (1999) Lona Williams, who wrote the screenplay and was herself a Minnesota-raised former teen beauty queen, plays the pageant’s third, non-speaking judge, Jean.",0.97,https://i.redd.it/xoj2fohpfy191.jpg
uze22y,3733,55266,612,False,t3_uze22y,153,False,742,False,False,False,2qiel,t5_2qiel,1429022,The Colorado Avalanche have reached the Conference Finals for the first time since 2002,0.98,https://www.reddit.com/r/hockey/comments/uze22y/the_colorado_avalanche_have_reached_the/
uz9m4x,265,2983,813,False,t3_uz9m4x,23,False,256,False,False,False,2qjyy,t5_2qjyy,479822,"Grandfathers ship sailing under the Golden Gate Bridge into the SF Bay. Unknown date, sorry.",0.98,https://i.redd.it/do3vnl61i3291.jpg
uyvoor,1122,6146,177,False,t3_uyvoor,403,False,9051,False,False,False,2titf,t5_2titf,788914,It's easy as that,0.99,https://i.redd.it/1z7h91tn6t191.jpg
uz1cf9,12164,27379,1267,False,t3_uz1cf9,116,False,2102,False,False,False,3fmt2,t5_3fmt2,332613,Don’t tell him 💀,0.99,https://i.imgur.com/woyk82L.jpg
uz20ry,126679,90197,1178,False,t3_uz20ry,69,False,771,False,False,False,2ukze,t5_2ukze,171255,Innocent Man Murdered = Tragedy Prevented !!,0.94,https://i.imgur.com/fc7v2jl.jpg
uz3o6p,220,1645,1100,False,t3_uz3o6p,8,False,613,False,False,False,3mnyi,t5_3mnyi,329404,Poor Guy !!,0.98,https://v.redd.it/1g2fkk3z22291
uz3hlz,11218,50684,1160,False,t3_uz3hlz,458,False,762,False,False,False,12t6sw,t5_12t6sw,373951,"KGB HALKINA DUYURULUR! BU BİR TATBİKAT DEĞİLDİR. Subredditteki son olaylardan sonra ben ve moderatör ekibim sub'ı temizleme kararı aldık. 24 saat içinde up ve yorum atmayan inaktif hesaplar ban yiyecektir. Daha sonra dmden abi niye anamın amına yolladınız beni yazmayın. İyi eğlenceler, iyi forumlar.",0.84,https://i.redd.it/43j0l9e812291.jpg
uz1oq3,195251,200140,1252,False,t3_uz1oq3,99,False,1947,False,False,False,2ea6kj,t5_2ea6kj,357634,An uncontrolled off-leash dog + bicycle rider = crash and broken arm. Dog owner doesn't agree with the math.,0.98,https://www.reddit.com/r/BestofRedditorUpdates/comments/uz1oq3/an_uncontrolled_offleash_dog_bicycle_rider_crash/
uz1ut5,18713,387283,1244,False,t3_uz1ut5,15,False,1913,False,False,False,2sbq3,t5_2sbq3,22087746,Beautifully colored slot canyon in Utah [OC] [1600x2000],0.98,https://i.redd.it/rf5qx7esn1291.jpg
uz98zu,14577,39145,881,False,t3_uz98zu,131,False,288,False,False,False,in7k7,t5_in7k7,119276,"Qanon Pastor threatens to start a ""real resurrection"" at the capitol",0.98,https://v.redd.it/yce3eyk1f3291
uyzxst,479,7239,1376,False,t3_uyzxst,12,False,1133,False,False,False,2vez1,t5_2vez1,240371,la mulți ani,1.0,https://i.redd.it/ur5o64i281291.gif
uz5dkc,102507,325058,1067,False,t3_uz5dkc,89,False,514,False,False,False,2ve0h,t5_2ve0h,63427,"Texas police release timeline in deadly school shooting, revealing suspect was inside for 77 minutes.",0.99,https://i.redd.it/sbeov4zbh2291.png
uz9dzh,22947,19114,825,False,t3_uz9dzh,43,False,264,False,False,False,2ubln,t5_2ubln,61176,"Poor Quaxly, no one is discussing him",0.99,https://i.redd.it/78ex0227g3291.jpg
uzatiq,54,1766,800,True,t3_uzatiq,10,False,575,False,False,False,34ixl,t5_34ixl,2378620,Cabin in the words in Maine,0.99,https://i.redd.it/kazaaupht3291.jpg
uzbx23,4,245,691,False,t3_uzbx23,4,False,175,False,False,False,3eeyc,t5_3eeyc,172939,Amazing,1.0,https://v.redd.it/lnlnmt4844291
uz9fi0,452582,3046084,823,False,t3_uz9fi0,15,False,256,False,False,False,u8wq5,t5_u8wq5,487481,Bryce Dallas Howard Directing ‘The Mandalorian’ Season 3 Episode,0.98,https://www.hollywoodreporter.com/movies/movie-news/star-wars-mandalorian-season-3-bryce-dallas-howard-1235155578/
uz7lqq,319,298,912,False,t3_uz7lqq,3,False,343,False,False,False,2x7x1,t5_2x7x1,684271,One of my favorite lines from Season 3,1.0,https://i.redd.it/hi3rhw9n03291.png
uz22mr,940,11320,1285,False,t3_uz22mr,10,False,798,False,False,False,3ppb2,t5_3ppb2,94845,Scott the writer,0.99,https://v.redd.it/9o63x0emp1291
uz3kop,0,21464,1157,False,t3_uz3kop,42,False,649,False,False,False,fx5gt,t5_fx5gt,111087,Keep Your Guard Up At All Times,0.99,https://v.redd.it/lpm0shx322291
uzb80m,5769,18091,729,False,t3_uzb80m,1,False,195,False,False,False,3ca4m,t5_3ca4m,135271,Fix this shit show,1.0,https://i.redd.it/4w3nsbzlr2291.jpg
uz2zdj,5868,193313,1185,False,t3_uz2zdj,35,False,702,False,False,False,2vqni,t5_2vqni,228365,facts,0.96,https://i.redd.it/j9f06d98x1291.png
uzbvf5,304,10204,694,False,t3_uzbvf5,6,False,176,False,False,False,2rn75,t5_2rn75,74358,double miku everyday #55,0.99,https://i.redd.it/qc62tbhs34291.jpg
uz7n7i,24412,21152,960,False,t3_uz7n7i,8,False,368,False,False,False,2sqf9,t5_2sqf9,57068,This is Josie! Josie says…. Josie forgot what she was going to say,1.0,https://i.redd.it/mmcqrts513291.jpg
uz00c6,139789,85737,1325,False,t3_uz00c6,20,False,1042,False,False,False,mv490,t5_mv490,87215,Everybody Gets Therapy,0.99,https://www.reddit.com/gallery/uz00c6
uzbp50,5059,7511,754,False,t3_uzbp50,22,False,184,False,False,False,2qpvj,t5_2qpvj,118642,POLICE CHECKPOINT RIGHT NOW AT MANCHESTER BRIDGE,0.81,https://www.reddit.com/r/rva/comments/uzbp50/police_checkpoint_right_now_at_manchester_bridge/
uz90rr,664889,39497102,843,False,t3_uz90rr,1,False,270,False,False,False,31xwr,t5_31xwr,175609,Akiha Tohno,0.99,https://i.imgur.com/QMy9QfX.jpg
uz3aji,67,980,1171,False,t3_uz3aji,23,False,670,False,False,False,2rgym,t5_2rgym,196390,hilf life in backrooms,0.98,https://v.redd.it/n4d4cj5uz1291
uzeqgq,291404,31166,569,False,t3_uzeqgq,11,False,114,False,False,False,2yb1h,t5_2yb1h,29152,The two members of the “Scoring 45+ in Game 6 Against the Celtics to Avoid Elimination” club.,0.95,https://i.redd.it/w02aqdhoy4291.jpg
uzd4fm,41981,157198,620,False,t3_uzd4fm,8,False,336,False,False,False,3c02n,t5_3c02n,287471,Megumin's new scale figure prototype,0.99,https://i.redd.it/keu9ve5zg4291.jpg
uzec71,335,6121,546,False,t3_uzec71,5,False,114,False,False,False,2vi0z,t5_2vi0z,4227576,"The Jaguarundi is a small wild cat native to the Americas, being found from Argentina to Mexico! these fearsome fellas are known for their striking resemblance to their cousin the cougar, though their weasle-like features often get them mixed up with mustelids",1.0,https://i.redd.it/un5xip23u4291.png
uz618i,90,1235,1040,False,t3_uz618i,15,False,446,False,False,False,2jc06q,t5_2jc06q,67137,Baby chirp,1.0,https://v.redd.it/ho0xd8z2n2291
uzclam,40675,117837,652,False,t3_uzclam,21,False,359,False,False,False,mvcq5,t5_mvcq5,1234328,He just wanted a friend.,0.98,https://v.redd.it/ybx2e4y2b4291
uyyht2,588491,485368,1398,False,t3_uyyht2,173,False,1318,False,False,False,2x4yx,t5_2x4yx,2349804,Why the Air at the Gym May Be More Likely to Spread Covid,0.89,https://www.nytimes.com/2022/05/24/well/move/covid-gym-air.html
uz6bdf,8959,25442,1026,False,t3_uz6bdf,12,False,426,False,False,False,2vxf7,t5_2vxf7,72056,😎✌⭐😢😢😢❤🎶🌈☮,1.0,https://i.redd.it/1m95z05op2291.jpg
uzdgg8,1419740,737659,692,False,t3_uzdgg8,14,False,163,False,False,False,2rylc,t5_2rylc,51739,KLew continues to torment Verlander as he crushes his first home run of the season!,0.99,https://streamable.com/bvxa4g
uz6vz3,593,2063,997,False,t3_uz6vz3,18,False,417,False,False,False,10jfn5,t5_10jfn5,40530,Congrats on coming out queen 😍😍🥳🥳🎉👏👏,0.98,https://i.redd.it/8fs4f0ciu2291.jpg
uz1heg,54981,131299,1312,False,t3_uz1heg,29,False,869,False,False,False,2qhqw,t5_2qhqw,724635,"Whenever you’re down, just remember that Friender is there for you.",0.98,https://i.redd.it/3bt5m4mwk1291.jpg
uz74qb,898,320,985,False,t3_uz74qb,42,False,394,False,False,False,2tqcj,t5_2tqcj,214081,Unpopular Opinion? Ross has the body to sport these leather pants. And did it well. I said it! One of my top favorite episodes.,0.98,https://i.redd.it/02ct5c8lw2291.jpg
uzbo3t,49223,19184,754,False,t3_uzbo3t,121,False,479,False,False,False,gajhd,t5_gajhd,308855,I hope this woman gets the help she needs…,0.96,https://i.redd.it/d6rzocnq14291.jpg
uz8k52,57,9896,867,False,t3_uz8k52,8,False,687,False,False,False,3blco,t5_3blco,1812566,saVagE MOnKey ENslaVeS KID anD UsES IT AS A BeaST of bURdEn,0.98,https://v.redd.it/py8dnlkg83291
uz3g16,3368,54426,1170,False,t3_uz3g16,43,False,620,False,False,False,2qs10,t5_2qs10,156948,this random gaurd,0.98,https://i.redd.it/0rzgnnt412291.jpg
uyzx39,20569,147596,1277,False,t3_uyzx39,20,False,1010,False,False,False,2t41z,t5_2t41z,137324,i n d e e d,1.0,https://i.redd.it/s64u7dzv71291.jpg
uz44f4,2060,2294,1182,False,t3_uz44f4,39,False,602,False,False,False,kcm0c,t5_kcm0c,77835,Comparison of the Golden Deers' portraits in Three Houses and Three Hopes (@bk2128 on twitter),1.0,https://i.redd.it/a5yhy7le62291.jpg
uz3rqu,67,372,1155,False,t3_uz3rqu,20,False,586,False,False,False,2rhee,t5_2rhee,66520,Friendship and Relationships are still cool,1.0,https://i.redd.it/341ky78h32291.jpg
uzavq7,78524,620714,799,False,t3_uzavq7,7,False,218,False,False,False,3f8po,t5_3f8po,276297,220528 Jisoo Weverse BLINK Membership Update,0.99,https://i.redd.it/nfjffq64u3291.jpg
uz4k81,219,17343,1107,False,t3_uz4k81,16,False,611,False,False,False,1lxu4k,t5_1lxu4k,109226,Boom goes the dynamite,0.99,https://v.redd.it/u6ib7jcka2291
uz6os9,24501,101945,1008,False,t3_uz6os9,8,False,407,False,False,False,3ekfb,t5_3ekfb,212719,"Mindy doesn't really like coke, she just likes the way it smells.",0.99,https://i.redd.it/4ta23s4rs2291.png
uzdt7a,9921,16244,580,False,t3_uzdt7a,2,False,116,False,False,False,2mqpqw,t5_2mqpqw,69902,🤝 r/loveforchildlabor,0.98,https://i.redd.it/vkuzxcs8o4291.gif
uzelug,54042,66637,578,False,t3_uzelug,30,True,279,False,False,False,2qmkf,t5_2qmkf,291447,(NSFW) HD close up of dildo on the court,0.94,https://i.redd.it/0c1d5bx5x4291.jpg
uz6ugu,2549,9207,1048,False,t3_uz6ugu,4,False,445,False,False,False,2ef8gf,t5_2ef8gf,64687,"Morbosemi, Morbtra, and Morblen in the Latest Blockbuster Hit",0.99,https://i.redd.it/wginc0fxt2291.png
uz1vct,29107,3171,1243,False,t3_uz1vct,25,False,787,False,False,False,2rpor,t5_2rpor,304069,[FO] First time framing!,1.0,https://i.redd.it/hrx7hq3zn1291.jpg
uz62yn,1407,353,1037,False,t3_uz62yn,4,False,452,False,False,False,306sc,t5_306sc,402722,Puzzled blep,1.0,https://i.imgur.com/bbyT0Qe.jpg
uzebp7,12416,15332,548,False,t3_uzebp7,36,False,115,False,False,False,2r3em,t5_2r3em,321031,.,0.95,https://v.redd.it/22qoecjxt4291
uyxxt5,76,78532,1433,False,t3_uyxxt5,19,False,1398,False,False,False,2t7ge,t5_2t7ge,136282,Ginger heaven.…,0.99,https://gfycat.com/yearlylikelykoi
uz6ve7,6761,426648,949,False,t3_uz6ve7,60,False,360,False,False,False,5wptpp,t5_5wptpp,103854,Russian Captain Alexander Pankov was killed in Ukraine.,0.97,https://i.redd.it/veacy9mdu2291.jpg
uz89mp,93166,71240,930,False,t3_uz89mp,67,False,336,False,False,False,2qgzt,t5_2qgzt,19815809,"Amazon to Permanently Disable Cloud Cam, Offers Affected Customers a Free Blink Mini and Echo",0.96,https://www.macrumors.com/2022/05/27/amazon-dropping-support-for-cloud-cam/
uz0qs6,82460,898725,1297,False,t3_uz0qs6,183,False,2157,False,False,False,3g3zk,t5_3g3zk,573258,Just a few more of these shootings and it might finally click,0.98,https://i.imgur.com/yRJCrRe.jpg
uz5izn,93,311,1071,False,t3_uz5izn,110,False,473,False,False,False,5s7w3r,t5_5s7w3r,84324,Cut the Appearance Bashing,0.82,https://www.reddit.com/r/aliceandfernsnark/comments/uz5izn/cut_the_appearance_bashing/
uzbu8u,27,181,744,False,t3_uzbu8u,14,False,195,False,False,False,xnz2i,t5_xnz2i,58857,Squish haul for today🥹(please don’t think I’m a scalper because I bought 2 Archie’s). I promise I bought one for me and one for my sister. We are Mexican American and the Axolotl has deep significance to us representing the Aztec god of fire and lightning. I’m so happy I’m crying 🥹,0.96,https://www.reddit.com/gallery/uzbu8u
uz8djt,37480,13232,918,False,t3_uz8djt,27,True,339,False,False,False,5aiyne,t5_5aiyne,108780,[OC] Choking Kink,0.95,https://v.redd.it/tslz1x7b73291
uz47ji,17288,4665267,1126,False,t3_uz47ji,16,False,1472,False,False,False,2st00,t5_2st00,230949,TIL Golden Retrievers swim in schools,1.0,https://i.imgur.com/RGwsGr6.gifv
uz5rse,76802,6407,1057,False,t3_uz5rse,51,False,449,False,False,False,360vi,t5_360vi,122284,"The lost Primarch of the XIth legion, battling millions of mind controlled humans and xenos during the Rangdan xenocides. Commissioned by me, artwork by Reclusi art.",0.99,https://i.redd.it/kzs2x37jk2291.png
uz97oy,121,2272,883,False,t3_uz97oy,11,False,295,False,False,False,2s2ja,t5_2s2ja,398618,Absolute slapper of a tune,0.98,https://v.redd.it/q2xbcqbre3291
uyuj3z,86,6225,213,False,t3_uyuj3z,168,False,10233,False,False,False,3ptyd,t5_3ptyd,1457744,Rare Impressive Art,0.9,https://v.redd.it/8chfwucbnz191
uz31h5,29162,9481,1233,False,t3_uz31h5,46,False,1641,False,False,False,30hhs,t5_30hhs,353767,"Zelensky to Kissinger: The world didn't adapt to the Nazis, we're not adapting to Putin",0.99,https://www.jta.org/2022/05/26/global/zelensky-to-kissinger-the-world-didnt-adapt-to-the-nazis-were-not-adapting-to-putin
uzbxs6,34,114,692,False,t3_uzbxs6,15,False,163,False,False,False,2tb3z,t5_2tb3z,298592,"Found in Livermore, CA",1.0,https://www.reddit.com/gallery/uzbxs6
uywagz,3911,18330,91,False,t3_uywagz,56,False,4918,False,False,False,2ro2c,t5_2ro2c,1760255,Okaaayyy…,0.99,https://i.redd.it/420tx1h990291.jpg
uz72d6,5017,458289,989,False,t3_uz72d6,1,False,393,False,False,False,2w4iz,t5_2w4iz,164102,2B & Pod 042 by @Xleontan,0.99,https://i.redd.it/77d8f9z1w2291.jpg
uywgyp,111,1147,21,False,t3_uywgyp,10,False,1722,False,False,False,2tt9j,t5_2tt9j,48059,Bird watching is rough.,1.0,https://i.redd.it/35ywazp7b0291.jpg
uz4yg9,43222,63176,1149,False,t3_uz4yg9,22,False,521,False,False,False,10to4u,t5_10to4u,52490,Meme,0.98,https://i.redd.it/1wh3oiczd2291.jpg
uyxsf8,299,3394,3,False,t3_uyxsf8,25,False,1373,False,False,False,2s7fw,t5_2s7fw,96035,just moved cross country from seattle to nyc with this guy,0.99,https://i.redd.it/rodzledso0291.jpg
uz6j30,9583,15928,1017,False,t3_uz6j30,29,False,987,False,False,False,2u0zn,t5_2u0zn,351491,"Finally got diagnosed, how’s this for a first attempt?",0.99,https://i.imgur.com/a3GWptw.jpg
uzcqdd,512,342,692,False,t3_uzcqdd,91,False,171,False,False,False,2qmha,t5_2qmha,248192,Today is my ex’s 30 birthday. Made him a ribeye topped with bacon jam.,0.87,https://i.redd.it/o6yyg92rc4291.jpg
uz7iqb,18702,11270,967,False,t3_uz7iqb,9,False,364,False,False,False,2ryfq,t5_2ryfq,42109,Spent four years in a shelter. He’s finally home for good.,1.0,https://i.redd.it/gsl9frr003291.jpg
uz22i3,6669,70001,1288,False,t3_uz22i3,20,False,752,False,False,False,3kh5d,t5_3kh5d,127739,The good life,0.99,https://i.redd.it/dy1a1i8mp1291.jpg
uz59xa,67,1583,1084,False,t3_uz59xa,34,False,1124,False,False,False,2qlqp,t5_2qlqp,4107665,"English walnut desk build with LOTS of sap but hey, it was going to be firewood!",0.98,https://www.reddit.com/gallery/uz59xa
uz6amj,2819,111655,1034,False,t3_uz6amj,16,False,402,False,False,False,326ot,t5_326ot,62930,The Birth Of Zack,0.99,https://i.redd.it/afzq2oxgp2291.png
uz06ga,10248,131298,1375,False,t3_uz06ga,3,False,980,False,False,False,3aaj7,t5_3aaj7,54604,Such a stunner,0.97,https://i.redd.it/7bp8s710a1291.jpg
uyrr85,211,2841,412,False,t3_uyrr85,92,False,5134,False,False,False,2s9k9,t5_2s9k9,284445,My family cosplay at San Diego Comic Con back in 2014,0.98,https://i.redd.it/55crggd0oy191.jpg
uz5izm,80162,19898,1073,False,t3_uz5izm,13,False,442,False,False,False,2s14k,t5_2s14k,98194,[Fernandinho] Coming to Man City in 2013 was the best decision I have ever made. Thank you. 🙏🏾👏🏾💙,1.0,https://twitter.com/fernandinho/status/1530258915086192642
uywipr,118,997,127,False,t3_uywipr,37,False,1795,False,False,False,2zvvb,t5_2zvvb,310007,Poland showing signs of schizophrenia,0.98,https://i.redd.it/plod6f8rb0291.jpg
uz9nte,6,156,912,False,t3_uz9nte,25,False,270,False,False,False,2qr4d,t5_2qr4d,159649,Here is my 2004 A4 USP Avant 6mt,0.99,https://i.redd.it/xkq9loeti3291.jpg
uyyg7s,44312,19166,1409,False,t3_uyyg7s,225,False,1223,False,False,False,2qhnk,t5_2qhnk,2153446,"Nintendo of America on Twitter: ""Be ready for more no-holds-barred Strike action following the launch of #MarioStrikers: Battle League, as there are free post-launch updates coming, including new characters!""",0.97,https://twitter.com/NintendoAmerica/status/1530177091475496960
uz7n96,11384,1312,913,False,t3_uz7n96,26,False,323,False,False,False,3k7ez,t5_3k7ez,599320,this is a sad day for brawl stars indeed,0.94,https://i.redd.it/azi91gj513291.png
uz1isy,7952,14390,1261,False,t3_uz1isy,27,False,795,False,False,False,427he1,t5_427he1,37966,Come on! Who dares to battle me?!,0.98,https://i.redd.it/zzub2ye7l1291.jpg
uz8a6f,95,462,932,False,t3_uz8a6f,61,False,316,False,False,False,2r3p6,t5_2r3p6,256176,What your favourite Radiohead album says about you,0.93,https://i.redd.it/740gkpjf63291.png
uyvyuo,59069,14345,112,False,t3_uyvyuo,130,False,1935,False,False,False,2qhvj,t5_2qhvj,641780,Me tripping,0.98,https://i.redd.it/r92kxlie50291.jpg
uzajf9,5956,3241,815,False,t3_uzajf9,5,False,236,False,False,False,3lry9,t5_3lry9,485289,Angry pickle gets knocked out of the air last second by SAED,1.0,https://v.redd.it/ld94njsvq3291
uz0mho,8545,5248,1303,False,t3_uz0mho,209,False,895,False,False,False,2y1rb,t5_2y1rb,138547,Don’t hate me but,0.93,https://i.imgur.com/bU7DLU7.jpg
uz0orr,377,2839,1301,False,t3_uz0orr,102,False,869,False,False,False,2swge,t5_2swge,768995,Mom joined an MLM and she thinks we're not supporting her.,0.99,https://www.reddit.com/r/antiMLM/comments/uz0orr/mom_joined_an_mlm_and_she_thinks_were_not/
uzd9yb,5702,17018,616,False,t3_uzd9yb,16,False,303,False,False,False,38c5p,t5_38c5p,136023,Not my cat has wares if you have coin.,1.0,https://i.redd.it/bf02ef8mi4291.jpg
uz4chw,2075,6897,1129,False,t3_uz4chw,58,False,527,False,False,False,2t8de,t5_2t8de,607819,"My dream Apartment! Botanical, cottage, witchy vibes.",0.96,https://www.reddit.com/gallery/uz4chw
uz43us,41937,72363,1142,False,t3_uz43us,62,False,534,False,False,False,2vu7a,t5_2vu7a,42379,A panel from Yujiro vs Kaku Kaioh colored by me,0.99,https://www.reddit.com/gallery/uz43us
uz2ku7,8335,9158,1212,False,t3_uz2ku7,24,False,686,False,False,False,2wgr5,t5_2wgr5,96464,the USA player's dilemma,0.98,https://i.redd.it/eub8u28vt1291.png
uyzyg6,1469,878,1386,False,t3_uyzyg6,12,False,981,False,False,False,2um64,t5_2um64,465328,PIC,0.99,https://i.imgur.com/nkJCW9F.jpg
uz3b6y,242,44374,1179,False,t3_uz3b6y,24,False,603,False,False,False,37q5a,t5_37q5a,93256,Shhhhhhhiiiissss!! 😍,0.97,https://v.redd.it/qi7vleysz1291
uz9e17,17367,19240,883,False,t3_uz9e17,3,False,259,False,False,False,2xuj2,t5_2xuj2,47186,"Everyone looked away from the tweet, how are we supposed to get there now?",1.0,https://i.redd.it/ukjh890cg3291.jpg
uz667y,22843,25939,1090,False,t3_uz667y,17,False,443,False,False,False,324q4,t5_324q4,239420,oh my shucking cod,0.99,https://v.redd.it/29sbh68bo2291
uz9psp,1260,1519,867,False,t3_uz9psp,15,True,244,False,False,False,3pmyi,t5_3pmyi,484145,"The lips, the boobs…it all looks painful. Her “before” pic is last",0.97,https://www.reddit.com/gallery/uz9psp
uzb7if,25703,3814,738,False,t3_uzb7if,14,False,175,False,False,False,2rqn4,t5_2rqn4,166902,Sister in law thought I got professional photos taken . . . just a blanket on my couch.,0.99,https://i.imgur.com/tkLlGYu.jpg
uz9t7m,196,6955,811,False,t3_uz9t7m,8,False,539,False,False,False,2r8tu,t5_2r8tu,3925918,The power of bubbles,0.95,https://v.redd.it/3jzkdgyrpv091
uzdvbq,3007,9509,583,False,t3_uzdvbq,38,False,266,False,True,False,2t3or,t5_2t3or,489809,Who else LOVED all the queens reactions when they saw _ _ _ _ _ _ _ _ _ _?!,1.0,https://v.redd.it/hoa82xdho4291
uz6no5,72419,430973,1056,False,t3_uz6no5,19,False,469,False,False,False,3j659,t5_3j659,409042,Weeb diss track ft. the r/ComedyNecrophilia cast,0.99,https://i.redd.it/sx65dc9hs2291.png
