post_id,author_comment_karma,author_link_karma,time_in_mins,post_is_original_content,post_name,post_num_comments,post_over_18,post_score,post_has_link,post_spoiler,post_stickied,subreddit_id,subreddit_name,subreddit_subscriber_count,post_title,post_upvote_ratio,post_url
uz6vw1,7410,7498,988,False,t3_uz6vw1,18,False,866,False,False,False,2w858,t5_2w858,416851,Hot and red. chilli of course 🌶,0.99,https://i.redd.it/bojlcuvhu2291.jpg
uzcrik,17883,6692,682,False,t3_uzcrik,40,False,337,False,False,False,2qrap,t5_2qrap,281080,"anytime i’m depressed, arrested development is my comfort show. every time i watch it i can’t believe the show is from the early 2000’s as i was born in 1999. way ahead of its time",0.97,https://i.redd.it/s4mszqs3d4291.jpg
uz12hq,10356,2017,1263,False,t3_uz12hq,22,True,2089,False,True,False,k44tx,t5_k44tx,491987,Getting some helpful information from Spider-Man's biggest foe,0.99,https://i.redd.it/5k9wsx6kh1291.jpg
uz3b5q,9451,3491,1159,False,t3_uz3b5q,21,False,1462,False,False,False,3l4bg9,t5_3l4bg9,86066,it's time to duel,0.99,https://i.redd.it/qwau45wzz1291.jpg
uz8vr1,416051,2453267,891,False,t3_uz8vr1,419,False,4027,False,False,False,35n7t,t5_35n7t,2536580,explained at 𝙡𝙚𝙣𝙜𝙩𝙝,0.98,https://i.imgur.com/rNzD48O.jpg
uyz2oh,750,4440,1358,False,t3_uyz2oh,28,False,2833,False,False,False,2x88b,t5_2x88b,276409,I'm not good at goodbyes. Well nobody is.,0.99,https://i.redd.it/lyh30f6l01291.jpg
uza12z,5065,213370,833,False,t3_uza12z,7,False,548,False,False,False,2xyw0,t5_2xyw0,2339997,Just a Good Boi making sure the smaller ones in his pack are sleeping safely.,0.98,https://v.redd.it/we1402cduz191
uza8s8,49808,16084,822,False,t3_uza8s8,95,False,1249,False,True,False,2t3or,t5_2t3or,489817,Raja spent the last 10 years listening that she's not anymore *that* fashion icon she was on S03 cuz she always was in sweaters and t-shirts in WOW basement for Fashion Photo Ruview just to serve...........THIS LEVEL OF EXCELENCE in 3 eps only. Just a reminder that Raja's power is unmatched,0.99,https://i.redd.it/mq6fvxzyn3291.png
uyyne2,52302,330783,1379,False,t3_uyyne2,231,False,16884,False,False,False,j34kt,t5_j34kt,2389615,Blursed_meeting,0.96,https://i.redd.it/vuvw5c2vw0291.png
uz53d2,1080,24351,1074,False,t3_uz53d2,28,False,1120,False,False,False,2tugx,t5_2tugx,155667,German Air Force McDonnell Douglas F-4F Phantom II [3840x2160],0.99,https://wallpapercave.com/wp/5PutqAf.jpg
uz34zy,879,14603,1168,False,t3_uz34zy,216,False,1510,False,False,False,2qkli,t5_2qkli,220929,Scotland in a nutshell,0.89,https://v.redd.it/e804xudey1291
uzeu9y,1054,37511,555,False,t3_uzeu9y,25,False,231,False,False,False,3d4x4,t5_3d4x4,299923,"Telangana government gives Rs 5,000 for honorarium for Imams, Muezzins in the state . This is next level appeasement by government and when the society will react to it they will say we Hindus are getting intolerant. Why no grant for priests of temples and Churches if the government is secular ?",0.89,https://i.redd.it/3y9hydcuz4291.jpg
uz2l4g,2491,6651,1193,False,t3_uz2l4g,13,False,1605,False,False,False,2udns,t5_2udns,186933,"""I want a big orange cat surrounded by smaller cats"" nailed it?",1.0,https://v.redd.it/qog3ez7zt1291
uzbkcv,224035,436541,752,False,t3_uzbkcv,339,False,2553,False,False,False,2yo6b,t5_2yo6b,2324739,This has “Dont Go In There” vibes,0.99,https://v.redd.it/9ng168tp04291
uz2d1a,492,3523,1204,False,t3_uz2d1a,26,False,1660,False,False,False,3eean,t5_3eean,253374,Wingless Goose,0.99,https://v.redd.it/2ctqzbako0291
uz3q4w,1042,13084,1140,False,t3_uz3q4w,17,False,1354,False,False,False,323oy,t5_323oy,1911737,My Airbnb host just caught me crying.,0.99,https://www.reddit.com/r/CasualConversation/comments/uz3q4w/my_airbnb_host_just_caught_me_crying/
uz5ey8,1545,49887,1060,False,t3_uz5ey8,7,False,1062,False,False,False,3p77e0,t5_3p77e0,151386,Mark Meadows reportedly burned papers after meeting with GOP lawmaker,0.99,https://theweek.com/mark-meadows/1013962/mark-meadows-reportedly-burned-papers-after-meeting-with-gop-lawmaker
uzcqk1,43371,1752431,684,False,t3_uzcqk1,8,False,339,False,False,False,2yw2v,t5_2yw2v,113422,You shall not pass!,0.99,https://v.redd.it/wglw642tc4291
uz8f0p,449,70216,915,False,t3_uz8f0p,28,False,1646,False,False,False,2qt55,t5_2qt55,21463054,It's just the perfect spot.,0.96,https://i.redd.it/7p1aueeo73291.gif
uze80t,220829,127097,595,False,t3_uze80t,11,False,258,False,False,False,2s7w9,t5_2s7w9,61142,30-17,0.99,https://i.redd.it/68kg5bkus4291.jpg
uyvtpz,4980,16209,103,False,t3_uyvtpz,373,False,5355,False,False,False,2xp2o,t5_2xp2o,1002979,Fighting a bottle,0.92,https://v.redd.it/tktgh5rn30291
uyw75r,70,5193,78,False,t3_uyw75r,82,False,4920,False,False,False,2u5kl,t5_2u5kl,3884926,Mercy fan art by me,0.96,https://i.redd.it/klbvvhw680291.jpg
uzbozl,308075,1203375,745,False,t3_uzbozl,326,False,955,False,False,True,2qhv6,t5_2qhv6,316609,"[Wojnarowski] The Lakers have hired Darvin Ham as coach, sources tell ESPN.",0.97,https://twitter.com/wojespn/status/1530344012607066112
uz7nlp,4862,6355,951,False,t3_uz7nlp,3,False,756,False,False,False,2w1qa,t5_2w1qa,455098,It’s *leviohsah* not *leviohsuh*,0.99,https://i.redd.it/47jcxf7913291.jpg
uz61u9,61145,141405,1029,False,t3_uz61u9,9,False,950,False,False,False,2tg3p,t5_2tg3p,205304,"[942x648] Triple 305 mm turrets being built for Italian dreadnoughts, in the Vickers-Terni factory at La Spezia, first half of the 1910s",0.99,https://i.redd.it/od10lxl1n2291.jpg
uz96to,6910,1976,877,False,t3_uz96to,99,False,596,False,False,False,3iptz,t5_3iptz,43694,no words.,0.96,https://i.redd.it/f73ygmvke3291.png
uyxssr,370,5085,1424,False,t3_uyxssr,22,False,3620,False,False,False,5aiyne,t5_5aiyne,108779,change is in the air,0.99,https://i.redd.it/8cwxhxmwo0291.jpg
uz3t8d,71,1348,1136,False,t3_uz3t8d,10,False,1343,False,False,False,2ubln,t5_2ubln,61182,Pokemon games when your Parents walk in,0.99,https://i.redd.it/oudlyw4842291.jpg
uz4njm,606,5934,1096,False,t3_uz4njm,148,False,1169,False,False,False,2xuj2,t5_2xuj2,47186,they just tweeted this and took it down???,0.97,https://i.redd.it/6s2noo7db2291.jpg
uz6i98,1252,9102,1007,False,t3_uz6i98,27,False,896,False,False,False,2th0f,t5_2th0f,640486,Without those it'd be troublesome,0.99,https://i.redd.it/mqmpjue9r2291.jpg
uz95ia,34999,90182,879,False,t3_uz95ia,17,False,605,False,False,False,2sqho,t5_2sqho,1658618,Broky's collection of gold coins,0.98,https://i.redd.it/6ghoy2k6e3291.png
uz44ib,2883,16922,1122,False,t3_uz44ib,42,False,1258,False,False,False,2tqd4,t5_2tqd4,517240,Why would you do that?,0.96,https://v.redd.it/loynn2cj62291
uz2rs6,58994,19856,1185,False,t3_uz2rs6,113,False,4095,False,False,False,2uao3,t5_2uao3,2742292,Trashy,0.96,https://i.redd.it/wz7rx6xiv1291.jpg
uyxzmy,4458,52536,1414,False,t3_uyxzmy,99,False,12541,False,False,False,386zh,t5_386zh,2027317,anime_irl,0.98,https://i.redd.it/hd51i1hoq0291.jpg
uyyl85,1608,7956,1383,False,t3_uyyl85,45,False,2879,False,False,False,3b291,t5_3b291,413872,"Whenever I put my bra on Hobbes' head, he always welcomes it and sits comfortably.",0.99,https://i.redd.it/wf6t245bw0291.jpg
uz87w3,6167,1859,925,False,t3_uz87w3,78,False,684,False,False,False,9d1wl,t5_9d1wl,81999,"Was is that hard, Disney? (Star Wars: Survivor)",0.97,https://i.redd.it/mix5xkqx53291.jpg
uz1m0y,376,9255,1239,False,t3_uz1m0y,83,False,1824,False,False,False,2t2xg,t5_2t2xg,329108,New Image from S3!,0.98,https://i.redd.it/mhi9nwfxl1291.jpg
uyxi0w,4282,17624,1,False,t3_uyxi0w,115,False,3612,False,False,False,2x2n9,t5_2x2n9,382570,funniest read dead tiktok I've seen in a while 😂,0.98,https://v.redd.it/kw9xrurxl0291
uz5kqb,15661,2615,1052,False,t3_uz5kqb,1155,False,1155,False,False,False,2s4tv,t5_2s4tv,771587,Current state of this sub now days,0.58,https://i.redd.it/4lv0wfu7j2291.jpg
uyzdb3,25680,330613,1345,False,t3_uyzdb3,310,False,9540,False,False,False,2qoos,t5_2qoos,535054,What happens if a squirrel eats fermented pears?,0.96,https://v.redd.it/xwvp0qe431291
uz1gfg,73668,1441644,1247,False,t3_uz1gfg,426,False,56888,False,False,False,2r5rp,t5_2r5rp,6278219,They are turning the fricking lions gay...,0.92,https://i.redd.it/ibqwjc0pk1291.png
uz8gbw,4241,5158,914,False,t3_uz8gbw,35,False,652,False,False,False,38oju,t5_38oju,971611,burger store near my place. I'm dying guys,0.99,https://i.redd.it/u3khrmk083291.jpg
uzesk3,25,1473,559,False,t3_uzesk3,4,False,224,False,False,False,3o2iq,t5_3o2iq,320096,Grover does a mlem,1.0,https://www.reddit.com/gallery/uzesk3
uz0crn,16621,79350,1300,False,t3_uz0crn,82,False,6878,False,False,False,rgzzt,t5_rgzzt,2080938,"""Technological Tracker"" my ass",0.99,https://v.redd.it/aszpf9nfb1291
uyxokd,10,2211,1432,False,t3_uyxokd,246,False,3359,False,False,False,5wptpp,t5_5wptpp,103860,"Russian woman drawing Z sign on a pole in Brooklyn ,E 14th St & Kings Hwy",0.95,https://v.redd.it/3vhfuf8mn0291
uz4qlr,1274,6385,1093,False,t3_uz4qlr,63,False,1152,False,False,False,8ydx6,t5_8ydx6,154371,Men just want one thing,0.99,https://i.imgur.com/wv9Eews.jpg
uz4rlk,12533,270852,1092,False,t3_uz4rlk,9,False,1126,False,False,False,3imv0,t5_3imv0,185196,I tried to draw Byleth as an Arknights/GBF-styled unit!,0.96,https://i.redd.it/nuttp2p9c2291.jpg
uzc21v,8816,53603,725,False,t3_uzc21v,13,False,363,False,False,False,rhsj0,t5_rhsj0,335663,“Speed…I am speed.”,0.99,https://v.redd.it/en5dhy5gmtw81
uzak2c,1581,419,808,False,t3_uzak2c,2,False,475,False,False,False,m55ss,t5_m55ss,75536,Polite Scrabble Player,0.99,https://i.redd.it/yyfgtvv3r3291.jpg
uz924v,4405,20458,885,False,t3_uz924v,39,False,592,False,False,False,3opwf,t5_3opwf,228466,"Sayori, since I don’t think I’ve ever drawn her before!",0.98,https://i.redd.it/e60tagwed3291.jpg
uz9pbm,133450,99262,854,False,t3_uz9pbm,388,False,535,False,False,False,2rj3j,t5_2rj3j,1697681,Baylor Forward Matthew Mayer transfers to Illinois,0.94,https://www.reddit.com/r/CollegeBasketball/comments/uz9pbm/baylor_forward_matthew_mayer_transfers_to_illinois/
uz0huw,186,2265,1294,False,t3_uz0huw,448,False,5651,False,False,False,2r2jt,t5_2r2jt,13358918,Our republican parents don't understand the long term consequences of their actions,0.93,https://www.reddit.com/r/TwoXChromosomes/comments/uz0huw/our_republican_parents_dont_understand_the_long/
uzdy3n,3207,59918,616,False,t3_uzdy3n,29,False,260,False,False,False,rty81,t5_rty81,303547,Champion 😎🤝,0.94,https://i.redd.it/nvis9sesp4291.jpg
uz9oou,28818,64599,856,False,t3_uz9oou,10,False,533,False,False,False,2qzze,t5_2qzze,122939,Secret boss fight 🗿,0.99,https://i.redd.it/52tyaw3zi3291.png
uz5na4,245463,653789,1053,False,t3_uz5na4,171,False,981,False,False,False,3dw7go,t5_3dw7go,167712,"""The godless commies couldnt Rittenhouse Rittenhouse, so now they’re trying to Rittenhouse the Uvalde shooter.""",0.98,https://i.redd.it/8kslj32sj2291.png
uzec1r,629,19468,593,False,t3_uzec1r,130,False,244,False,False,False,2qjfk,t5_2qjfk,4104237,Elon Musk Says Bill Gates Has ‘Multi-Billion Dollar’ Tesla Short Position,0.87,https://www.reddit.com/r/stocks/comments/uzec1r/elon_musk_says_bill_gates_has_multibillion_dollar/
uz4hd9,0,557,1110,False,t3_uz4hd9,40,False,1195,False,False,False,2rm4d,t5_2rm4d,15828647,I work as a 9-1-1 operator. It’s been 36 hour since I got that first call about a sleepwalking man.,0.97,https://www.reddit.com/r/nosleep/comments/uz4hd9/i_work_as_a_911_operator_its_been_36_hour_since_i/
uyx1zo,361,6149,32,False,t3_uyx1zo,545,False,20680,False,False,False,34o9s,t5_34o9s,3165571,Decade I grew up in Starter Pack,0.92,https://i.redd.it/ztowx9hah0291.jpg
uz2m2s,5121,15750,1198,False,t3_uz2m2s,55,False,1528,False,False,False,2r2ct,t5_2r2ct,67706,My old boy having a nice sit,1.0,https://i.redd.it/oh0l1yy7u1291.jpg
uyw1wo,705034,4995843,93,False,t3_uyw1wo,233,False,4769,False,False,False,2h9x5r,t5_2h9x5r,82612,"Conservatives are the dumbest drooling morons on the planet. The one on the right is just someone taking a picture of their actual TV. I swear, they are still stuck in the Stone Age when it comes to understanding technology.",0.92,https://i.redd.it/vm6lx8b560291.jpg
uyxqrx,13903,13825,1433,False,t3_uyxqrx,321,True,3263,False,False,False,aclr0,t5_aclr0,345927,A male patient has an impressively-massive foreign body removed,0.98,https://v.redd.it/hbo170i9o0291
uz13o6,10469,23625,1268,False,t3_uz13o6,395,False,37098,False,False,False,2th52,t5_2th52,12184235,New Poll Summarizes Inflation Nicely,0.95,https://i.redd.it/z1ggwgguh1291.jpg
uzc9bh,2243,2346,719,False,t3_uzc9bh,16,False,857,False,False,False,2r05i,t5_2r05i,6568476,Inflation being a little too real in this game,0.99,https://i.redd.it/41v265ut74291.jpg
uzcrhb,19241,82513,689,False,t3_uzcrhb,13,False,323,False,False,False,2wky1,t5_2wky1,230530,"Fast as hell, but doing well ?",0.91,https://v.redd.it/xhml72j2d4291
uz37n3,176410,524838,1171,False,t3_uz37n3,39,False,1394,False,False,False,2sq9y,t5_2sq9y,525483,"Japanese officers salute the grave of a British soldier in a rubber tree plantation, British Malaya, circa early 1942 [1080x757]",0.98,https://i.redd.it/mrqimesyx1291.jpg
uz4dqb,13230,67447,1116,False,t3_uz4dqb,151,False,2934,False,False,False,2qgzy,t5_2qgzy,20212853,Mariusz Pudzianowski wins the Power Stairs during the 2008 World's Strongest Man contest,0.95,https://v.redd.it/xlopulpx82291
uyvwy1,191626,416439,103,False,t3_uyvwy1,992,False,27822,False,False,False,2qqjc,t5_2qqjc,27703322,"TIL Weird Al's biggest problem with services that illegally distributed his music was that they would misattribute songs to him. Al was especially annoyed by profane songs like, ""Baby Got Jack” or “Ugly Girl”.",0.94,https://www.weirdal.com/archives/miscellaneous/ask-al/
uz3zzy,45225,171367,1134,False,t3_uz3zzy,239,False,1240,False,False,False,2w31t,t5_2w31t,1867392,New Card Revealed - Neptulon the Tidehunter,0.97,https://i.redd.it/htzowydq52291.png
uz8lpt,41889,22442,913,False,t3_uz8lpt,11,False,624,False,False,False,30cqj,t5_30cqj,500990,I think this qualifies,0.97,https://v.redd.it/4uj2ixu0m0291
uz66cc,25267,10953,1030,False,t3_uz66cc,132,False,906,False,False,False,2rrd6,t5_2rrd6,120269,The only objectively correct Metroid tier list,0.87,https://i.imgur.com/yIeruKd.png
uz9w8t,193,6606,847,False,t3_uz9w8t,6,False,1255,False,False,False,35f67,t5_35f67,897709,Hmmm,0.99,https://i.redd.it/pf73zeu7e1291.gif
uz7vvm,445,546,947,False,t3_uz7vvm,12,False,695,False,False,False,2unq2,t5_2unq2,50756,My brothers mashallah this chroma is SICK!!,0.99,https://i.redd.it/aof4s2rx23291.jpg
uzd9su,521,3936,659,False,t3_uzd9su,2,False,286,False,False,False,3gtur,t5_3gtur,210375,Biscuit time,0.98,https://v.redd.it/wulk2jcki4291
uzd8ge,12,521,661,False,t3_uzd8ge,22,False,289,False,False,False,2t8de,t5_2t8de,607815,Living Room Makeover (I love the pink),0.99,https://i.redd.it/ftvezw9ze4291.jpg
uyzw28,13187,24925,1326,False,t3_uyzw28,16,False,2260,False,False,False,2r78l,t5_2r78l,640696,If Kanye went to London instead of Paris,0.99,https://i.redd.it/r7fewn2n71291.png
uyxjpt,36806,24161,5,False,t3_uyxjpt,1261,False,5904,False,False,False,2qh63,t5_2qh63,505523,"Woman with pistol kills man with AR15 firing into crowd, stopping potential mass shooting",0.64,https://abcnews.go.com/US/wireStory/police-woman-killed-man-fired-rifle-party-crowd-85002437
uz817z,32452,28280,940,False,t3_uz817z,15,False,680,False,False,False,2zij4,t5_2zij4,840863,The railings held...,0.98,https://v.redd.it/32tufpq672291
uyywza,537,1810,1373,False,t3_uyywza,42,False,2685,False,False,False,38c6g,t5_38c6g,210791,Colossal Titan titan,0.98,https://i.redd.it/1h6xbsz7z0291.jpg
uzblf5,776,54548,758,False,t3_uzblf5,35,False,388,False,False,False,33yph,t5_33yph,137592,Ignorning the abuse inflicted onto the LGBTQ+ community by cops...,0.93,https://i.redd.it/566d7hj4g1291.jpg
uywymu,889,14203,39,False,t3_uywymu,71,False,3976,False,False,False,kf94g,t5_kf94g,1045972,Answers to the questions on my previous post : it works with batteries and yes it can still be used without the motor.,0.98,https://v.redd.it/caalz7l0g0291
uz6jth,2108,39519,1012,False,t3_uz6jth,3,False,842,False,False,False,3c02l,t5_3c02l,323832,I'd wish,0.98,https://i.redd.it/7yls5sxrzz191.gif
uz7zz2,2672,3167,942,False,t3_uz7zz2,36,False,681,False,False,False,2vcz8,t5_2vcz8,335538,"My first place by myself. Small but mine :,)",0.99,https://i.redd.it/po9vspc443291.jpg
uyz6nx,4686,34569,1360,False,t3_uyz6nx,21,False,2507,False,False,False,2xwtp,t5_2xwtp,349900,A long boi giving me a long talk after not seeing him for 2 days,0.99,https://v.redd.it/5se20n1j11291
uzd9k6,313,1957,660,False,t3_uzd9k6,18,False,287,False,False,False,2qoih,t5_2qoih,372766,For all those who wanted to see the kiosk set up.,0.99,https://i.redd.it/hkhqobwhi4291.jpg
uz4n1g,43594,177757,1104,False,t3_uz4n1g,51,False,2757,False,False,False,3n328,t5_3n328,886692,A purrfesional Dungeon Master.,0.99,https://i.imgur.com/zdwsLML.jpg
uzav10,6043,473982,798,False,t3_uzav10,1,True,434,False,False,False,2yn47,t5_2yn47,86711,Ryuko showing off her sixpack (Velminth),0.97,https://i.redd.it/1kwrc5dxt3291.png
uz6xyz,17088,49138,994,False,t3_uz6xyz,195,False,1946,False,False,False,2w7mz,t5_2w7mz,5359954,Am I dreaming?,0.98,https://i.redd.it/8kbaop8wu2291.png
uz4qfc,231,1981,1100,False,t3_uz4qfc,28,False,1107,False,False,False,x22a1,t5_x22a1,56984,The Block 19,0.98,https://i.redd.it/yttxfk1zb2291.jpg
uz1h71,12284,138211,1252,False,t3_uz1h71,80,False,1776,False,False,False,2wabp,t5_2wabp,283993,"""That guy can't even set the steam engine right""",0.92,https://i.redd.it/omyfwgzpk1291.png
uzc7sl,5597,5999,722,False,t3_uzc7sl,78,False,347,False,False,False,2qls5,t5_2qls5,1619752,[Omega speedmaster 1967] Did I just find what think I just found....?,0.99,https://www.reddit.com/gallery/uzc7sl
uzb0in,52226,527782,790,False,t3_uzb0in,19,False,428,False,False,False,3c3oy,t5_3c3oy,64511,Hmm…doesn’t appear to be anything here,0.93,https://www.reddit.com/gallery/uzb0in
uzeng3,6255,14872,575,False,t3_uzeng3,47,False,546,False,False,False,2s7tt,t5_2s7tt,9493398,It was dereliction of duty. In the military they'd be court martialed.,0.95,https://i.redd.it/gcyz5gggx4291.jpg
uz6t7n,20261,84477,1000,False,t3_uz6t7n,55,False,1990,False,False,False,2qixk,t5_2qixk,1246599,"New Intro, New Possibility",0.99,https://v.redd.it/x1rnqkeyr2291
uywxw9,637,5158,41,False,t3_uywxw9,106,False,3780,False,False,False,2viau,t5_2viau,1778597,[Spinet Elite 5] This is our stop.,0.98,https://v.redd.it/jeolyjzzf0291
uyzq1x,151,4864,1334,False,t3_uyzq1x,77,False,6483,False,False,False,2u0zn,t5_2u0zn,351490,It's true,0.98,https://i.redd.it/83300qq661291.png
uz6sz8,153,39883,1000,False,t3_uz6sz8,49,False,838,False,False,False,24m64v,t5_24m64v,224907,Jennifer Gurrola (@jennifergurrolaa),0.93,https://v.redd.it/iy74j2kqt2291
uzbng8,860,24329,755,False,t3_uzbng8,10,False,383,False,False,False,2qloj,t5_2qloj,61555,Every 7-11 has one,0.99,https://i.redd.it/qasojgak14291.gif
uzdad2,4819,5194,659,False,t3_uzdad2,3,False,688,False,False,False,2u3ta,t5_2u3ta,17969887,New independent Mexican union wins wage increase at GM plant,0.97,https://apnews.com/article/mexico-caribbean-bc8edb21805edea5cbb6425744db8806
uz6jdg,155,1290,1013,False,t3_uz6jdg,31,False,2069,False,False,False,3ptyd,t5_3ptyd,1457711,Looks like a 8K Picture. Can’t believe it’s made by hand,0.96,https://v.redd.it/4zbuqqohr2291
uz69om,204,997,1026,False,t3_uz69om,46,False,875,False,False,False,36k8a,t5_36k8a,142728,The new TF2 update dropped!,0.98,https://i.redd.it/sd7zrno8p2291.png
uyztfz,768,2703,1330,False,t3_uyztfz,15,False,2222,False,False,False,2sb8j,t5_2sb8j,397063,This little Barred owl was posted on fb by Hope for Wildlife with a dislocated elbow. He will recover completely.,0.99,https://www.reddit.com/gallery/uyztfz
uyvo76,44,23789,119,False,t3_uyvo76,88,False,5194,False,False,False,2yo2z,t5_2yo2z,2697879,Hippity hop,0.98,https://v.redd.it/zwyg5rj320291
uzd6sr,43426,36842,665,False,t3_uzd6sr,19,False,294,False,False,False,38f3iy,t5_38f3iy,115039,I’ll fucking defend the base game fight me,1.0,https://i.redd.it/rh8j4dxnh4291.gif
uzbv2y,10,904,743,False,t3_uzbv2y,5,False,365,False,False,False,2riv8,t5_2riv8,254799,I’m digging Dusty’s vibes…,1.0,https://i.redd.it/2000juyo34291.jpg
uzbk5r,37795,621749,760,False,t3_uzbk5r,13,False,383,False,False,False,2vsua,t5_2vsua,46769,"""Come with me, Senpai. Oh, I love you so much~❤""",0.99,https://i.redd.it/0i08o76o04291.jpg
uz9bu8,5,314,878,False,t3_uz9bu8,17,False,541,False,False,False,2s0v1,t5_2s0v1,90081,Warrington 2022,0.99,https://i.redd.it/bjl8150sf3291.jpg
uzfpku,0,74,508,False,t3_uzfpku,54,False,187,False,False,False,3onkg,t5_3onkg,148027,LL not getting receipts,0.96,https://clips.twitch.tv/DepressedGloriousKalePeanutButterJellyTime-4Lm8BydSGnRJn2fp
uz6qoo,1419,6816,1004,False,t3_uz6qoo,67,False,798,False,False,False,2qp9o,t5_2qp9o,317420,Mario Kart in VR is a whole new world of fun!,0.95,https://v.redd.it/nykrfqavq2291
uz67ge,5697,44418,1029,False,t3_uz67ge,62,False,870,False,False,False,2rhbm,t5_2rhbm,2449381,I love this Greek Salad on a hot day!,0.97,https://i.redd.it/ijiej62qo2291.jpg
uz7690,4720,7461,983,False,t3_uz7690,28,False,759,False,False,False,2uh5t,t5_2uh5t,96942,true,0.98,https://i.redd.it/z0mgrxfww2291.jpg
uz12xu,46112,758688,1271,False,t3_uz12xu,228,False,1833,False,False,False,2qjyy,t5_2qjyy,479825,Salesforce staff want to cut NRA ties after Uvalde shooting,0.94,https://www.sfgate.com/bayarea/article/Salesforce-workers-demand-company-stop-working-NRA-17202021.php
uz8nbc,20167,8640,912,False,t3_uz8nbc,19,False,606,False,False,False,2td2i,t5_2td2i,47637,Boston is the greatest sports city on the planet,0.99,https://i.redd.it/6faj79kf93291.png
uz0x1q,535,9486,1278,False,t3_uz0x1q,21,False,1929,False,False,False,11tk33,t5_11tk33,142841,gonna leave this here,0.99,https://i.redd.it/kczrk3zag1291.jpg
uz8sn3,38,516,904,False,t3_uz8sn3,9,False,591,False,False,False,3f2yn,t5_3f2yn,285515,shiny diet coke,0.94,https://i.redd.it/zrpihva3b3291.jpg
uyyk8e,0,5190,1392,False,t3_uyyk8e,30,False,2738,False,False,False,35rwtp,t5_35rwtp,115467,The feeling when your friends abandon you,0.99,https://i.redd.it/905lz7prv0291.png
uywzq8,9926,30164,39,False,t3_uywzq8,59,False,3585,False,False,False,hwe5w,t5_hwe5w,154843,Poptart meets the air conditioner,0.99,https://i.redd.it/lvru3m0mg0291.jpg
uz8b4x,12778,3396,929,False,t3_uz8b4x,77,False,1558,False,False,False,2sf6m,t5_2sf6m,484451,Status Effect Health Orbs-V2 (+200% Effort),0.94,https://i.imgur.com/15VcHrS.gif
uzd2f6,5033,305,673,False,t3_uzd2f6,15,False,288,False,False,False,2s7a6,t5_2s7a6,88828,"Ate an edible, and waiting for Bob's Burgers to start. What a magical night.",0.98,https://i.redd.it/qyj29j1dg4291.jpg
uzcp2a,1427,8446,695,False,t3_uzcp2a,10,False,311,False,False,False,2te6p,t5_2te6p,562910,"Thanks to a late reservation at Oga’s Cantina, I managed to capture this photo after the park closed.",0.99,https://i.redd.it/y5ypmqwcc4291.jpg
uzbzci,13,602,737,False,t3_uzbzci,59,False,852,False,False,False,39inp,t5_39inp,551286,a lot,0.96,https://i.redd.it/6r46q2uw44291.jpg
uz6q1n,175221,271241,1005,False,t3_uz6q1n,100,False,796,False,False,False,mmcxm,t5_mmcxm,38246,"Lot of you are saying some real anti-cop stuff. But just wait until someone breaks into your house and you need someone to show up an hour later and shrug their shoulders, what'll you do then?",0.96,https://www.reddit.com/r/behindthebastards/comments/uz6q1n/lot_of_you_are_saying_some_real_anticop_stuff_but/
uz5t6x,39,3615,1049,False,t3_uz5t6x,20,False,924,False,False,False,5kvon5,t5_5kvon5,94524,krotos,0.96,https://v.redd.it/2jr6pqwal2291
uyygqz,1335,449435,1398,False,t3_uyygqz,23,False,2738,False,False,False,2rlke,t5_2rlke,1585839,1973 PLYMOUTH CUDA [750x850],0.99,https://i.redd.it/gf1snea4v0291.jpg
uz09dj,688,3347,1310,False,t3_uz09dj,41,False,2110,False,False,False,2vez1,t5_2vez1,240369,Found this on Instagram.,0.98,https://i.redd.it/4fllut2oa1291.jpg
uzcn0h,687,821,699,False,t3_uzcn0h,21,False,309,False,False,False,2vso4,t5_2vso4,178362,Since we are posting synth vibe videos,0.96,https://v.redd.it/yncg5ybrb4291
uz0nyr,50,1121,1291,False,t3_uz0nyr,54,False,1974,False,False,False,38p4n,t5_38p4n,376646,WOW! WOW! WOW! Moment.,0.99,https://v.redd.it/b1dv3vr5e1291
uz8k5a,4386,42876,917,False,t3_uz8k5a,76,False,1486,False,False,False,45hae8,t5_45hae8,875132,This Guy Can Do Double Backflips,0.97,https://v.redd.it/krulkytx83291
uz06g2,71770,146692,1314,False,t3_uz06g2,43,False,2048,False,False,False,3ca4m,t5_3ca4m,135270,sErVe aNd pRoTeCt,0.99,https://i.redd.it/fy683s95hw191.gif
uz63sh,41678,45514,1035,False,t3_uz63sh,74,False,868,False,True,False,ge6kz,t5_ge6kz,106910,I love this connection so much,0.87,https://i.redd.it/5oohaj3vn2291.jpg
uz6pys,3291,48822,1006,False,t3_uz6pys,14,False,785,False,False,False,2riwr,t5_2riwr,202521,Kiki's Delivery Service (Animated by me),0.99,https://v.redd.it/fo3rd43ms2291
uz2urt,0,26020,1190,False,t3_uz2urt,133,False,1420,False,False,False,4c9xpc,t5_4c9xpc,271586,guy challanges bjj white belt,0.96,https://v.redd.it/c4iwrag5w1291
uz1xgu,45728,25621,1233,False,t3_uz1xgu,36,False,1631,False,False,False,2x1rn,t5_2x1rn,1015573,WAT,0.99,https://i.redd.it/tb9e5svgo1291.jpg
uz08b6,3410,271459,1312,False,t3_uz08b6,18,False,7744,False,False,False,k2lq4,t5_k2lq4,225796,good bird \(^u^)/,0.98,https://i.redd.it/pe9s5txea1291.gif
uz50ia,8698,138262,1088,False,t3_uz50ia,644,False,8574,False,False,False,3jj03,t5_3jj03,1798471,POS man attacks woman instead of putting his dogs on leash,0.98,https://v.redd.it/wkedkeige2291
uzaqyz,9565,147441,805,False,t3_uzaqyz,4,False,429,False,False,False,3jtm62,t5_3jtm62,73067,comfy (Daily Hu Tao day 133)(By: cyota ),1.0,https://i.redd.it/o9a01xups3291.jpg
