post_id,author_comment_karma,author_link_karma,time_in_mins,post_is_original_content,post_name,post_num_comments,post_over_18,post_score,post_has_link,post_spoiler,post_stickied,subreddit_id,subreddit_name,subreddit_subscriber_count,post_title,post_upvote_ratio,post_url
uzdr2t,32051,49220,589,False,t3_uzdr2t,590,False,29885,False,False,False,2x93b,t5_2x93b,6931271,Me winning a free beer by stopping the timer at exactly 10 seconds,0.97,https://v.redd.it/dl4gkbhmn4291
ug4ekc,2973,521271,1220,False,t3_ug4ekc,795,False,134789,False,False,False,2th52,t5_2th52,12184147,🔮WallStreetBets Predictions Tournament for May 2022🔮,0.91,https://reddit.com/r/wallstreetbets/predictions?tournament=tnmt-a2f22025-5448-4d24-ad0c-6cbab5f6f24e
u5ph5l,30019,1250491,1212,False,t3_u5ph5l,600,False,194689,False,False,False,2ubgg,t5_2ubgg,4273625,r/mildlyinfuriating predictions tournament 1 ,0.86,https://reddit.com/r/mildlyinfuriating/predictions?tournament=tnmt-36143315-5a0d-47f6-985a-6bda765137ad
uzbk11,8565,12882,718,False,t3_uzbk11,2504,False,27034,False,False,False,2qh3l,t5_2qh3l,24720451,Federal agents entered Uvalde school to kill gunman despite local police initially asking them to wait,0.97,https://www.nbcnews.com/news/us-news/federal-agents-entered-uvalde-school-kill-gunman-local-police-initiall-rcna30941
uzarv7,102547,12625115,761,False,t3_uzarv7,1304,False,59272,False,False,False,35n7t,t5_35n7t,2536575,A mother did what the police refused to do,0.96,https://i.redd.it/z57kmmg3t3291.jpg
uzahs6,387394,514252,776,False,t3_uzahs6,1027,False,23881,False,False,False,2qm21,t5_2qm21,1512693,Schooling the shitty NRA on 2A,0.9,https://i.imgur.com/aZjgMqr.jpg
uzdgv7,174,15476,607,False,t3_uzdgv7,93,False,7138,False,False,False,2qh03,t5_2qh03,32960605,Lol,0.97,https://i.redd.it/vs2m60imk4291.jpg
uzel84,765,24786,538,False,t3_uzel84,532,False,4912,False,False,False,2qo4s,t5_2qo4s,4801207,[Highlight] Butler hits an insane fadeaway to push the Heat lead to six,0.97,https://streamable.com/oxstox
uz9j83,39502,156806,825,False,t3_uz9j83,1160,False,29748,False,False,False,2qh13,t5_2qh13,28909555,Spanish parliament approves ‘only yes means yes’ consent bill | Spain,0.93,https://www.theguardian.com/world/2022/may/26/spanish-parliament-approves-only-yes-means-yes-consent-bill
uz9pmj,312898,10792926,816,False,t3_uz9pmj,557,False,22074,False,False,False,3gdh7,t5_3gdh7,6850435,"🔥 Bald Eagle swoops in, steals food right out of the mouth of a Gray Wolf.",0.97,https://v.redd.it/4sua7rn1j3291
uz9irt,7442,30436,826,False,t3_uz9irt,1157,False,28783,False,False,False,2qhsa,t5_2qhsa,9717112,Motorcyclist chases after POS driver who fled from a Hit and Run,0.93,https://v.redd.it/kg21qej5h3291
uz88xi,3303,7907,889,False,t3_uz88xi,2870,False,45874,False,False,False,2qnts,t5_2qnts,21410928,Police didn't immediately confront the gunman as Texas school shooting unfolded because they 'could've been shot',0.94,https://www.insider.com/texas-shooting-police-didnt-immediately-confront-gunman-lieutenant-explains-2022-5
uzas7f,215340,54863,761,False,t3_uzas7f,240,False,12109,False,False,False,2szyo,t5_2szyo,24766114,"The definition of a submarine is not a ship that can go underwater, but a ship that can go back up.",0.94,https://www.reddit.com/r/Showerthoughts/comments/uzas7f/the_definition_of_a_submarine_is_not_a_ship_that/
uz87xq,14182,6612,891,False,t3_uz87xq,775,False,25894,False,False,False,2y77d,t5_2y77d,1956998,85 Degree Bakery enabled tips on their point of sale devices. Tips don’t go to workers; you’re just giving the company more money.,0.97,https://i.imgur.com/BQNBUUH.jpg
uz9bud,0,5950,836,True,t3_uz9bud,331,False,32232,False,False,False,2r05i,t5_2r05i,6568399,Stop Motion Animation,0.96,https://v.redd.it/wzllptrmf3291
uz9mud,3670,14121,820,False,t3_uz9mud,273,False,15567,False,False,False,2vegg,t5_2vegg,5813544,me_irl,0.94,https://i.redd.it/zy78vbzji3291.jpg
uz89iz,16197,36650,889,False,t3_uz89iz,1133,False,57547,False,False,False,qir9n,t5_qir9n,3090927,The thin blue line,0.92,https://i.redd.it/8g06ywgd63291.jpg
uz9h9x,232,7485,828,False,t3_uz9h9x,517,False,22937,False,True,False,3i60n,t5_3i60n,2084871,Sadchamp,0.96,https://i.redd.it/hpk5oxx5h3291.gif
uz9ea2,64,8222,833,False,t3_uz9ea2,85,False,16737,False,False,False,3j7rv,t5_3j7rv,1015081,Blessed baby hog :),0.97,https://i.redd.it/geg4ypgeg3291.jpg
uz998s,892,45750,840,False,t3_uz998s,188,False,18890,False,False,False,2w67q,t5_2w67q,6248171,Welcome to the firm,0.9,https://v.redd.it/k8tpakf3f3291
uzar7m,36146,21604,762,False,t3_uzar7m,260,False,7705,False,False,False,2x2oy,t5_2x2oy,6243584,WCGW by grilling next to your siding?,0.98,https://i.redd.it/6eg3ivtxs3291.jpg
uz7wx5,1205,6687,906,False,t3_uz7wx5,407,False,21846,False,False,False,2srr9,t5_2srr9,1348442,Anon had a dad,0.97,https://i.redd.it/c8z9fnle33291.png
uzayml,22871,21432,752,False,t3_uzayml,1279,False,7628,False,False,False,3jj03,t5_3jj03,1798353,Off duty police officer kills his neighbor's dog for the fun of it. (name removed),0.96,https://v.redd.it/u7h9iuguu3291
uz7r2r,335038,8574162,913,False,t3_uz7r2r,1521,False,16938,False,False,False,2qi4s,t5_2qi4s,2232178,Star Wars Jedi: Survivor - Official Teaser,0.95,https://www.youtube.com/watch?v=4HLDaBGdnLc
uz8puy,2881,24749,867,False,t3_uz8puy,302,False,13637,False,False,False,122hf1,t5_122hf1,1373994,Reaching difficult parts of Storm Veil Castle only to find Arteria Leafs ... Classic FromSoft Trolling!,0.97,https://i.redd.it/vfs3qi8u93291.gif
uz6jv0,278,7345,972,False,t3_uz6jv0,753,False,34293,False,False,False,35fmc,t5_35fmc,2315893,Customer is upset that a mattress store won’t… help them move…?,0.96,https://i.redd.it/p1tbj9lnr2291.jpg
uz6jnw,50523,8513804,972,False,t3_uz6jnw,778,False,27497,False,False,False,346d4,t5_346d4,1429722,You had one job,0.97,https://i.redd.it/4w3nsbzlr2291.jpg
uzbkyi,3633,6603,718,False,t3_uzbkyi,108,False,5393,False,False,False,3g3zk,t5_3g3zk,573243,"So, so close.",0.96,https://i.redd.it/efkyou0w04291.jpg
uz97wm,363,5501,845,False,t3_uz97wm,308,False,10704,False,False,False,2uqcm,t5_2uqcm,5502385,Fighting a battle every day. 7 Stone off. [OC] I’m still me 🙏,0.97,https://i.redd.it/miqb5guue3291.jpg
uze15z,3521,181369,573,False,t3_uze15z,836,False,3151,False,False,False,2qiel,t5_2qiel,1428999,The St. Louis Blues have been eliminated from the Stanley Cup Playoffs after losing to the Colorado Avalanche in 6 games.,0.96,https://www.reddit.com/r/hockey/comments/uze15z/the_st_louis_blues_have_been_eliminated_from_the/
uz77gi,28782,204855,940,False,t3_uz77gi,197,False,14707,False,False,False,2tycb,t5_2tycb,16052836,Patrick Stewart in the 70s,0.98,https://i.redd.it/csyhk4a9x2291.jpg
uza06d,62738,786806,802,False,t3_uza06d,135,False,9464,False,False,False,m0bnr,t5_m0bnr,6225902,"He is the chosen one, making it in a single trip",0.97,https://v.redd.it/p135tcxxl3291
uz6r58,9750,157937,962,False,t3_uz6r58,316,False,24756,False,False,False,33x33,t5_33x33,5552231,They also getting natural protein so it’s all good,0.92,https://i.imgur.com/rBxEAJT.jpg
uz9c9r,3299,51208,836,False,t3_uz9c9r,652,False,9555,False,False,False,3aimx,t5_3aimx,3752327,"WILD chase in Paris, France after of a woman hits a man and runs!",0.93,https://v.redd.it/rnom4cs5f3291
uzagvb,3224,9015,778,False,t3_uzagvb,101,False,6881,False,False,False,2xh58,t5_2xh58,3622351,"I helped the lil guys get back to momma, I was worried they’d be forgotten and left.",0.97,https://v.redd.it/uwez2rk3q3291
uzauxi,10878,642573,758,False,t3_uzauxi,325,False,5754,False,False,False,2w844,t5_2w844,2724931,does anyone else stay awake at night because they feel if they go to sleep they lose out on their free time?,0.96,https://www.reddit.com/r/NoStupidQuestions/comments/uzauxi/does_anyone_else_stay_awake_at_night_because_they/
uz6vdu,7243,19518,957,False,t3_uz6vdu,331,False,13821,False,False,False,2qh16,t5_2qh16,12080623,"Democrats ask Apple, Google to prohibit apps from using data mining to target people seeking abortions",0.95,https://thehill.com/policy/technology/3504361-democrats-ask-apple-google-to-prohibit-apps-from-using-data-mining-to-target-people-seeking-abortions/
uzbtuf,4726,16066,705,False,t3_uzbtuf,22,False,4709,False,False,False,3deqz,t5_3deqz,4210087,Free Johnny!!,0.98,https://v.redd.it/1gen54k014291
uzawez,62455,183797,756,False,t3_uzawez,77,False,6515,False,False,False,23gidu,t5_23gidu,385376,topical,0.98,https://i.redd.it/g1ozyh79u3291.gif
uz6gk5,124,6995,976,False,t3_uz6gk5,391,False,20296,False,False,False,2w7mz,t5_2w7mz,5359937,I think I found my dream guy,0.95,https://i.redd.it/xg14ft8iasw31.png
uza571,66216,1698787,795,False,t3_uza571,232,False,6864,False,False,False,r1l2z,t5_r1l2z,1560818,"Thanks, I hate chonky hairless munchkin cats",0.93,https://i.redd.it/b7fonpyzm3291.jpg
uz5ra3,8808,9422,1010,False,t3_uz5ra3,545,False,40394,False,False,False,2sf2b,t5_2sf2b,536582,The worst person you know just had a good take,0.93,https://i.imgur.com/n13gEgi.jpg
uz8mo8,2709,12077,872,False,t3_uz8mo8,625,False,8421,False,False,False,2qh0u,t5_2qh0u,29005759,walkout at my school today (oc),0.92,https://i.redd.it/zf7j7nhk93291.jpg
uz86ge,398626,59102,894,False,t3_uz86ge,962,False,9324,False,False,False,2qm7u,t5_2qm7u,1952834,"[Baggarly] Gabe Kapler told reporters in Cincinnati that he doesn't plan on coming out for the national anthem and that will be his plan going forward ""until I feel better about the direction of our country.""",0.89,https://twitter.com/extrabaggs/status/1530297672187277312?s=21&t=06w0hKXBddaLZERDY0rAXg
uz55cj,123599,1070357,1039,False,t3_uz55cj,651,False,46641,False,False,False,2qh1o,t5_2qh1o,31232991,Door-to-door salesman squeaks at homeowner,0.97,https://v.redd.it/z613vu3mf2291
uz5p9e,4927,19733,1013,False,t3_uz5p9e,641,False,44445,False,False,False,2qh7a,t5_2qh7a,20692646,"Swat team, me, digital, 2017",0.86,https://i.redd.it/admxbrick2291.jpg
uz4zue,62596,71243,1047,False,t3_uz4zue,223,False,21305,False,False,False,39qgx,t5_39qgx,769478,I’m not surprised but somehow still disappointed.,0.96,https://i.redd.it/6q53v596e2291.gif
uz8zru,424,3966,854,False,t3_uz8zru,301,False,7404,False,False,False,2wb7y,t5_2wb7y,1082763,you. can't. fix. shane.,0.95,https://i.redd.it/dc0qp6guc3291.png
uzdiaq,21,2320,606,False,t3_uzdiaq,11,False,2704,False,False,False,3bd7e,t5_3bd7e,1307494,Fox Going Fast,0.99,https://i.redd.it/t7ws4ukojd221.jpg
uz7ukx,387,18198,910,False,t3_uz7ukx,79,False,7610,False,False,False,2sbq3,t5_2sbq3,22087629,"Found a dead tree...used it for a frame. ""Crater in the Woods"" - Crater Lake National Park @JeremyVeselyPhotography [1368x2048] [OC]",0.98,https://i.redd.it/py8ypbjb23291.png
uz8gjf,21282,89315,880,False,t3_uz8gjf,51,False,10228,False,False,False,2zmfe,t5_2zmfe,5630859,F ...,0.99,https://i.redd.it/qe4qat3083291.gif
uzc822,1508,8213,682,False,t3_uzc822,133,False,3337,False,False,False,3h47q,t5_3h47q,3953050,Last day of work at a theater means it's big screen Mario Kart time,0.96,https://www.reddit.com/gallery/uzc822
uz8d97,6909,268592,885,False,t3_uz8d97,101,False,11371,False,False,False,2qjpg,t5_2qjpg,19055022,Hentai logic,0.97,https://v.redd.it/xuo3dmx673291
uz6ylp,17224,28995,953,False,t3_uz6ylp,352,False,12084,False,False,False,2yo6b,t5_2yo6b,2324700,This tick that I picked up because I thought it was a rock…,0.97,https://i.redd.it/23isx565v2291.jpg
uzbv01,799,3293,703,False,t3_uzbv01,135,False,3511,False,False,False,2rn7o,t5_2rn7o,942647,Pretty sure I’ve bought a few outfits here.,0.98,https://i.redd.it/pq8r4i5m34291.jpg
uz71tb,13673,22235,949,False,t3_uz71tb,767,False,12825,False,False,False,43zwn1,t5_43zwn1,787816,Lurking as well. Also I just shook his hand. He's still in Montreal 🤫,0.9,https://i.redd.it/ppddlqowv2291.jpg
uz52rq,16459,293683,1043,False,t3_uz52rq,203,False,19526,False,False,False,3gcwj,t5_3gcwj,11472909,Mental health days are ok.,0.95,https://i.redd.it/upc4n28ze2291.jpg
uzcla0,1366,55401,661,False,t3_uzcla0,269,False,3007,False,False,False,2s5ti,t5_2s5ti,1743976,meirl,0.9,https://i.redd.it/gpu5upi8b4291.jpg
uz7do0,15954,4811,933,False,t3_uz7do0,175,False,7739,False,False,False,2qh33,t5_2qh33,40806445,"[OC] Apparently my robot vacuum is on strike. Found it in the bathroom, where it used the doorjamb to shut itself off.",0.98,https://i.redd.it/ia9qnd0ty2291.jpg
uz451s,395,56839,1089,False,t3_uz451s,2477,False,40481,False,False,False,2yrq6,t5_2yrq6,4020396,Huge protest outside of the NRA convention in Houston. It's growing by the hour. There's gonna be more protesters than attendees.,0.86,https://v.redd.it/qxc2aaqb62291
uz3lpv,864,60673,1114,False,t3_uz3lpv,1445,False,38353,False,False,False,2cneq,t5_2cneq,8062523,Greg Abbott Is Full of Shit,0.9,https://www.texasobserver.org/greg-abbott-uvalde-shooting/
uz7332,17288,4661796,947,False,t3_uz7332,66,False,8575,False,False,False,mbn0j,t5_mbn0j,971097,Meirl,0.98,https://i.imgur.com/Hsy5VkB.jpeg
uzaprk,5275,13949,766,False,t3_uzaprk,42,False,4008,False,False,False,2v0i1,t5_2v0i1,1137728,When someone enters the bathroom after you and you hear their cries at the bomb you dropped in there.,0.96,https://i.redd.it/cwh19chks3291.gif
uza83h,27600,301835,792,False,t3_uza83h,1302,False,4656,False,False,False,swxxz,t5_swxxz,1468446,can’t make this up,0.86,https://i.redd.it/txdf09fzn3291.jpg
uz7dtz,452589,3046188,933,False,t3_uz7dtz,515,False,7269,False,True,False,2uii8,t5_2uii8,2601378,Official Stills of SPOILER Characters in 'Doctor Strange in the Multiverse of Madness',0.95,https://www.reddit.com/gallery/uz7dtz
uz7yh1,55061,9346,905,False,t3_uz7yh1,494,False,6189,False,False,False,2qgzy,t5_2qgzy,20212789,NY Yankees will broadcast gun violence facts instead of their game w/ the TB Rays,0.89,https://twitter.com/yankees/status/1529955869428965379?s=21&t=Wq5h2ynnxxDpLZt66fjyqg
uz5qub,17288,4661808,1012,False,t3_uz5qub,172,False,13359,False,False,False,2r5rp,t5_2r5rp,6278200,"""WhY RiGhT nOw?""",0.97,https://i.imgur.com/YOg1rVt.jpg
uzaguw,314910,232599,779,False,t3_uzaguw,122,False,3878,False,False,False,p3r73,t5_p3r73,536150,"Ask your dates if they support the right to choose, ask who they voted for, ask if they believe in equal rights for all. Boycott shitty people",0.97,https://i.imgur.com/rhdbWCL.jpg
uz6awl,346017,98911,985,True,t3_uz6awl,233,False,8449,False,False,False,3boqz,t5_3boqz,2124647,"Josh is on the grill until 11:55, so stop pestering him and do your station!",0.94,https://www.reddit.com/r/MaliciousCompliance/comments/uz6awl/josh_is_on_the_grill_until_1155_so_stop_pestering/
uz8q4b,9412,184533,868,False,t3_uz8q4b,206,False,5659,False,False,False,2s7tt,t5_2s7tt,9493373,What it's like in America right now.,0.87,https://i.redd.it/dumgdvfea3291.jpg
uz6lbt,17288,4661822,971,False,t3_uz6lbt,32,False,8063,False,False,False,2s427,t5_2s427,3422946,doggo tried so hard to resist,0.98,https://i.imgur.com/H5iZCvB.gifv
uz6xvt,47,6385,955,False,t3_uz6xvt,152,False,8143,False,False,False,38e1l,t5_38e1l,1908253,Maybe Maybe Maybe,0.94,https://v.redd.it/17s2qdoct2291
uz9uqg,46558,4004,811,False,t3_uz9uqg,51,False,3856,False,False,False,2tluu,t5_2tluu,831212,"2 year, 110 lbs lost so far.",0.98,https://i.redd.it/eprowu2kk3291.jpg
uz4eg0,119,5156,1077,False,t3_uz4eg0,1447,False,13351,False,False,False,2qh1e,t5_2qh1e,26441488,"That ""IT'S MORBIN TIME"" scene",0.91,https://youtu.be/OPaCXU4mwR8
uz8935,15544,61141,891,False,t3_uz8935,1330,False,74623,False,False,False,35n7t,t5_35n7t,2536576,Cops don't help,0.92,https://i.redd.it/hmyphrd963291.jpg
uz3lgv,53702,380685,1115,False,t3_uz3lgv,488,False,21872,False,False,False,5r98w,t5_5r98w,1333968,Fuck the Christian Karens that post bullshit like this in response to children being murdered by mass shootings.,0.89,https://i.imgur.com/sx2nTNS.jpg
uz7tuo,218824,9414853,911,False,t3_uz7tuo,432,False,5383,False,False,False,mouw,t5_mouw,27549082,Many attendees of gatherings like Burning Man report “transformative experiences”. People who reported these experiences also reported feeling more socially connected with all human beings. Transformative experiences and their prosocial feelings persisted at least six months.,0.93,https://www.eurekalert.org/news-releases/954182
uz5xfm,175,4590,1003,False,t3_uz5xfm,63,False,8300,False,False,False,2ro2c,t5_2ro2c,1760240,Pretty Much🤣,0.98,https://i.redd.it/pba1fe7bm2291.jpg
uz9ln8,3291,2623,824,False,t3_uz9ln8,508,False,4320,False,False,False,2xcv7,t5_2xcv7,2795913,Two pizzas I bought to bake in my hotel that has no oven,0.89,https://i.redd.it/4p4i16p8i3291.jpg
uzawxq,91036,69628,756,False,t3_uzawxq,61,False,3135,False,False,False,38iwx,t5_38iwx,1998256,This was from 2015 in my home town but I never not laugh at this.,0.97,https://i.redd.it/0cvq5z9fu3291.jpg
uz39fi,17288,4661858,1131,False,t3_uz39fi,524,False,21278,False,False,False,3k2t0,t5_3k2t0,2210342,Showing off in the middle of the road,0.97,https://v.redd.it/hisd9cnjz1291
uz7wjk,60252,6782,908,False,t3_uz7wjk,3943,False,44567,False,False,False,2qh3l,t5_2qh3l,24720455,Uvalde school police chief identified as commander who decided not to breach classroom,0.95,https://www.cnn.com/us/live-news/texas-elementary-school-shooting-05-27-22/h_aabca871ba934fa48726a8d5e5c12eac
uzer8z,400273,22904,529,False,t3_uzer8z,687,False,3664,False,False,False,2qo4s,t5_2qo4s,4801214,"Jimmy Butler with a huge bounce-back performance to stave off elimination in G6: 47 points on 16/29 shooting, 9 assists, 8 rebounds, 4 steals and a block",0.98,https://www.reddit.com/r/nba/comments/uzer8z/jimmy_butler_with_a_huge_bounceback_performance/
uzdrzr,925,6087,591,False,t3_uzdrzr,935,False,1880,False,False,False,2xxyj,t5_2xxyj,5086004,If Guns Were As Regulated As Cars,0.85,https://i.redd.it/qarw1gpwn4291.jpg
uz6zbi,53217,48046,953,False,t3_uz6zbi,426,False,5900,False,False,False,2eempv,t5_2eempv,50058,Johnny Depp and Judy (the stenographer) ❤️,0.89,https://i.redd.it/03fo4j6av2291.jpg
uz9d1g,2622,4797,837,False,t3_uz9d1g,723,False,4594,False,False,False,2usxq,t5_2usxq,1625088,reddit,0.94,https://i.redd.it/cg62hx31g3291.png
uz7n9z,17288,4661881,920,False,t3_uz7n9z,356,False,4996,False,False,False,2u0zn,t5_2u0zn,351471,autism and adhd awareness,0.96,https://i.imgur.com/xPMSmnd.jpeg
uz2dbi,6650,15563,1173,False,t3_uz2dbi,877,False,20608,False,False,False,2s5oq,t5_2s5oq,20598900,LPT: Raise your hand to admit your mistake if you make a driving error. The huge majority of the time it will diminish any potential road rage from the other driver.,0.92,https://www.reddit.com/r/LifeProTips/comments/uz2dbi/lpt_raise_your_hand_to_admit_your_mistake_if_you/
uz2n3r,138302,14470,1160,False,t3_uz2n3r,1337,False,17138,False,False,False,2to41,t5_2to41,17962417,TIFU: by thinking peanut butter was supposed to be spicy,0.95,https://www.reddit.com/r/tifu/comments/uz2n3r/tifu_by_thinking_peanut_butter_was_supposed_to_be/
uz9eny,7448,30488,835,False,t3_uz9eny,319,False,3527,False,False,False,2qh61,t5_2qh61,6813281,Motorcyclist chases after POS driver who fled from a Hit and Run,0.92,https://v.redd.it/1hazmnjlf3291
uz4g5r,674,4668,1075,False,t3_uz4g5r,287,False,8220,False,False,False,2r9vp,t5_2r9vp,1856787,"Another bust in Texas, 30 years to life",0.96,https://i.redd.it/tzhknzgl92291.jpg
uz6qw2,1211,18622,965,False,t3_uz6qw2,320,False,5636,False,False,False,msyp9,t5_msyp9,692402,[France] POS runs over a pedestrian and tries to get away,0.93,https://v.redd.it/97c14719t2291
uz1zfw,2403,59744,1191,False,t3_uz1zfw,141,False,26806,False,False,False,2xbrg,t5_2xbrg,5002872,Life do be like that sometimes,0.97,https://v.redd.it/bvevllwxo1291
uz37k6,310,136349,1134,False,t3_uz37k6,162,False,18540,False,False,False,3nasz,t5_3nasz,1880616,Why walk when you can fly,0.9,https://v.redd.it/3f0mz5zsy1291
uz25w0,131466,843512,1183,False,t3_uz25w0,284,False,22219,False,False,False,35g8o,t5_35g8o,993865,It was worth a shot.,0.96,https://i.imgur.com/jrI9Woq.jpg
uz94vt,2188,15648,848,False,t3_uz94vt,89,False,3522,False,False,False,jzp47,t5_jzp47,577529,"Obviously, I’m starving her….",0.98,https://v.redd.it/75uoc443e3291
uz4aio,16560,2157799,1083,False,t3_uz4aio,82,False,9571,False,False,False,363r3,t5_363r3,3646557,This is so dope.,0.94,https://v.redd.it/nk32458882291
uz7irk,16091,35325,927,False,t3_uz7irk,1035,False,5264,False,False,False,2sgp1,t5_2sgp1,6125926,After an incredible amount of support & feedback from this sub I've determined it's time to Ascend and FINALLY rename my game. The comment on this post suggesting a name (that is LESS offensive / lawsuit inviting than SuperTHOT) with the most upvotes will be it.,0.91,https://v.redd.it/xq62yoppz2291
uzccyv,8244,1092,676,False,t3_uzccyv,258,False,1975,False,False,False,2sljg,t5_2sljg,632247,Congratulations to Andrade and Charlotte on their marriage,0.96,https://i.redd.it/fur5m4u584291.jpg
uz8sdu,1338,4026,865,False,t3_uz8sdu,59,False,3795,False,False,False,3538a,t5_3538a,834875,This is the only rule for r/soda,0.98,https://i.redd.it/qi98i001b3291.jpg
uz402g,7881,97263,1097,False,t3_uz402g,959,False,10126,False,False,False,3ipa1,t5_3ipa1,545886,They Were Afraid Of Getting Shot At...,0.93,https://i.imgur.com/5SoDbwW.jpg
uz2y5f,983,11801,1146,False,t3_uz2y5f,720,False,19339,False,False,False,3cs2l,t5_3cs2l,237988,#killyourlawn,0.83,https://i.redd.it/1xm1upryw1291.jpg
uz52k2,270950,751739,1045,False,t3_uz52k2,147,False,8858,False,False,False,29numb,t5_29numb,768794,I drew Mumei and Gura!,0.91,https://i.redd.it/5hcj5wvxe2291.jpg
uz4fl3,862,4686,1076,False,t3_uz4fl3,343,False,8591,False,False,False,3ptyd,t5_3ptyd,1457589,He's amazing,0.94,https://v.redd.it/qsgdg8od92291
uzb8vc,168433,180023,738,False,t3_uzb8vc,134,False,2377,False,False,False,2rfz5,t5_2rfz5,1108166,"On this day 10 years ago, Luffy & Law officially formed Straw Hat-Heart Alliance (Chapter 668)",0.98,https://i.redd.it/w9rh5j3hx3291.jpg
uzctl8,9234,23202,649,False,t3_uzctl8,75,False,1758,False,False,False,37lnk,t5_37lnk,101561,Never forget what we're fighting for,0.95,https://i.redd.it/awzw5jsmd4291.png
uzalf8,77411,78876,774,False,t3_uzalf8,6,False,2717,False,False,False,2r7hk,t5_2r7hk,1166214,Happy Fat Bear Friday.,1.0,https://i.imgur.com/DSKvtQi.jpg
uz5lra,70335,11118223,1020,False,t3_uz5lra,526,False,6588,False,False,False,xkt2h,t5_xkt2h,284712,This is what a Democratic majority has accomplished:,0.81,https://i.redd.it/62yz6tq7j2291.png
uz0yl9,2885,24765,1238,True,t3_uz0yl9,234,False,37976,False,False,False,2tex6,t5_2tex6,1998683,Rest with a Soap Bath,0.96,https://i.redd.it/so9lm8wmg1291.gif
uz6t8e,12588,31922,962,False,t3_uz6t8e,47,False,5031,False,False,False,3g7ta,t5_3g7ta,1131663,Arthur writes this,0.96,https://i.redd.it/drcawr7vt2291.jpg
uz3xpd,2169,58882,1100,False,t3_uz3xpd,231,False,9880,False,False,False,2u2bh,t5_2u2bh,3835876,What you say?,0.9,https://v.redd.it/78j0q8r852291
uz4i2i,5338,13524,1073,False,t3_uz4i2i,79,False,7552,False,False,False,3frqi,t5_3frqi,868714,Birb,0.98,https://v.redd.it/z5s2ekc1a2291
uz36pn,319,14024,1136,False,t3_uz36pn,182,False,13556,False,False,False,3948y,t5_3948y,2932140,The kid: it's train time 😁,0.95,https://v.redd.it/mfphpmooy1291
uz0hdz,3183,16617,1261,True,t3_uz0hdz,615,False,45226,False,False,False,2ti4h,t5_2ti4h,19965063,A park bench that can fold to a table,0.94,https://i.redd.it/p26vjr6lc1291.jpg
uz7cdx,5064,213109,936,False,t3_uz7cdx,164,False,4416,False,False,True,2vxxc,t5_2vxxc,1917776,Motorcyclist chases after POS driver who fled from a Hit and Run,0.93,https://v.redd.it/xyfi4t7p12291
uz1urs,1793,18819,1198,False,t3_uz1urs,75,False,16585,False,False,False,2qhm7,t5_2qhm7,869838,LEGO Dwebble & Crustle from Pokémon,0.97,https://i.redd.it/h6738dgun1291.jpg
uz6rk7,1681,2801,964,False,t3_uz6rk7,734,False,6515,False,False,False,2rjli,t5_2rjli,2802887,My mom just told me I’m gonna be a school shooter because I’m introverted and I play fps games 🫥,0.94,https://www.reddit.com/r/teenagers/comments/uz6rk7/my_mom_just_told_me_im_gonna_be_a_school_shooter/
uz8hxo,300,1717,881,False,t3_uz8hxo,33,False,3425,False,False,False,2qqjc,t5_2qqjc,27703138,"TIL that in 1889 the US Congress created a committee with two members known as the ""Committee on Disposition of Useless Executive Papers."" Its job was to discard papers both members agreed weren't important and report why they weren't important. This later was replaced by the National Archives.",0.98,https://history.house.gov/Blog/2019/July/7-9-WasteBasket/
uz8fag,4201,12932,884,False,t3_uz8fag,69,False,3525,False,False,False,3ndbi,t5_3ndbi,580295,i have my reasons,0.99,https://i.redd.it/ueru6e0q63291.gif
uz5ds3,15291,34409,1031,True,t3_uz5ds3,74,False,5712,False,False,False,2qh55,t5_2qh55,22522164,[Homemade] Pizza,0.97,https://i.redd.it/e62ha6cih2291.jpg
uz7wfi,17288,4661990,910,False,t3_uz7wfi,218,False,4084,False,False,False,45hae8,t5_45hae8,875067,Lady gets what she deserves,0.91,https://i.imgur.com/C78ZJWy.gifv
uzd4np,1011,8883,631,False,t3_uzd4np,199,False,1502,False,False,False,2qh7q,t5_2qh7q,211455,Nikki Fried,0.91,https://i.redd.it/m9aq071yg4291.jpg
uz96pj,1673,4456,847,False,t3_uz96pj,36,False,3033,False,False,False,3nbbq,t5_3nbbq,1282201,Yamaha. Creator of all,0.98,https://i.redd.it/f4pj7ni9gz191.png
uz626e,29421,6883,998,False,t3_uz626e,1352,False,45540,False,False,False,2y77d,t5_2y77d,1957002,Cops trying to join the movement.,0.92,https://i.redd.it/zsbadixgn2291.jpg
uz6iz0,12834,34843,976,False,t3_uz6iz0,152,False,4443,False,False,False,313fb,t5_313fb,2439684,"""Then we will fight in the shade"" - actual arrowheads from the Battle of Thermopylae [3024 x 4032]",0.98,https://i.redd.it/qi3w8bifr2291.jpg
uz2o1q,3745,478379,1160,False,t3_uz2o1q,222,False,14761,False,False,False,3pzez,t5_3pzez,2067515,Is she not swimming?,0.96,https://i.redd.it/epqqyveou1291.jpg
uz3p84,614,6833,1111,False,t3_uz3p84,49,False,8073,False,False,False,2yb9w,t5_2yb9w,1385184,"""Bro, come check out this creature""",0.98,https://v.redd.it/e0fsueab32291
